source,citation,relation,ID,title,authors,journal,year,fulltext_online_link,fulltext_location
10.1136~thx.2009.130799," http://thorax.bmj.com/content/65/6/510.full.html#related-urls Article cited in: http://thorax.bmj.com/content/65/6/510.full.html#ref-list-1 This article cites 45 articles, 10 of which can be accessed free at: service Email alerting the box at the top right corner of the online article. Receive free email alerts when new articles cite this article. Sign up in Collections Topic",references,NOT found in MAS
10.1136~thx.2009.130799,Pneumonia (respiratory medicine),references,NOT found in MAS
10.1136~thx.2009.130799,Pneumonia (infectious disease),references,10.1146/annurev.nutr.23.011702.073054,ZINC AND THE RISK FOR INFECTIOUS DISEASE,"[[u'Christa', u'Fischer', u'Walker'], [u'Robert', u'E.', u'Black']]",Annual Review of Nutrition,2004,"[u'http://www.idpas.org/pdf/2523ZincandtheRiskforInfectiousDisease.pdf', u'http://www.psp-one.com/files/5366_file_Walker_and_Black._Zinc_and_risk_for_infectious_disease.pdf', u'http://arjournals.annualreviews.org/doi/abs/10.1146%2Fannurev.nutr.23.011702.073054']","[{u'Name': u'Child Mortality', u'PublicationCount': 0, u'__type': u'Keyword:http://research.microsoft.com', u'CitationCount': 0, u'ID': 5534}, {u'Name': u'Common Cold', u'PublicationCount': 0, u'__type': u'Keyword:http://research.microsoft.com', u'CitationCount': 0, u'ID': 6582}, {u'Name': u'Immune Function', u'PublicationCount': 0, u'__type': u'Keyword:http://research.microsoft.com', u'CitationCount': 0, u'ID': 19200}, {u'Name': u'Infectious Disease', u'PublicationCount': 0, u'__type': u'Keyword:http://research.microsoft.com', u'CitationCount': 0, u'ID': 19718}, {u'Name': u'Tuberculosis', u'PublicationCount': 0, u'__type': u'Keyword:http://research.microsoft.com', u'CitationCount': 0, u'ID': 43064}, {u'Name': u'Zinc', u'PublicationCount': 0, u'__type': u'Keyword:http://research.microsoft.com', u'CitationCount': 0, u'ID': 45699}, {u'Name': u'Zinc Deficient', u'PublicationCount': 0, u'__type': u'Keyword:http://research.microsoft.com', u'CitationCount': 0, u'ID': 45701}]"
10.1146/annurev.nutr.23.011702.073054,"Black, R., Allen, L., Bhutta, Z., et. al, Maternal and child undernutrition: global and regional exposures and health consequences, Lancet, 2008",cited-by,10.1016/S0140-6736(07)61690-0,Maternal and child undernutrition: global and regional exposures and health consequences,"[['Robert', 'E', 'Black'], ['Lindsay', 'H', 'Allen'], ['Zulfiqar', 'A', 'Bhutta'], ['Laura', 'E', 'Caulfield'], ['Mercedes', 'de', 'Onis'], ['Majid', '', 'Ezzati'], ['Colin', '', 'Mathers'], ['Juan', '', 'Rivera']]",Lancet,2008,"[u'http://www.sciencedirect.com/science/article/pii/S0140673607616900', u'http://linkinghub.elsevier.com/retrieve/pii/S0140673607616900']",
10.1146/annurev.nutr.23.011702.073054,"Sazawal, S., Hiremath, G., Dhingra, U., et. al, Efficacy of probiotics in prevention of acute diarrhoea: a meta-analysis of masked, randomised, placebo-controlled trials, Lancet Infectious Diseases, 2006",cited-by,10.1016/S1473-3099(06)70495-9,"Efficacy of probiotics in prevention of acute diarrhoea: a meta-analysis of masked, randomised, placebo-controlled trials","[['Sunil', '', 'Sazawal'], ['Girish', '', 'Hiremath'], ['Usha', '', 'Dhingra'], ['Pooja', '', 'Malik'], ['Saikat', '', 'Deb'], ['Robert', 'E', 'Black']]",Lancet Infectious Diseases,2006,"[u'http://www.sciencedirect.com/science/article/pii/S1473309906704959', u'http://linkinghub.elsevier.com/retrieve/pii/S1473309906704959']",
10.1146/annurev.nutr.23.011702.073054,"Maret, W., Sandstead, H., , Zinc requirements and the risks and benefits of zinc supplementation, Journal of Trace Elements in Medicine and Biology, 2006",cited-by,10.1016/j.jtemb.2006.01.006,Zinc requirements and the risks and benefits of zinc supplementation,"[['Wolfgang', '', 'Maret'], ['Harold', 'H.', 'Sandstead']]",Journal of Trace Elements in Medicine and Biology,2006,"[u'http://www.sciencedirect.com/science/article/pii/S0946672X06000411', u'http://linkinghub.elsevier.com/retrieve/pii/S0946672X06000411']",
10.1146/annurev.nutr.23.011702.073054,"Wintergerst, E., Maggini, S., Hornig, D., , Contribution of Selected Vitamins and Trace Elements to Immune Function, Annals of Nutrition and Metabolism, 2007",cited-by,10.1159/000107673,Contribution of Selected Vitamins and Trace Elements to Immune Function,"[['Eva', 'S.', 'Wintergerst'], ['Silvia', '', 'Maggini'], ['Dietrich', 'H.', 'Hornig']]",Annals of Nutrition and Metabolism,2007,"[u'http://content.karger.com/ProdukteDB/produkte.asp?doi=10.1159/000107673', u'http://www.karger.com/doi/10.1159/000107673']",
10.1146/annurev.nutr.23.011702.073054,"Royet, J., Dziarski, R., , Peptidoglycan recognition proteins: pleiotropic sensors and effectors of antimicrobial defences, Nature Reviews Microbiology, 2007",cited-by,10.1038/nrmicro1620,Peptidoglycan recognition proteins: pleiotropic sensors and effectors of antimicrobial defences,"[['Julien', '', 'Royet'], ['Roman', '', 'Dziarski']]",Nature Reviews Microbiology,2007,"[u'http://www.nature.com/doifinder/10.1038/nrmicro1620', u'http://dx.doi.org/10.1038/nrmicro1620']",
10.1146/annurev.nutr.23.011702.073054,"Bobat, R., Coovadia, H., Stephen, C., et. al, Safety and efficacy of zinc supplementation for children with HIV1 infection in South Africa: a randomised double-blind placebo-controlled trial, Lancet, 2005",cited-by,10.1016/S0140-6736(05)67756-2,Safety and efficacy of zinc supplementation for children with HIV1 infection in South Africa: a randomised double-blind placebo-controlled trial,"[['Raziya', '', 'Bobat'], ['Hoosen', '', 'Coovadia'], ['Cindy', '', 'Stephen'], ['Kimesh', 'L', 'Naidoo'], ['Neil', '', 'McKerrow'], ['Robert', 'E', 'Black'], ['William', 'J', 'Moss']]",Lancet,2005,"[u'http://www.sciencedirect.com/science/article/pii/S0140673605677562', u'http://linkinghub.elsevier.com/retrieve/pii/S0140673605677562']",
10.1146/annurev.nutr.23.011702.073054,"Kitamura, H., Morikawa, H., Kamon, H., et. al, Toll-like receptor–mediated regulation of zinc homeostasis influences dendritic cell function, Nature Immunology, 2006",cited-by,10.1038/ni1373,Toll-like receptor–mediated regulation of zinc homeostasis influences dendritic cell function,"[['Hidemitsu', '', 'Kitamura'], ['Hideyuki', '', 'Morikawa'], ['Hokuto', '', 'Kamon'], ['Megumi', '', 'Iguchi'], ['Shintaro', '', 'Hojyo'], ['Toshiyuki', '', 'Fukada'], ['Susumu', '', 'Yamashita'], ['Tsuneyasu', '', 'Kaisho'], ['Shizuo', '', 'Akira'], ['Masaaki', '', 'Murakami'], ['Toshio', '', 'Hirano']]",Nature Immunology,2006,"[u'http://www.nature.com/doifinder/10.1038/ni1373', u'http://dx.doi.org/10.1038/ni1373']",
10.1146/annurev.nutr.23.011702.073054,"Wintergerst, E., Maggini, S., Hornig, D., , Immune-Enhancing Role of Vitamin C and Zinc and Effect on Clinical Conditions, Annals of Nutrition and Metabolism, 2006",cited-by,10.1159/000090495,Immune-Enhancing Role of Vitamin C and Zinc and Effect on Clinical Conditions,"[['Eva', 'S.', 'Wintergerst'], ['Silvia', '', 'Maggini'], ['Dietrich', 'H.', 'Hornig']]",Annals of Nutrition and Metabolism,2006,"[u'http://www.karger.com/doi/10.1159/000090495', u'http://content.karger.com/ProdukteDB/produkte.asp?doi=10.1159/000090495']",
10.1146/annurev.nutr.23.011702.073054,"Thompson, R., , Studying zinc biology with fluorescence: ain’t we got fun?, Current Opinion in Chemical Biology, 2005",cited-by,10.1016/j.cbpa.2005.08.020,Studying zinc biology with fluorescence: ain’t we got fun?,"[['Richard', 'B', 'Thompson']]",Current Opinion in Chemical Biology,2005,"[u'http://www.sciencedirect.com/science/article/pii/S1367593105001183', u'http://linkinghub.elsevier.com/retrieve/pii/S1367593105001183']",
10.1146/annurev.nutr.23.011702.073054,"Hoque, K., Binder, H., , Zinc in the Treatment of Acute Diarrhea: Current Status and Assessment, Gastroenterology, 2006",cited-by,10.1053/j.gastro.2006.02.062,Zinc in the Treatment of Acute Diarrhea: Current Status and Assessment,"[['Kazi', 'Mirajul', 'Hoque'], ['Henry', 'J.', 'Binder']]",Gastroenterology,2006,"[u'http://www.sciencedirect.com/science/article/pii/S001650850600744X', u'http://linkinghub.elsevier.com/retrieve/pii/S001650850600744X', u'http://www.sepeap.org/archivos/pdf/10733.pdf']",
10.1146/annurev.nutr.23.011702.073054,"Prasad, A., , Zinc: role in immunity, oxidative stress and chronic inflammation, Current Opinion in Clinical Nutrition and Metabolic Care, 2009",cited-by,10.1097/MCO.0b013e3283312956,"Zinc: role in immunity, oxidative stress and chronic inflammation","[['Ananda', 'S', 'Prasad']]",Current Opinion in Clinical Nutrition and Metabolic Care,2009,[u'http://content.wkhealth.com/linkback/openurl?sid=WKPTLP:landingpage&an=00075197-200911000-00016'],
10.1146/annurev.nutr.23.011702.073054,"Sazawal, S., Dhingra, U., Dhingra, P., et. al, Effects of fortified milk on morbidity in young children in north India: community based, randomised, double masked placebo controlled trial, British Medical Journal, 2007",cited-by,10.1136/bmj.39035.482396.55,"Effects of fortified milk on morbidity in young children in north India: community based, randomised, double masked placebo controlled trial","[['Sunil', '', 'Sazawal'], ['Usha', '', 'Dhingra'], ['Pratibha', '', 'Dhingra'], ['Girish', '', 'Hiremath'], ['Jitendra', '', 'Kumar'], ['Archana', '', 'Sarkar'], ['Venugopal', 'P', 'Menon'], ['Robert', 'E', 'Black']]",British Medical Journal,2007,"[u'http://dx.doi.org/10.1136/bmj.39035.482396.55', u'http://www.bmj.com/cgi/doi/10.1136/bmj.39035.482396.55']",
10.1146/annurev.nutr.23.011702.073054,"Haase, H., Overbeck, S., Rink, L., , Zinc supplementation for the treatment or prevention of disease: Current status and future perspectives, Experimental Gerontology, 2008",cited-by,10.1016/j.exger.2007.12.002,Zinc supplementation for the treatment or prevention of disease: Current status and future perspectives,"[['Hajo', '', 'Haase'], ['Silke', '', 'Overbeck'], ['Lothar', '', 'Rink']]",Experimental Gerontology,2008,"[u'http://www.sciencedirect.com/science/article/pii/S0531556507002987', u'http://linkinghub.elsevier.com/retrieve/pii/S0531556507002987']",
10.1146/annurev.nutr.23.011702.073054,"Sazawal, S., Dhingra, U., Hiremath, G., et. al, Effects of fortified milk on morbidity in young children in north India: community based, randomised, double masked placebo controlled trial, , 2006",cited-by,"6518264Effects of fortified milk on morbidity in young children in north India: community based, randomised, double masked placebo controlled trial","Effects of fortified milk on morbidity in young children in north India: community based, randomised, double masked placebo controlled trial","[['Sunil', '', 'Sazawal'], ['Usha', '', 'Dhingra'], ['Girish', '', 'Hiremath'], ['Jitendra', '', 'Kumar'], ['Pratibha', '', 'Dhingra'], ['Archana', '', 'Sarkar'], ['Venugopal', 'P', 'Menon'], ['Robert', 'E', 'Black']]",,2006,"[u'http://www.bmj.com/cgi/reprint/334/7585/140.pdf', u'http://www.bmj.com/cgi/rapidpdf/bmj.39035.482396.55v1.pdf']",
10.1146/annurev.nutr.23.011702.073054,"Orth, G., , Host Defenses Against Human Papillomaviruses: Lessons from Epidermodysplasia Verruciformis, , 0",cited-by,10.1007/978-3-540-75203-5_3,Host Defenses Against Human Papillomaviruses: Lessons from Epidermodysplasia Verruciformis,"[['G.', '', 'Orth']]",,0,"[u'http://www.springerlink.com/index/u3075246p1673589.pdf', u'http://www.springerlink.com/content/u3075246p1673589']",
10.1146/annurev.nutr.23.011702.073054,"Aydemir, T., Liuzzi, J., McClellan, S., et. al, Zinc transporter ZIP8 (SLC39A8) and zinc influence IFN  expression in activated human T cells, Journal of Leukocyte Biology, 2009",cited-by,10.1189/jlb.1208759,Zinc transporter ZIP8 (SLC39A8) and zinc influence IFN  expression in activated human T cells,"[['Tolunay', 'B.', 'Aydemir'], ['Juan', 'P.', 'Liuzzi'], ['Steve', '', 'McClellan'], ['Robert', 'J.', 'Cousins']]",Journal of Leukocyte Biology,2009,"[u'http://www.jleukbio.org/cgi/rapidpdf/jlb.1208759v1.pdf', u'http://www.jleukbio.org/cgi/doi/10.1189/jlb.1208759']",
10.1146/annurev.nutr.23.011702.073054,"Turner, P., Collinson, A., Cheung, Y., et. al, Aflatoxin exposure in utero causes growth faltering in Gambian infants, , 0",cited-by,10454651Aflatoxin exposure in utero causes growth faltering in Gambian infants,Aflatoxin exposure in utero causes growth faltering in Gambian infants,"[['Paul', 'C', 'Turner'], ['Andrew', 'C', 'Collinson'], ['Yin', 'Bun', 'Cheung'], ['YunYun', '', 'Gong'], ['Andrew', 'J', 'Hall'], ['Andrew', 'M', 'Prentice'], ['Christopher', 'P', 'Wild']]",,0,[u'http://ije.oxfordjournals.org/cgi/reprint/36/5/1119.pdf'],
10.1146/annurev.nutr.23.011702.073054,"Szewczyk, B., Kubera, M., Nowak, G., , The role of zinc in neurodegenerative inflammatory pathways in depression, Progress in Neuro-psychopharmacology & Biological Psychiatry, 2011",cited-by,10.1016/j.pnpbp.2010.02.010,The role of zinc in neurodegenerative inflammatory pathways in depression,"[['Bernadeta', '', 'Szewczyk'], ['Marta', '', 'Kubera'], ['Gabriel', '', 'Nowak']]",Progress in Neuro-psychopharmacology & Biological Psychiatry,2011,"[u'http://www.sciencedirect.com/science/article/pii/S0278584610000576', u'http://linkinghub.elsevier.com/retrieve/pii/S0278584610000576']",
10.1146/annurev.nutr.23.011702.073054,"Bell, R., , Micronutrients for Sustainable Food, Feed, Fibre and Bioenergy Production, , 2008",cited-by,"14065362Micronutrients for Sustainable Food, Feed, Fibre and Bioenergy Production","Micronutrients for Sustainable Food, Feed, Fibre and Bioenergy Production","[['R.', 'W.', 'Bell']]",,2008,[u'http://www.fertilizer.org/ifacontent/download/13524/196003/version/1/file/2008_ifa_micronutrients.pdf'],
10.1146/annurev.nutr.23.011702.073054,"Esfahani, S., Hamidian, M., Madani, A., et. al, Serum zinc and copper levels in children with chronic renal failure, Pediatric Nephrology, 2006",cited-by,10.1007/s00467-006-0119-1,Serum zinc and copper levels in children with chronic renal failure,"[['Seyed', 'Taher', 'Esfahani'], ['Mohammad', 'Reza', 'Hamidian'], ['Abbas', '', 'Madani'], ['Neamatollah', '', 'Ataei'], ['Parvin', '', 'Mohseni'], ['Moustafa', '', 'Roudbari'], ['Marzieh', '', 'Haddadi']]",Pediatric Nephrology,2006,"[u'http://www.springerlink.com/content/m43775377u1x1189', u'http://www.springerlink.com/index/10.1007/s00467-006-0119-1', u'http://www.springerlink.com/index/pdf/10.1007/s00467-006-0119-1']",
10.1146/annurev.nutr.23.011702.073054,"Chrzanowska-Jeske, M., , Generalized symmetric variables, , 2001",cited-by,10.1109/ICECS.2001.957419,Generalized symmetric variables,"[['Malgorzata', '', 'Chrzanowska-Jeske']]",,2001,"[u'http://ieeexplore.ieee.org/xpls/abs_all.jsp?arnumber=957419', u'http://ieeexplore.ieee.org/stamp/stamp.jsp?arnumber=00957419']",
10.1146/annurev.nutr.23.011702.073054,"Wasantwisut, E., Winichagoon, P., Chitchumroonchokchai, C., et. al, Iron and Zinc Supplementation Improved Iron and Zinc Status, but Not Physical Growth, of Apparently Healthy, Breast-Fed Infants in Rural Communities of Northeast Thailand1, , 0",cited-by,"10103322Iron and Zinc Supplementation Improved Iron and Zinc Status, but Not Physical Growth, of Apparently Healthy, Breast-Fed Infants in Rural Communities of Northeast Thailand1","Iron and Zinc Supplementation Improved Iron and Zinc Status, but Not Physical Growth, of Apparently Healthy, Breast-Fed Infants in Rural Communities of Northeast Thailand1","[['Emorn', '', 'Wasantwisut'], ['Pattanee', '', 'Winichagoon'], ['Chureeporn', '', 'Chitchumroonchokchai'], ['Tippawan', '', 'Pongcharoen']]",,0,"[u'http://mulinet2.li.mahidol.ac.th/gsdl/collect/rsjourna/index/assoc/hash018e.dir/doc.pdf', u'http://intl-jn.nutrition.org/cgi/reprint/136/9/2405.pdf', u'http://jn.nutrition.org/cgi/reprint/136/9/2405.pdf']",
10.1146/annurev.nutr.23.011702.073054,"Boy, E., Mannar, V., Pandav, C., et. al, Achievements, challenges, and promising new approaches in vitamin and mineral deficiency control, Nutrition Reviews, 2009",cited-by,10.1111/j.1753-4887.2009.00155.x,"Achievements, challenges, and promising new approaches in vitamin and mineral deficiency control","[['Erick', '', 'Boy'], ['Venkatesh', '', 'Mannar'], ['Chandrakant', '', 'Pandav'], ['Bruno', 'de', 'Benoist'], ['Fernando', '', 'Viteri'], ['Olivier', '', 'Fontaine'], ['Christine', '', 'Hotz']]",Nutrition Reviews,2009,[u'http://blackwell-synergy.com/doi/abs/10.1111/j.1753-4887.2009.00155.x'],
10.1146/annurev.nutr.23.011702.073054,"Sitprija, V., , Altered fluid, electrolyte and mineral status in tropical disease, with an emphasis on malaria and leptospirosis, Nature Clinical Practice Nephrology, 2008",cited-by,10.1038/ncpneph0695,"Altered fluid, electrolyte and mineral status in tropical disease, with an emphasis on malaria and leptospirosis","[['Visith', '', 'Sitprija']]",Nature Clinical Practice Nephrology,2008,"[u'http://dx.doi.org/10.1038/ncpneph0695', u'http://www.nature.com/doifinder/10.1038/ncpneph0695']",
10.1146/annurev.nutr.23.011702.073054,"Sack, D., Qadri, F., Svennerholm, A., , Determinants of Responses to Oral Vaccines in Developing Countries, , 2008",cited-by,10.1159/000129624,Determinants of Responses to Oral Vaccines in Developing Countries,"[['David', 'A.', 'Sack'], ['Firdausi', '', 'Qadri'], ['Ann-Mari', '', 'Svennerholm']]",,2008,"[u'http://content.karger.com/ProdukteDB/produkte.asp?doi=10.1159/000129624', u'http://www.karger.com/doi/10.1159/000129624']",
10.1146/annurev.nutr.23.011702.073054,"Qiu, A., Glover, C., Hogstrand, C., , Regulation of branchial zinc uptake by 1α,25-(OH) 2D 3 in rainbow trout and associated changes in expression of ZIP1 and ECaC, Aquatic Toxicology, 2007",cited-by,10.1016/j.aquatox.2007.02.020,"Regulation of branchial zinc uptake by 1α,25-(OH) 2D 3 in rainbow trout and associated changes in expression of ZIP1 and ECaC","[['Andong', '', 'Qiu'], ['Chris', 'N.', 'Glover'], ['Christer', '', 'Hogstrand']]",Aquatic Toxicology,2007,"[u'http://www.sciencedirect.com/science/article/pii/S0166445X07002184', u'http://linkinghub.elsevier.com/retrieve/pii/S0166445X07002184']",
10.1146/annurev.nutr.23.011702.073054,"Schwiebert, E., Liang, L., Cheng, N., et. al, Extracellular zinc and ATP-gated P2X receptor calcium entry channels: New zinc receptors as physiological sensors and therapeutic targets, Purinergic Signalling, 2005",cited-by,10.1007/s11302-005-0777-7,Extracellular zinc and ATP-gated P2X receptor calcium entry channels: New zinc receptors as physiological sensors and therapeutic targets,"[['Erik', 'M.', 'Schwiebert'], ['Lihua', '', 'Liang'], ['Nai-Lin', '', 'Cheng'], ['Clintoria', 'Richards', 'Williams'], ['Dragos', '', 'Olteanu'], ['Elisabeth', 'A.', 'Welty'], ['Akos', '', 'Zsembery']]",Purinergic Signalling,2005,"[u'http://www.springerlink.com/index/y98u51g35435hm57.pdf', u'http://www.springerlink.com/content/y98u51g35435hm57', u'http://www.springerlink.com/index/10.1007/s11302-005-0777-7', u'http://www.springerlink.com/index/pdf/10.1007/s11302-005-0777-7']",
10.1146/annurev.nutr.23.011702.073054,"Ryz, N., Meddings, J., Taylor, C., , Long-chain inulin increases dendritic cells in the Peyer's patches and increases ex vivo cytokine secretion in the spleen and mesenteric lymph nodes of growing female rats, independent of zinc status, British Journal of Nutrition, 2009",cited-by,10.1017/S000711450812342X,"Long-chain inulin increases dendritic cells in the Peyer's patches and increases ex vivo cytokine secretion in the spleen and mesenteric lymph nodes of growing female rats, independent of zinc status","[['Natasha', 'R.', 'Ryz'], ['Jon', 'B.', 'Meddings'], ['Carla', 'G.', 'Taylor']]",British Journal of Nutrition,2009,[u'http://www.journals.cambridge.org/abstract_S000711450812342X'],
10.1146/annurev.nutr.23.011702.073054,"Pee, S., Moench-Pfanner, R., Martini, E., et. al, Home fortification in emergency response and transition programming: Experiences in Aceh and Nias, Indonesia, , 2007",cited-by,"6295643Home fortification in emergency response and transition programming: Experiences in Aceh and Nias, Indonesia","Home fortification in emergency response and transition programming: Experiences in Aceh and Nias, Indonesia","[['Saskia', 'de', 'Pee'], ['Regina', '', 'Moench-Pfanner'], ['Elviyanti', '', 'Martini'], ['Ian', '', 'Darnton-Hill'], ['Martin', 'W.', 'Bloem']]",,2007,[u'http://www.ennonline.net/pool/files/ife/sprinkles-after-tsunami-saskia-de-pee-hki.pdf'],
10.1146/annurev.nutr.23.011702.073054,"Falcón-Pérez, J., Dell'Angelica, E., , Zinc transporter 2 (SLC30A2) can suppress the vesicular zinc defect of adaptor protein 3-depleted fibroblasts by promoting zinc accumulation in lysosomes, Experimental Cell Research, 2007",cited-by,10.1016/j.yexcr.2007.02.006,Zinc transporter 2 (SLC30A2) can suppress the vesicular zinc defect of adaptor protein 3-depleted fibroblasts by promoting zinc accumulation in lysosomes,"[['Juan', 'M.', 'Falc\xc3\xb3n-P\xc3\xa9rez'], ['Esteban', 'C.', ""Dell'Angelica""]]",Experimental Cell Research,2007,"[u'http://www.sciencedirect.com/science/article/pii/S0014482707000523', u'http://linkinghub.elsevier.com/retrieve/pii/S0014482707000523']",
10.1146/annurev.nutr.23.011702.073054,"Ji, Z., Wu, Y., Wu, F., , A Ratiometric Fluorescence Sensor for Zinc in Neutral Solution Based on Thiourea Receptor, Chemistry Letters, 2006",cited-by,10.1246/cl.2006.950,A Ratiometric Fluorescence Sensor for Zinc in Neutral Solution Based on Thiourea Receptor,"[['Zhao-Jun', '', 'Ji'], ['Yu-Mei', '', 'Wu'], ['Fang-Ying', '', 'Wu']]",Chemistry Letters,2006,[u'http://joi.jlc.jst.go.jp/JST.JSTAGE/cl/2006.950?from=CrossRef'],
10.1146/annurev.nutr.23.011702.073054,"Beck, F., Li, Y., Bao, B., et. al, Evidence for reprogramming global gene expression during zinc deficiency in the HUT78 cell line, Nutrition, 2006",cited-by,10.1016/j.nut.2006.08.001,Evidence for reprogramming global gene expression during zinc deficiency in the HUT78 cell line,"[['Frances', 'W. J.', 'Beck'], ['Yiwei', '', 'Li'], ['Bin', '', 'Bao'], ['Ananda', 'S.', 'Prasad'], ['Fazlul', 'H.', 'Sarkar']]",Nutrition,2006,"[u'http://www.sciencedirect.com/science/article/pii/S0899900706003091', u'http://linkinghub.elsevier.com/retrieve/pii/S0899900706003091']",
10.1146/annurev.nutr.23.011702.073054,"Tuerk, M., Fazel, N., , Zinc deficiency, Current Opinion in Gastroenterology, 2009",cited-by,10.1097/MOG.0b013e328321b395,Zinc deficiency,"[['Melanie', 'J', 'Tuerk'], ['Nasim', '', 'Fazel']]",Current Opinion in Gastroenterology,2009,[u'http://content.wkhealth.com/linkback/openurl?sid=WKPTLP:landingpage&an=00001574-200903000-00009'],
10.1146/annurev.nutr.23.011702.073054,"Saito, H., Nomura, K., Hotta, M., et. al, Malnutrition induces dissociated changes in lymphocyte count and subset proportion in patients with anorexia nervosa, International Journal of Eating Disorders, 2007",cited-by,10.1002/eat.20417,Malnutrition induces dissociated changes in lymphocyte count and subset proportion in patients with anorexia nervosa,"[['Hiroshi', '', 'Saito'], ['Kaoru', '', 'Nomura'], ['Mari', '', 'Hotta'], ['Kazue', '', 'Takano']]",International Journal of Eating Disorders,2007,[u'http://doi.wiley.com/10.1002/eat.20417'],
10.1146/annurev.nutr.23.011702.073054,"Zhang, B., Guo, Y., , Beneficial effects of tetrabasic zinc chloride for weanling piglets and the bioavailability of zinc in tetrabasic form relative to ZnO, Animal Feed Science and Technology, 2007",cited-by,10.1016/j.anifeedsci.2006.06.006,Beneficial effects of tetrabasic zinc chloride for weanling piglets and the bioavailability of zinc in tetrabasic form relative to ZnO,"[['Bingkun', '', 'Zhang'], ['Yuming', '', 'Guo']]",Animal Feed Science and Technology,2007,"[u'http://www.sciencedirect.com/science/article/pii/S0377840106002318', u'http://linkinghub.elsevier.com/retrieve/pii/S0377840106002318']",
10.1146/annurev.nutr.23.011702.073054,"Hooton, T., Weiss, N., Gilman, R., et. al, Brief Report: Randomized Controlled Trial of Zinc Supplementation for Persistent Diarrhea in Adults With HIV1 Infection, Jaids-journal of Acquired Immune Deficiency Syndromes, 2006",cited-by,10.1097/01.qai.0000242446.44285.b5,Brief Report: Randomized Controlled Trial of Zinc Supplementation for Persistent Diarrhea in Adults With HIV1 Infection,"[['Thomas', '', 'Hooton'], ['Noel', 'S', 'Weiss'], ['Robert', '', 'Gilman'], ['Mark', 'H', 'Wener'], ['Victor', '', 'Chavez'], ['Rosario', '', 'Meneses'], ['Juan', '', 'Echevarria'], ['Margot', '', 'Vidal'], ['King', 'K', 'Holmes']]",Jaids-journal of Acquired Immune Deficiency Syndromes,2006,[u'http://content.wkhealth.com/linkback/openurl?sid=WKPTLP:landingpage&an=00126334-200610010-00010'],
10.1146/annurev.nutr.23.011702.073054,"Shumilina, E., Xuan, N., Schmid, E., et. al, Zinc induced apoptotic death of mouse dendritic cells, Apoptosis, 2010",cited-by,10.1007/s10495-010-0520-x,Zinc induced apoptotic death of mouse dendritic cells,"[['Ekaterina', '', 'Shumilina'], ['Nguyen', 'Thi', 'Xuan'], ['Evi', '', 'Schmid'], ['Shefalee', 'K.', 'Bhavsar'], ['Kalina', '', 'Szteyn'], ['Shuchen', '', 'Gu'], ['Friedrich', '', 'G\xc3\xb6tz'], ['Florian', '', 'Lang']]",Apoptosis,2010,"[u'http://www.springerlink.com/content/298256k426164156', u'http://www.springerlink.com/index/10.1007/s10495-010-0520-x', u'http://www.springerlink.com/index/pdf/10.1007/s10495-010-0520-x']",
10.1146/annurev.nutr.23.011702.073054,"Üçkardeş, Y., Özmert, E., Ünal, F., et. al, Effects of zinc supplementation on parent and teacher behaviour rating scores in low socioeconomic level Turkish primary school children, Acta Paediatrica, 2009",cited-by,10.1111/j.1651-2227.2008.01186.x,Effects of zinc supplementation on parent and teacher behaviour rating scores in low socioeconomic level Turkish primary school children,"[['Yasemin', '', '\xc3\x9c\xc3\xa7karde\xc5\x9f'], ['Elif', 'N', '\xc3\x96zmert'], ['Fatih', '', '\xc3\x9cnal'], ['Kadriye', '', 'Yurdak\xc3\xb6k']]",Acta Paediatrica,2009,[u'http://blackwell-synergy.com/doi/abs/10.1111/j.1651-2227.2008.01186.x'],
