source,citation,relation,ID,title,authors,journal,year,fulltext_online_link,fulltext_location
13108660.pdf,"National Vital Statistics Report, Vol. 49, No. 5, July 24, 2001 13 Table 6. Percent low birthweight by race and Hispanic origin of mother: United States, each State and territory, final 1999 and preliminary 2000 [By place of residence. Data are based on a continuous file of records received from the States. Low birthweight is less than 2,500 grams] All races 1 White, total 2 White, non-Hispanic Black, total 2 Hispanic 3 2000 1999 2000 1999 2000 1999 2000 1999 2000 1999 Area United States 4 .......... 7.6 7.6 6.5 6.6 6.6 6.6 12.9 13.1 6.4 6.4 Alabama .................... 9.8 9.3 7.8 7.3 7.9 7.3 14.2 13.6 6.5 6.6 Alaska ....................... 5.6 5.8 4.9 5.3 4.8 5.2 11.9 10.5 5.4 6.6 Arizona ...................... 7.0 6.9 6.8 6.6 7.0 6.5 12.8 12.1 6.7 6.7 Arkansas ................... 8.6 8.6 7.1 7.4 7.3 7.5 13.7 13.0 5.9 5.9 California ................... 6.2 6.1 5.6 5.5 5.7 5.6 11.5 11.7 5.6 5.5 Colorado ................... 8.4 8.3 8.0 8.0 8.0 8.0 14.8 13.8 8.1 8.2 Connecticut ............... 7.4 7.6 6.8 6.8 6.4 6.3 11.8 13.1 8.6 9.1 Delaware ................... 8.6 8.6 7.1 6.8 7.2 6.8 13.2 13.8 6.5 7.0 District of Columbia ... 11.8 13.1 7.4 6.4 6.8 6.7 13.9 16.1 8.2 6.1 Florida ....................... 8.0 8.2 6.6 6.9 6.6 7.1 12.3 12.2 6.5 6.4 Georgia ..................... 8.6 8.7 6.6 6.7 6.7 6.8 12.7 12.7 5.6 5.8 Hawaii ....................... 7.5 7.6 5.3 5.4 4.9 5.2 10.4 9.8 7.3 8.0 Idaho ......................... 6.7 6.2 6.7 6.1 6.5 6.1 * * 7.4 6.0 Illinois ........................ 7.9 8.0 6.4 6.5 6.5 6.5 14.1 14.2 6.2 6.4 Indiana ...................... 7.4 7.9 6.7 7.2 6.9 7.3 12.5 12.9 5.3 6.5 Iowa .......................... 6.1 6.2 5.9 5.9 5.9 5.9 11.7 12.6 5.5 5.7 Kansas ...................... 6.9 7.1 6.5 6.7 6.6 6.7 12.2 12.2 5.9 6.2 Kentucky ................... 8.4 8.2 7.8 7.6 7.8 7.7 13.7 14.0 7.4 6.3 Louisiana ................... 10.3 10.0 7.4 6.9 7.4 7.0 14.3 14.5 7.3 6.2 Maine ........................ 6.0 6.0 6.0 6.0 6.0 6.1 * * * * Maryland ................... 8.6 9.0 6.4 6.7 6.4 6.7 12.8 13.5 6.4 7.2 Massachusetts .......... 7.1 7.1 6.7 6.6 6.4 6.4 10.7 10.9 8.3 8.2 Michigan .................... 7.9 8.0 6.4 6.5 6.3 6.4 14.5 14.6 6.4 6.7 Minnesota ................. 5.8 6.1 5.5 5.6 5.6 5.7 10.8 11.0 5.7 6.0 Mississippi ................. 10.6 10.3 7.9 7.4 8.0 7.4 14.0 13.8 7.2 6.2 Missouri ..................... 7.6 7.7 6.6 6.7 6.6 6.7 13.2 13.7 6.4 5.8 Montana .................... 6.2 6.8 6.1 6.8 6.1 6.9 * * 7.9 * Nebraska ................... 6.8 6.7 6.4 6.4 6.4 6.4 13.0 12.9 6.7 6.6 Nevada ...................... 7.2 7.6 6.7 7.0 7.1 7.6 12.9 12.4 6.1 6.1 New Hampshire ........ 6.3 6.2 6.3 6.2 6.1 5.9 * * * 7.3 New Jersey ............... 7.7 8.2 6.5 6.9 6.2 6.7 12.7 13.4 7.3 7.2 New Mexico .............. 8.0 7.7 8.2 7.6 8.1 7.7 13.0 12.3 8.2 7.6 New York .................. 7.7 7.8 6.7 6.8 6.5 6.5 11.4 11.7 7.3 7.6 North Carolina ........... 8.8 8.9 7.1 7.2 7.3 7.3 13.6 13.7 6.1 6.4 North Dakota ............. 6.4 6.2 6.4 6.2 6.3 6.3 * * * * Ohio 5 ........................ * 7.9 * 6.9 * 6.9 * 13.7 * 7.5 Oklahoma .................. 7.4 7.4 6.9 7.0 7.0 7.2 12.9 11.9 6.2 5.9 Oregon ...................... 5.6 5.4 5.4 5.3 5.5 5.3 10.9 10.7 5.7 5.2 Pennsylvania ............. 7.7 7.9 6.7 6.8 6.6 6.7 13.5 14.3 8.9 9.1 Rhode Island ............. 7.2 7.3 6.5 6.8 6.4 6.7 13.1 11.3 6.5 7.1 South Carolina .......... 9.7 9.8 7.2 7.2 7.2 7.3 14.2 14.7 7.4 5.5 South Dakota ............ 6.2 5.9 5.9 5.9 5.9 5.9 * * * * Tennessee ................ 9.2 9.2 7.8 7.9 7.8 7.9 14.6 14.2 6.7 6.6 Texas ........................ 7.3 7.4 6.6 6.6 6.5 6.7 12.7 12.6 6.8 6.6 Utah .......................... 6.6 6.8 6.6 6.7 6.4 6.7 12.5 13.6 7.8 6.7 Vermont .................... 6.1 5.7 6.0 5.7 5.9 5.6 * * * * Virginia ...................... 7.9 7.8 6.5 6.4 6.5 6.5 12.5 12.0 6.3 5.8 Washington ............... 5.6 5.8 5.3 5.5 5.2 5.4 10.7 10.4 5.4 5.3 West Virginia ............. 8.3 8.0 8.0 7.9 8.0 7.9 15.5 12.3 * * Wisconsin .................. 6.5 6.7 5.8 5.9 5.7 5.9 13.3 13.4 6.6 6.1 Wyoming ................... 8.3 8.4 8.3 8.1 8.2 8.4 * * 8.6 5.7 Puerto Rico ............... 10.8 11.4 10.7 11.4 --- --- 12.1 11.4 --- ---Virgin Islands ............ 9.5 10.1 8.5 10.3 * * 9.7 10.3 10.2 13.3 Guam ........................ 7.9 7.8 * * * * * * * * American Samoa ...... --- 3.6 --- * --- --- --- * --- ---Northern Marianas .... --- 8.2 --- * --- --- --- * --- ---* Figure does not meet standards of reliability or precision; see Technical notes. --- Data not available. 1 Includes races other than white and black. 2 Race and Hispanic origin are reported separately on the birth certificate. Data for persons of Hispanic origin are included in the data for each race group according to the mother’s reported race; see Technical notes. 3 Includes all persons of Hispanic origin of any race; see Technical notes. 4 Excludes data for the territories.",references,NOT found in MAS
13108660.pdf,"5 Due to processing problems, Ohio data for 2000 are not shown separately but are included in U.S. totals; see Technical notes. NOTE: Data are subject to sampling and/or random variation. For information on the relative standard errors of the data and further discussion, see Technical notes.",references,NOT found in MAS
13108660.pdf,"14 National Vital Statistics Report, Vol. 49, No. 5, July 24, 2001 Table 7. Percent of live births by cesarean delivery by race and Hispanic origin of mother: United States, each State and territory, final 1999 and preliminary 2000 [By place of residence. Data are based on a continuous file of records received from the States] All races 1 White, total 2 White, non-Hispanic Black, total 2 Hispanic 3 2000 1999 2000 1999 2000 1999 2000 1999 2000 1999 Area United States 4 .......... 22.9 22.0 22.8 21.9 23.0 22.1 24.3 23.2 22.1 21.2 Alabama .................... 26.4 24.8 26.8 25.4 27.0 25.6 25.5 23.5 22.2 20.4 Alaska ....................... 17.1 14.8 19.1 16.9 19.4 16.7 23.4 16.0 16.3 17.1 Arizona ...................... 18.6 17.8 18.8 17.9 20.2 19.4 20.3 18.9 17.1 16.0 Arkansas ................... 26.5 25.4 26.1 24.9 26.5 25.3 28.3 27.5 20.7 19.3 California ................... 23.4 22.7 23.3 22.5 24.2 23.5 26.6 25.9 22.7 21.9 Colorado ................... 18.3 17.3 18.3 17.3 18.9 17.9 20.2 19.2 16.9 15.8 Connecticut ............... 21.8 21.0 21.8 21.0 22.3 21.1 22.4 21.4 19.8 19.0 Delaware ................... 24.9 23.0 24.7 23.2 25.3 23.5 25.6 23.0 20.6 21.0 District of Columbia ... 22.6 22.2 21.7 19.9 25.2 23.9 22.9 23.2 15.7 12.9 Florida ....................... 25.0 23.8 25.3 24.2 24.3 23.4 24.5 22.5 27.6 26.4 Georgia ..................... 22.6 21.7 22.5 21.5 23.6 22.2 23.0 22.3 16.5 16.6 Hawaii ....................... 14.6 13.8 16.9 17.2 17.1 17.0 16.2 16.6 14.2 16.0 Idaho ......................... 18.3 17.3 18.3 17.1 18.1 17.0 * * 19.5 18.0 Illinois ........................ 21.0 20.1 20.9 20.1 21.7 20.9 21.4 20.2 18.6 17.8 Indiana ...................... 21.8 20.5 21.8 20.5 21.9 20.5 22.0 20.5 20.0 19.5 Iowa .......................... 20.9 19.9 21.0 20.0 21.1 20.0 20.6 18.7 20.1 19.6 Kansas ...................... 22.3 21.2 22.2 21.3 22.6 21.4 25.4 21.4 19.5 20.2 Kentucky ................... 24.6 23.3 24.6 23.4 24.7 23.4 25.0 23.2 21.7 21.6 Louisiana ................... 26.6 26.8 27.2 27.4 27.2 27.4 26.0 26.0 28.2 28.9 Maine ........................ 22.9 21.5 22.9 21.5 22.9 21.5 23.2 28.3 27.9 28.9 Maryland ................... 24.1 23.2 23.2 22.5 23.5 22.8 26.0 24.8 19.9 19.7 Massachusetts .......... 23.7 22.4 24.0 22.4 24.5 22.8 23.5 24.0 20.5 20.4 Michigan .................... 22.0 21.0 22.2 21.1 22.3 21.3 21.4 20.4 20.5 18.5 Minnesota ................. 19.9 18.9 20.5 19.4 20.5 19.5 18.6 18.8 19.3 17.6 Mississippi ................. 28.3 27.3 29.4 28.1 29.6 28.3 27.1 26.4 22.8 21.4 Missouri ..................... 22.5 21.7 22.8 22.1 22.8 22.2 21.0 19.9 21.4 18.2 Montana .................... 19.1 18.8 18.7 18.3 18.9 18.3 * * 18.0 21.1 Nebraska ................... 22.6 22.0 22.7 22.1 22.9 22.4 23.2 20.6 21.6 19.6 Nevada ...................... 21.9 21.8 21.5 21.3 22.9 22.5 26.0 27.1 19.4 19.2 New Hampshire ........ 21.1 19.9 21.1 19.9 21.1 20.0 23.6 25.4 22.3 21.1 New Jersey ............... 27.5 26.3 27.5 26.3 27.7 26.4 28.4 26.6 27.2 26.3 New Mexico .............. 17.2 16.4 17.6 16.8 18.5 17.4 18.4 18.8 17.0 16.4 New York .................. 24.7 23.6 24.7 23.6 25.3 24.3 25.7 24.3 23.9 22.7 North Carolina ........... 23.1 22.7 22.7 22.3 23.6 22.9 24.4 23.9 17.5 18.1 North Dakota ............. 20.9 19.5 20.4 19.5 20.4 19.8 28.0 * 19.2 * Ohio 5 ........................ * 19.4 * 19.4 * 19.4 * 19.2 * 18.8 Oklahoma .................. 24.2 24.1 24.0 24.0 24.3 24.4 26.1 24.6 22.0 21.5 Oregon ...................... 19.5 18.4 19.3 18.3 19.5 18.5 21.5 18.4 18.3 17.7 Pennsylvania ............. 21.7 20.9 21.8 21.2 21.9 21.4 21.5 20.1 20.2 18.4 Rhode Island ............. 21.9 20.5 21.9 20.7 22.9 21.1 23.2 20.7 18.7 20.1 South Carolina .......... 25.3 24.2 25.6 24.3 25.8 24.6 25.0 24.1 21.9 18.8 South Dakota ............ 22.8 22.3 22.9 22.6 22.9 22.7 28.3 * 22.0 19.0 Tennessee ................ 24.9 24.0 24.9 24.1 25.1 24.3 24.9 23.9 21.7 20.4 Texas ........................ 24.9 23.8 24.7 23.6 25.7 24.9 27.0 25.5 23.9 22.5 Utah .......................... 16.8 16.0 16.8 15.9 16.5 15.7 21.0 20.4 18.8 17.7 Vermont .................... 17.3 16.4 17.3 16.4 17.4 16.4 * * * * Virginia ...................... 23.2 21.7 22.9 21.6 23.2 21.8 23.8 22.1 20.6 19.2 Washington ............... 20.7 18.9 20.6 18.7 20.8 18.8 24.0 22.5 19.6 17.7 West Virginia ............. 25.5 24.8 25.4 24.6 25.4 24.6 27.2 27.3 * 25.5 Wisconsin .................. 17.5 17.0 18.0 17.5 18.1 17.6 15.1 13.7 16.7 16.2 Wyoming ................... 19.3 19.6 19.1 19.5 18.9 19.6 * * 21.1 18.8 Puerto Rico ............... 38.9 37.8 39.1 38.0 --- --- 37.0 35.8 --- ---Virgin Islands ............ 22.3 22.7 28.4 29.5 38.9 26.6 20.6 21.1 23.3 27.8 Guam ........................ 17.1 16.6 22.2 18.5 21.9 18.4 * * * * American Samoa ...... --- --- --- --- --- --- --- --- --- ---Northern Marianas .... --- 14.9 --- * --- --- --- * --- ---* Figure does not meet standards of reliability or precision; see Technical notes. --- Data not available. 1 Includes races other than white and black. 2 Race and Hispanic origin are reported separately on the birth certificate. Data for persons of Hispanic origin are included in the data for each race group according to the mother’s reported race; see Technical notes. 3 Includes all persons of Hispanic origin of any race; see Technical notes. 4 Excludes data for the territories.",references,NOT found in MAS
13108660.pdf,"5 Due to processing problems, Ohio data for 2000 are not shown separately but are included in U.S. totals; see Technical notes. NOTE: Data are subject to sampling and/or random variation. For information on the relative standard errors of the data and further discussion, see Technical notes.",references,NOT found in MAS
13108660.pdf,"National Vital Statistics Report, Vol. 49, No. 5, July 24, 2001 15 Table 8. Percent of mothers receiving prenatal care in first trimester of pregnancy by race and Hispanic origin of mother: United States, each State and territory, final 1999 and preliminary 2000 [By place of residence. Data are based on a continuous file of records received from the States] All races 1 White, total 2 White, non-Hispanic Black, total 2 Hispanic 3 2000 1999 2000 1999 2000 1999 2000 1999 2000 1999 Area United States 4 .......... 83.2 83.2 85.0 85.1 88.5 88.4 74.2 74.1 74.4 74.4 Alabama .................... 82.8 83.2 88.1 88.9 89.6 90.0 72.0 71.4 56.1 60.5 Alaska ....................... 80.1 79.4 84.2 82.2 84.4 82.2 81.4 83.6 80.6 79.6 Arizona ...................... 76.5 75.9 77.0 76.6 87.1 86.1 74.0 74.5 65.4 65.0 Arkansas ................... 79.7 79.0 82.7 81.7 84.0 83.1 69.1 69.4 67.2 63.5 California ................... 84.5 83.6 84.4 83.6 89.9 89.2 81.9 81.0 80.7 79.7 Colorado ................... 80.7 81.7 81.0 82.0 87.8 88.4 75.2 75.4 65.4 66.0 Connecticut ............... 89.5 89.3 90.6 90.6 93.0 93.1 82.1 81.0 79.6 78.3 Delaware ................... 85.3 83.7 87.8 86.4 90.0 88.2 77.4 75.5 72.1 71.8 District of Columbia ... 75.3 71.9 85.5 82.7 90.4 90.9 70.2 67.1 76.0 64.2 Florida ....................... 83.7 83.9 86.8 87.1 89.1 89.1 73.6 73.6 81.0 81.3 Georgia ..................... 86.9 87.3 89.8 90.4 91.8 91.9 81.1 81.1 77.9 79.7 Hawaii ....................... 85.5 85.7 89.6 91.0 90.0 91.7 89.3 91.2 83.9 83.8 Idaho ......................... 80.9 80.5 81.2 80.7 83.6 82.9 74.0 73.7 66.1 64.8 Illinois ........................ 82.4 82.5 85.0 85.4 89.5 89.9 71.3 70.0 72.7 72.4 Indiana ...................... 81.1 80.6 82.7 82.2 84.2 83.3 68.3 67.3 62.0 64.4 Iowa .......................... 88.2 87.7 88.7 88.3 89.7 89.1 77.4 74.8 73.6 71.2 Kansas ...................... 86.9 85.8 87.6 86.7 90.6 89.2 79.1 76.9 68.7 68.1 Kentucky ................... 86.8 86.6 87.6 87.4 88.1 87.7 78.7 78.3 67.8 71.2 Louisiana ................... 83.3 82.9 90.5 89.7 90.7 89.8 73.6 73.2 85.4 85.6 Maine ........................ 88.7 89.2 88.9 89.5 89.0 89.7 75.9 83.0 79.5 84.4 Maryland ................... 86.4 87.0 90.8 91.4 92.1 92.4 77.7 78.0 79.1 81.4 Massachusetts .......... 89.3 89.4 90.9 90.8 92.3 92.2 79.4 80.0 79.7 79.0 Michigan .................... 84.2 84.0 87.2 87.0 88.8 88.5 70.1 69.9 71.7 72.0 Minnesota ................. 85.2 84.5 87.6 87.0 88.7 88.1 68.8 66.4 66.9 62.1 Mississippi ................. 81.3 81.5 88.8 89.1 89.2 89.3 72.4 72.7 75.5 74.5 Missouri ..................... 87.8 87.1 89.4 89.0 89.9 89.5 79.0 76.4 79.1 77.5 Montana .................... 83.3 83.8 86.1 85.8 86.6 86.1 86.7 85.7 81.6 76.4 Nebraska ................... 83.2 84.4 84.5 85.4 86.8 87.4 68.0 73.8 67.2 68.8 Nevada ...................... 74.5 75.2 75.1 75.5 84.4 83.2 66.0 69.6 60.6 62.0 New Hampshire ........ 91.1 90.7 91.4 91.0 91.9 91.4 76.7 72.9 79.0 80.6 New Jersey ............... 80.7 81.3 84.5 85.1 89.4 89.7 64.1 64.8 68.6 69.9 New Mexico .............. 68.6 66.8 70.1 68.1 76.7 73.6 65.9 62.6 65.7 64.4 New York .................. 80.9 81.0 84.2 84.2 88.3 88.1 71.3 71.0 72.9 71.8 North Carolina ........... 84.6 85.0 87.7 88.4 91.0 91.1 75.9 76.1 68.4 68.7 North Dakota ............. 86.3 86.3 88.8 88.3 89.3 88.6 78.0 72.1 72.8 81.7 Ohio 5 ........................ * 86.6 * 88.4 * 88.6 * 76.3 * 77.9 Oklahoma .................. 79.3 80.5 81.6 82.6 83.1 83.8 70.7 73.1 67.5 68.7 Oregon ...................... 81.3 80.9 81.6 81.2 84.4 83.8 76.3 76.0 69.0 68.6 Pennsylvania ............. 85.4 85.2 87.6 87.6 88.6 88.5 72.7 71.6 73.5 73.9 Rhode Island ............. 91.0 91.3 91.9 92.4 93.2 93.6 86.0 83.2 86.9 86.1 South Carolina .......... 79.4 80.7 84.1 85.9 85.8 87.2 70.9 70.9 59.1 61.1 South Dakota ............ 78.7 83.4 82.6 87.0 82.8 87.4 70.5 74.2 70.9 68.5 Tennessee ................ 83.1 84.3 86.0 87.0 87.6 87.9 72.2 74.6 56.1 64.0 Texas ........................ 78.8 79.3 78.8 79.3 87.6 87.3 76.1 76.7 71.1 72.2 Utah .......................... 79.5 80.5 80.5 81.5 83.6 84.0 56.0 63.7 60.5 63.0 Vermont .................... 88.4 87.9 88.6 88.0 88.8 88.0 74.2 81.6 84.4 80.6 Virginia ...................... 85.2 85.3 88.2 88.6 90.1 90.2 76.0 74.5 71.8 74.0 Washington ............... 82.7 82.8 83.4 83.6 85.9 86.0 74.9 75.7 71.0 71.1 West Virginia ............. 86.1 85.1 86.7 85.6 86.7 85.7 70.3 70.7 71.1 68.8 Wisconsin .................. 84.2 84.1 86.6 86.6 88.0 87.7 69.9 69.1 68.7 70.6 Wyoming ................... 82.7 83.0 83.5 83.4 84.5 84.3 73.7 76.4 74.1 74.8 Puerto Rico ............... 78.1 77.7 79.0 78.5 --- --- 67.9 69.0 --- ---Virgin Islands ............ 63.7 59.6 62.5 63.1 84.2 73.5 63.3 58.2 59.9 57.5 Guam ........................ 60.9 61.8 88.1 86.4 89.8 87.6 77.3 77.6 66.7 73.3 American Samoa ...... --- --- --- --- --- --- --- --- --- ---Northern Marianas .... --- 30.2 --- * --- --- --- * --- ---* Figure does not meet standards of reliability or precision; see Technical notes. --- Data not available. 1 Includes races other than white and black. 2 Race and Hispanic origin are reported separately on the birth certificate. Data for persons of Hispanic origin are included in the data for each race group according to the mother’s reported race; see Technical notes. 3 Includes all persons of Hispanic origin of any race; see Technical notes 4 Excludes data for the territories. 5 Due to processing problems, Ohio data are not shown separately but are included in U.S. totals; see Technical notes. NOTE: Data are subject to sampling and/or random variation. For information on the relative standard errors of the data and further discussion, see Technical notes.",references,NOT found in MAS
13108660.pdf,"16 National Vital Statistics Report, Vol. 49, No. 5, July 24, 2001 Technical notes Nature and sources of data Preliminary data for 2000 are based on a substantial proportion of vital records for that year. The data for 2000 are based on a continuous receipt and processing of statistical records through April 11, 2001, by the National Center for Health Statistics (NCHS). NCHS receives the data from the States’ vital registration systems through the Vital Statistics Cooperative Program. In this report, U.S. totals include only events occurring within the 50 States and the District of Columbia. Data for Puerto Rico, the Virgin Islands, and Guam are included in tables showing data by State, but are not included in U.S. totals. Tables by State generally show entries for American Samoa and the Northern Marianas, but preliminary data for these areas were not available by April 11, 2001, and are not presented in this report.",references,NOT found in MAS
13108660.pdf,Final data for 1999 for these areas are presented where available.,references,NOT found in MAS
13108660.pdf,"For 2000, individual records of births are weighted to independent counts of vital events occurring in each State. These State-specific counts serve as control totals and are the basis for the record weights in the preliminary file. If the number of records in the preliminary file is greater than the count received from the State, the State-specific number of records in the preliminary file is used instead and the weight is set at 1.0. Each birth record has one weight specific to the State where the birth occurred. Table I shows the percent of completeness of the preliminary file for each event by place of occurrence. The percent of completeness is obtained by dividing the number of records in the preliminary file by the control total and multiplying by 100.Although data by place of occurrence are used to compute the weights, all data in this report are tabulated by place of residence. For selected variables in the natality file, unknown or not-stated values are imputed. Detailed information on reporting completeness and imputation procedures may be found in Technical Appendix of the Vital Statistics of the United States: Natality (7).",references,NOT found in MAS
13108660.pdf,"Race and Hispanic origin are reported separately on the birth certificate. Therefore, data shown by race include persons of Hispanic or non-Hispanic origin, and data for Hispanic origin include persons of any race. In this report, births of Hispanic origin are included in the totals for each race group—white, black, American Indian, and Asian or Pacific Islander—according to the mother’s race as reported on the birth certificate. Data shown for Hispanic persons include all persons of Hispanic origin of any race. In 1999, approximately 97 percent of Hispanic-origin births were to white women. Data are shown separately for non-Hispanic white women because there are substantial differ­ ences in childbearing patterns between Hispanic and non-Hispanic white women. More than 1 in 5 white births were to Hispanic women in 2000.",references,NOT found in MAS
13108660.pdf,"From 1964 to 1996, mother’s age was edited for ages 10–49 years: births reported to occur to mothers younger than age 10 or older than 49 years had age imputed according to the same race and total birth order (total of live births and fetal deaths). Beginning in 1997, age of mother is edited for ages 10–54 years. A review and verification of unedited birth data for 1996 showed that the vast majority of births reported as occurring to women aged 50 years and over were to women aged 50–54 years. The numbers of births to women aged 50–54 years are too small for computing age-specific birth rates and have been included with births to women aged 45–49 years for computing birth rates.",references,NOT found in MAS
13108660.pdf,"National estimates of births to unmarried women are based on two methods of determining marital status. For 1999 and 2000, birth certificates in 48 States and the District of Columbia included a direct question about mother’s marital status; in California and Nevada, the direct question is part of the electronic birth registration process but does not appear on certified or paper copies of the birth certificate. The question in most States is: ‘‘Mother married? (At birth, conception, or any time between) (Yes or no)’’. Marital status is inferred in Michigan and New York. A birth is inferred as nonmarital if the father’s name is missing from the birth certificate or if a paternity acknowledgment was filed.",references,NOT found in MAS
13108660.pdf,"The birth rate for unmarried women for 2000 is estimated on the basis of population distributions by marital status provided by the U.S. Census Bureau as of March 2000 (8) applied to the national population estimates as of July 1 (9). (Both sets of estimates are projected from the 1990 census.) The nonmarital birth rate shown here for 2000 thus differs from those published by NCHS in the annual final reports, which are based on populations estimated from 3-year averages of the marital status distributions, rather than a single year as shown here (10,11). Because of variability, population estimates for a single year are not an adequate basis for computing age-specific birth rates for unmarried women—these rates are available only in the final reports.",references,NOT found in MAS
13108660.pdf,"Computing rates and percents Rates are on an annual basis per 1,000 estimated population residing in the specified area as of July 1, 2000, and July 1, 1999 (projected from the 1990 census) and are based on populations furnished by the U.S. Census Bureau (9,12). Rates by State and the territories are computed on the basis of populations on July 1, 2000, and July 1, 1999 (13–15).",references,NOT found in MAS
13108660.pdf,"For calculating birth rates, age and race of mother are imputed if they are not stated (0.02 percent and 0.1 percent, respectively, for 2000). In computing birth rates by live-birth order, births with live-birth order not stated are distributed in proportion to stated data. Births with marital status not reported (0.04 percent for 2000) are included with births to married mothers. Percents were computed using only events for which the characteristic is reported. The ‘‘Not stated’’ category is subtracted from the total before the percent is computed for birthweight, prenatal care, and method of delivery. Birth rates for the Hispanic population are based only on events to persons reported as Hispanic. Rates for non-Hispanic white persons are based on the sum of all white events reported as non-Hispanic and white events with origin not stated. Hispanic origin is not imputed if it is not reported.",references,NOT found in MAS
13108660.pdf,"An asterisk indicates that the figure does not meet standards of reliability or precision. In this report, three sets of criteria determine whether a figure meets these standards: +	 The State-specific sample is complete enough to provide reliable estimates. For example, a criterion of at least 75 percent of a State’s records for the 12-month period is used as a basis for providing State-specific estimates. The Ohio file contained only 41.4 percent of all records (see table I) for 2000. Therefore, data for Ohio are included in U.S. totals, but are not shown separately.",references,NOT found in MAS
