source,citation,relation,ID,title,authors,journal,year,fulltext_online_link,fulltext_location
3435991National Vital Statistics Report,"Goldman, N., Weinstein, M., Cornman, J., et. al, Sex Differentials in Biological Risk Factors for Chronic Disease: Estimates from Population-Based Surveys, Journal of Womens Health, 2004",cited-by,10.1089/154099904323087088,Sex Differentials in Biological Risk Factors for Chronic Disease: Estimates from Population-Based Surveys,"[['Noreen', '', 'Goldman'], ['Maxine', '', 'Weinstein'], ['Jennifer', '', 'Cornman'], ['Burton', '', 'Singer'], ['Teresa', '', 'Seeman'], ['Ming-Cheng', '', 'Chang']]",Journal of Womens Health,2004,"[u'http://opr.princeton.edu/papers/opr0303.pdf', u'http://www.liebertonline.com/doi/abs/10.1089%2F154099904323087088']",./output/13108660.pdf/citedby/10.1089~154099904323087088
3435991National Vital Statistics Report,"Mayer, S., Rincon, F., , Ultra-early Hemostatic Therapy for Acute Intracerebral Hemorrhage, Seminars in Hematology, 2006",cited-by,10.1053/j.seminhematol.2005.11.020,Ultra-early Hemostatic Therapy for Acute Intracerebral Hemorrhage,"[['Stephan', 'A.', 'Mayer'], ['Fred', '', 'Rincon']]",Seminars in Hematology,2006,"[u'http://www.sciencedirect.com/science/article/pii/S0037196305002271', u'http://linkinghub.elsevier.com/retrieve/pii/S0037196305002271']",
3435991National Vital Statistics Report,"Andresen, E., Wolinsky, F., Miller, J., et. al, Cross-Sectional and Longitudinal Risk Factors for Falls, Fear of Falling, and Falls Efficacy in a Cohort of Middle-Aged African Americans, , 0",cited-by,"6517728Cross-Sectional and Longitudinal Risk Factors for Falls, Fear of Falling, and Falls Efficacy in a Cohort of Middle-Aged African Americans","Cross-Sectional and Longitudinal Risk Factors for Falls, Fear of Falling, and Falls Efficacy in a Cohort of Middle-Aged African Americans","[['Elena', 'M.', 'Andresen'], ['Fredric', 'D.', 'Wolinsky'], ['J.', 'Philip', 'Miller'], ['Margaret-Mary', 'G.', 'Wilson'], ['Theodore', 'K.', 'Malmstrom'], ['Douglas', 'K.', 'Miller']]",,0,[u'http://gerontologist.gerontologyjournals.org/cgi/reprint/46/2/249.pdf'],"./output/13108660.pdf/citedby/6517728Cross-Sectional and Longitudinal Risk Factors for Falls, Fear of Falling, and Falls Efficacy in a Cohort of Middle-Aged African Americans"
3435991National Vital Statistics Report,"Moncher, F., Josephson, A., , Religious and spiritual aspects of family assessment, Child and Adolescent Psychiatric Clinics of North America, 2004",cited-by,10.1016/S1056-4993(03)00092-0,Religious and spiritual aspects of family assessment,"[['Frank', 'J', 'Moncher'], ['Allan', 'M', 'Josephson']]",Child and Adolescent Psychiatric Clinics of North America,2004,"[u'http://www.sciencedirect.com/science/article/pii/S1056499303000920', u'http://linkinghub.elsevier.com/retrieve/pii/S1056499303000920']",./output/13108660.pdf/citedby/10.1016~S1056-4993(03)00092-0
3435991National Vital Statistics Report,"Mak, K., Ho, S., Thomas, G., et. al, Family structure, parent-child conversation time and substance use among Chinese adolescents, BMC Public Health, 2010",cited-by,10.1186/1471-2458-10-503,"Family structure, parent-child conversation time and substance use among Chinese adolescents","[['Kwok-Kei', '', 'Mak'], ['Sai-Yin', '', 'Ho'], ['G', 'Neil', 'Thomas'], ['C', 'Mary', 'Schooling'], ['Sarah', 'M', 'McGhee'], ['Tai-Hing', '', 'Lam']]",BMC Public Health,2010,"[u'http://www.biomedcentral.com/1471-2458/10/503', u'http://www.biomedcentral.com/content/pdf/1471-2458-10-503.pdf', u'http://www.springerlink.com/content/g127887431144655', u'http://www.springerlink.com/index/g127887431144655.pdf']",./output/13108660.pdf/citedby/10.1186~1471-2458-10-503
3435991National Vital Statistics Report,"Playforth, K., Langer, O., , 220: Electrical uterine activity: does BMI play a role?, American Journal of Obstetrics and Gynecology, 2011",cited-by,10.1016/j.ajog.2010.10.236,220: Electrical uterine activity: does BMI play a role?,"[['Karen', '', 'Playforth'], ['Oded', '', 'Langer']]",American Journal of Obstetrics and Gynecology,2011,[u'http://www.sciencedirect.com/science/article/pii/S000293781001495X'],
13108660.pdf,"Table 3. Birth rates by age of mother, live-birth order, and race and Hispanic origin of mother: United States, preliminary 2000  [Data are based on a continuous file of records received from the States. Rates per 1,000 women in specified age and racial group] Age of mother Live-birth order and race/Hispanic origin 15-44 10-14 15-19 20-24 25-29 30-34 35-39 40-44 45-49 of mother years 1 years years years years years years years years 2 All races ....................................... 67.6 0.9 48.7 112.5 121.7 94.2 40.3 7.9 0.5 1st child ........................................ 27.1 0.9 38.2 51.7 44.2 27.2 9.0 1.7 0.1 2d child ........................................ 22.0 0.0 8.8 38.8 42.0 34.0 13.1 2.2 0.1 3d child ........................................ 11.3 * 1.5 15.9 22.5 19.6 9.5 1.6 0.1 4th child and over ........................ 7.2 * 0.2 6.0 13.0 13.3 8.7 2.4 0.2 White, total 3 ................................ 66.7 0.6 43.9 108.3 124.9 97.6 40.7 7.7 0.4 1st child ........................................ 26.9 0.6 35.2 51.8 46.4 28.4 9.2 1.7 0.1 2d child ........................................ 22.0 0.0 7.5 37.8 44.0 35.6 13.2 2.1 0.1 3d child ........................................ 11.2 * 1.1 14.3 22.9 20.6 9.8 1.6 0.1 4th child and over ........................ 6.6 * 0.1 4.5 11.6 12.9 8.5 2.3 0.1 White, non-Hispanic ..................... 58.7 0.3 32.8 90.1 113.4 94.2 39.0 7.2 0.4 1st child ........................................ 24.3 0.3 27.0 44.9 46.1 29.5 9.4 1.7 0.1 2d child ........................................ 19.9 * 5.0 31.1 40.3 35.8 13.3 2.1 0.1 3d child ........................................ 9.5 * 0.6 11.0 18.5 18.7 9.2 1.5 0.1 4th child and over ........................ 5.1 * 0.1 3.1 8.5 10.1 7.1 1.9 0.1 Black, total 3 ................................. 71.4 2.5 79.2 143.7 104.8 67.0 32.0 7.1 0.4 1st child ........................................ 26.7 2.4 58.7 53.7 25.5 14.2 5.8 1.2 0.1 2d child ........................................ 21.2 0.1 16.4 48.7 33.5 20.9 9.1 1.7 0.1 3d child ........................................ 12.8 * 3.5 26.6 24.0 15.6 7.5 1.6 0.1 4th child and over ........................ 10.7 * 0.6 14.7 21.8 16.4 9.6 2.7 0.2 American Indian, total 3,4 ............. 71.3 1.3 67.9 135.4 106.7 68.0 32.7 7.4 0.3 1st child ........................................ 25.0 1.3 51.8 49.8 21.0 9.8 3.9 0.9 * 2d child ........................................ 20.0 * 13.6 50.0 31.0 16.1 6.4 1.1 * 3d child ........................................ 12.6 * 2.2 24.9 26.8 15.5 6.6 1.1 * 4th child and over ........................ 13.6 * 0.2 10.8 28.0 26.5 15.7 4.2 * Asian or Pacific Islander, total 3 ... 70.7 0.3 21.8 72.2 125.7 120.6 60.2 12.7 0.9 1st child ........................................ 33.0 0.3 17.5 43.6 68.5 47.5 16.6 3.1 0.2 2d child ........................................ 24.1 * 3.5 19.8 38.2 48.2 24.7 4.3 0.2 3d child ........................................ 8.7 * 0.7 6.0 12.3 16.3 11.9 2.7 0.1 4th child and over ........................ 4.9 * 0.1 2.8 6.6 8.5 7.1 2.6 0.3 Hispanic 5 .................................... 105.9 1.9 94.4 184.6 170.8 109.0 48.6 11.6 0.6 1st child ........................................ 39.5 1.8 72.1 80.2 45.2 20.5 7.2 1.5 0.1 2d child ........................................ 32.3 0.0 18.7 65.8 58.7 32.3 11.8 2.3 0.1 3d child ........................................ 19.9 * 3.1 28.1 41.7 29.6 12.7 2.5 0.1 4th child and over ........................ 14.2 * 0.4 10.4 25.1 26.6 17.0 5.3 0.3 0.0 Quantity more than zero but less than 0.05. * Figure does not meet standards of reliability or precision; based on fewer than 20 births in the numerator.  1 The rate shown is the fertility rate, which is defined as the total number of births, regardless of age of mother, per 1,000 women aged 15-44 years.  2 The birth rate for ages 45-49 years is computed by relating births to women aged 45-54 years to women aged 45-49 years, because most of the births in this group are to women  aged 45-49. 3 Race and Hispanic origin are reported separately on the birth certificate. Data for persons of Hispanic origin are included in the data for each race group according to the mother’s reported race; see Technical notes. 4 Includes births to Aleuts and Eskimos. 5 Includes all persons of Hispanic origin of any race; see Technical notes. NOTE: Data are subject to sampling and/or random variation. For information on the relative standard errors of the data and further discussion, see Technical notes.",references,NOT found in MAS
13108660.pdf,"National Vital Statistics Report, Vol. 49, No. 5, July 24, 2001 11 Table 4. Live births by race and Hispanic origin of mother: United States, each State and territory, preliminary 2000, and birth and fertility rates, final 1999 and preliminary 2000 [By place of residence. Data are based on a continuous file of records received from the States. Birth rates are total births per 1,000 total population; fertility rates are total births per 1,000 women aged 15-44 years. Figures for 1999 are based on weighted data rounded to the nearest individual, so categories may not add to totals] Number Birth rate Fertility rate Asian or All White, White, American Pacific Area races total 1 non-Hispanic Black 1 Indian 1,2 Islander 1 Hispanic 3 2000 1999 2000 1999 United States 4 ................. 4,064,948 3,202,932 2,370,778 619,970 41,621 200,426 815,778 14.8 14.5 67.6 65.9 Alabama ........................... 63,317 42,075 40,182 20,515 182 544 1,883 14.4 14.2 65.0 63.3 Alaska .............................. 10,026 6,394 5,797 466 2,523 642 598 16.1 16.1 75.0 74.3 Arizona ............................. 85,274 74,765 39,906 2,789 5,668 2,052 34,696 17.5 17.0 84.4 81.1 Arkansas .......................... 38,031 29,249 26,817 8,031 247 505 2,362 14.8 14.4 69.5 67.7 California .......................... 531,832 429,516 172,337 34,856 3,037 64,423 257,202 15.8 15.6 70.6 69.5 Colorado ........................... 65,434 59,679 41,818 3,032 644 2,078 18,238 15.8 15.3 73.1 69.8 Connecticut ...................... 43,154 36,118 29,073 5,143 126 1,766 6,502 13.1 13.2 61.3 61.9 Delaware .......................... 11,050 8,010 6,998 2,633 39 368 1,021 14.5 14.2 63.5 61.7 District of Columbia .......... 7,666 2,325 1,464 5,155 9 177 876 14.8 14.5 63.0 60.0 Florida .............................. 204,152 150,614 106,199 47,390 1,129 5,019 45,867 13.3 13.0 66.9 65.1 Georgia ............................ 132,711 84,813 70,682 44,066 299 3,533 13,369 16.7 16.3 71.4 68.8 Hawaii .............................. 17,544 4,018 3,280 472 189 12,865 2,302 14.9 14.4 72.3 68.7 Idaho ................................ 20,371 19,710 17,029 75 288 298 2,596 16.0 15.9 74.8 73.2 Illinois ............................... 185,066 142,729 103,681 34,243 268 7,827 39,242 15.2 15.0 69.5 68.0 Indiana ............................. 87,111 76,279 70,684 9,500 144 1,188 5,421 14.6 14.5 66.3 65.2 Iowa .................................. 38,545 36,153 33,855 1,243 227 923 2,152 13.4 13.1 64.5 62.3 Kansas ............................. 39,690 35,320 30,199 2,869 434 1,067 4,765 14.9 14.6 69.3 67.5 Kentucky .......................... 56,197 50,351 49,297 5,155 80 610 1,065 14.1 13.7 63.8 61.5 Louisiana .......................... 67,964 38,169 36,663 28,375 390 1,030 1,531 15.5 15.4 69.2 67.7 Maine ............................... 13,603 13,185 13,017 112 118 188 143 10.8 10.9 49.5 49.4 Maryland .......................... 74,341 45,569 41,026 24,918 237 3,617 4,815 14.2 13.9 62.0 60.4 Massachusetts ................. 81,650 68,571 60,463 8,101 164 4,814 9,268 13.2 13.1 59.2 58.5 Michigan ........................... 136,273 107,433 92,602 24,346 679 3,815 6,962 13.7 13.5 62.0 60.7 Minnesota ......................... 67,393 58,738 52,431 3,935 1,245 3,475 3,723 14.0 13.8 63.6 62.6 Mississippi ........................ 44,106 23,558 22,861 19,906 248 393 622 15.8 15.4 70.3 67.9 Missouri ............................ 76,456 63,169 60,506 11,465 344 1,478 2,663 13.9 13.8 64.0 63.0 Montana ........................... 10,964 9,476 8,840 46 1,327 114 331 12.3 12.2 61.3 59.8 Nebraska .......................... 24,650 22,293 19,224 1,376 431 550 2,591 14.8 14.3 68.9 66.6 Nevada ............................. 30,910 26,095 15,744 2,383 432 2,000 10,236 16.4 16.2 80.0 78.3 New Hampshire ................ 14,613 14,077 13,145 182 28 326 374 12.0 11.7 52.3 50.8 New Jersey ...................... 115,071 84,254 63,827 21,003 182 9,632 22,348 14.0 14.0 65.5 64.5 New Mexico ...................... 27,238 22,902 9,047 499 3,436 401 13,961 15.6 15.6 72.7 72.2 New York .......................... 258,036 183,010 124,869 54,729 702 19,594 53,778 14.1 14.0 64.8 63.6 North Carolina .................. 120,249 86,393 73,933 29,342 1,739 2,775 12,563 15.5 14.9 71.5 67.6 North Dakota .................... 7,696 6,729 6,414 82 789 97 133 12.2 12.1 58.8 57.3 Ohio 5 ............................... * * * * * * * * 13.6 * 61.4 Oklahoma ......................... 49,905 38,899 34,219 4,829 5,158 1,019 4,364 14.8 14.6 70.1 68.9 Oregon ............................. 45,800 41,694 33,000 1,023 738 2,345 7,367 13.7 13.6 65.8 64.8 Pennsylvania .................... 146,243 121,249 113,564 20,646 384 3,964 7,532 12.2 12.1 58.2 57.4 Rhode Island .................... 12,493 10,803 7,873 1,112 147 431 2,070 12.5 12.5 58.0 57.2 South Carolina ................. 56,116 35,338 33,177 19,741 188 849 2,258 14.3 14.1 63.3 62.1 South Dakota ................... 10,354 8,431 8,231 106 1,684 132 223 14.0 14.4 66.8 67.7 Tennessee ....................... 79,630 61,237 58,036 16,916 154 1,323 3,227 14.4 14.2 65.2 63.5 Texas ............................... 366,841 313,424 144,384 40,969 831 11,617 168,573 18.0 17.4 80.8 77.6 Utah .................................. 47,368 44,912 38,826 332 690 1,435 5,938 21.9 21.7 94.5 93.1 Vermont ............................ 6,497 6,363 6,172 32 19 83 33 10.9 11.1 48.8 49.2 Virginia ............................. 98,907 71,173 63,521 22,507 109 5,118 7,716 14.2 13.9 61.2 59.6 Washington ...................... 81,033 68,679 55,787 3,496 1,969 6,889 11,320 13.9 13.8 63.2 62.1 West Virginia .................... 20,912 20,017 19,917 775 12 107 49 11.6 11.5 56.0 54.7 Wisconsin ......................... 69,428 59,899 55,529 6,494 937 2,097 4,493 13.1 13.0 60.5 59.3 Wyoming .......................... 6,247 5,865 5,304 57 266 59 568 13.0 12.8 62.7 60.8 Puerto Rico ...................... 59,333 54,595 --- 4,738 --- --- --- 15.2 15.3 64.9 65.3 Virgin Islands .................... 1,568 314 66 1,196 56 3 344 13.0 14.0 60.0 64.3 Guam ............................... 3,764 295 262 45 4 3,420 39 24.3 26.4 120.8 129.1 American Samoa .............. --- --- --- --- --- --- --- --- 27.2 --- 125.1 Northern Marianas ........... --- --- --- --- --- --- --- --- 20.0 --- 59.0 * Figure does not meet standards of reliability or precision; see Technical notes. --- Data not available. 1 Race and Hispanic origin are reported separately on the birth certificate. Data for persons of Hispanic origin are included in the data for each race group according to the mother’s reported race; see Technical notes. 2 Includes births to Aleuts and Eskimos. 3 Includes all persons of Hispanic origin of any race; see Technical notes. 4 Excludes data for the territories.",references,NOT found in MAS
13108660.pdf,"5 Due to processing problems, Ohio data for 2000 are not shown separately but are included in U.S. totals; see Technical notes. NOTE: Data are subject to sampling and/or random variation. For information on the relative standard errors of the data and further discussion, see Technical notes.",references,NOT found in MAS
13108660.pdf,"12 National Vital Statistics Report, Vol. 49, No. 5, July 24, 2001 Table 5. Percent of live births to unmarried mothers by race and Hispanic origin of mother: United States, each State and territory, final 1999 and preliminary 2000 [By place of residence. Data are based on a continuous file of records received from the States] All races 1 White, total 2 White, non-Hispanic Black, total 2 Hispanic 3 2000 1999 2000 1999 2000 1999 2000 1999 2000 1999 Area United States 4 .......... 33.1 33.0 27.1 26.8 22.1 22.1 68.5 68.9 42.5 42.2 Alabama .................... 34.3 33.3 18.1 17.2 17.7 16.9 68.1 67.8 24.7 26.4 Alaska ....................... 33.0 33.2 23.4 23.1 22.8 22.7 45.6 46.5 34.8 31.8 Arizona ...................... 39.3 38.8 37.0 36.0 24.7 24.6 61.9 63.6 51.4 50.2 Arkansas ................... 35.7 35.2 25.2 24.7 24.5 24.0 74.8 74.6 34.6 35.0 California ................... 32.6 32.9 32.9 32.7 19.8 20.7 62.5 62.6 42.0 41.3 Colorado ................... 25.0 25.4 23.9 24.1 17.4 18.4 51.6 54.5 39.1 38.8 Connecticut ............... 29.1 29.0 24.6 24.2 16.2 16.4 66.8 67.3 63.1 62.6 Delaware ................... 38.0 38.8 28.4 28.1 25.2 25.4 70.9 72.9 51.6 51.3 District of Columbia ... 60.3 61.7 25.0 24.5 8.7 8.2 77.8 78.9 53.9 54.1 Florida ....................... 38.3 37.5 29.7 29.0 26.5 26.1 67.5 67.2 38.3 37.3 Georgia ..................... 37.0 36.6 22.8 21.9 20.1 20.0 66.5 66.7 38.0 35.4 Hawaii ....................... 32.2 32.8 17.1 17.8 15.2 16.7 23.9 25.0 45.6 45.4 Idaho ......................... 21.6 21.6 21.0 21.1 19.1 19.7 48.0 41.0 32.9 31.3 Illinois ........................ 34.5 34.1 25.9 25.0 19.8 19.4 76.3 77.2 42.3 40.8 Indiana ...................... 34.8 34.5 30.0 29.5 28.7 28.5 76.0 77.1 47.3 45.3 Iowa .......................... 28.0 27.5 26.4 26.0 25.5 25.2 74.0 71.3 41.7 40.2 Kansas ...................... 29.0 28.6 25.9 25.4 23.6 23.7 69.3 69.2 41.7 38.8 Kentucky ................... 30.9 30.4 26.7 26.2 26.5 26.1 73.2 73.0 37.4 31.8 Louisiana ................... 45.7 44.8 25.4 25.1 25.2 24.9 73.8 73.7 33.5 30.8 Maine ........................ 31.1 31.3 30.8 31.1 30.8 30.5 43.8 49.1 33.6 36.3 Maryland ................... 34.6 34.9 22.4 21.8 20.2 19.9 60.7 62.1 42.2 40.5 Massachusetts .......... 26.5 26.5 23.4 23.2 18.5 18.7 58.9 59.2 62.4 61.4 Michigan .................... 33.4 33.1 25.2 24.7 23.3 22.9 72.8 72.4 40.9 41.0 Minnesota ................. 25.8 25.9 22.5 22.4 21.4 21.5 60.6 61.9 46.8 47.1 Mississippi ................. 46.0 45.9 21.7 21.0 21.2 20.7 75.1 75.4 40.3 33.3 Missouri ..................... 34.6 34.1 27.1 26.7 26.5 26.3 77.2 76.5 43.0 39.6 Montana .................... 30.8 30.0 25.4 24.5 24.4 23.9 43.5 * 38.8 38.4 Nebraska ................... 27.2 25.9 24.1 22.7 21.6 20.4 67.3 69.6 41.8 41.1 Nevada ...................... 36.0 35.7 33.6 33.3 27.7 28.5 67.4 68.1 42.8 41.4 New Hampshire ........ 24.7 24.2 24.8 24.3 24.2 23.5 38.5 37.4 37.4 40.9 New Jersey ............... 28.9 28.5 22.5 21.6 13.2 13.0 64.8 65.0 52.4 50.9 New Mexico .............. 45.5 45.1 41.8 41.3 26.4 26.7 59.5 63.2 51.9 51.2 New York .................. 36.3 36.6 29.1 29.5 18.5 19.1 67.5 67.9 60.6 60.0 North Carolina ........... 33.3 33.2 22.5 21.8 19.1 19.1 65.8 66.4 42.7 41.7 North Dakota ............. 28.3 27.5 23.4 22.9 22.9 22.6 * 26.4 33.3 33.9 Ohio 5 ........................ * 34.1 * 27.3 * 26.8 * 76.1 * 47.5 Oklahoma .................. 33.8 33.2 28.1 27.3 26.9 26.3 69.6 70.8 38.5 36.9 Oregon ...................... 30.1 30.4 29.6 29.9 27.1 28.0 64.5 62.9 40.3 39.6 Pennsylvania ............. 32.7 32.9 25.9 26.0 23.5 23.7 76.0 77.4 61.6 61.3 Rhode Island ............. 34.3 34.3 30.9 30.8 24.1 25.6 62.6 65.8 59.2 56.4 South Carolina .......... 39.8 39.0 23.0 22.3 22.0 21.5 70.9 70.6 37.6 37.2 South Dakota ............ 33.5 31.8 25.0 23.6 24.6 23.4 34.0 36.0 48.0 34.6 Tennessee ................ 34.5 34.7 24.5 24.3 23.7 23.8 72.3 73.4 39.6 38.0 Texas ........................ 30.2 31.3 27.0 27.8 19.5 20.1 61.3 62.4 33.4 34.8 Utah .......................... 17.2 16.7 16.4 16.0 13.0 12.9 52.9 51.3 39.2 37.7 Vermont .................... 28.2 28.9 28.2 28.8 28.0 28.6 * 55.0 * * Virginia ...................... 29.9 29.7 21.0 20.4 18.8 18.6 62.8 62.7 40.2 37.5 Washington ............... 28.2 28.1 26.8 26.5 24.2 24.0 53.5 55.6 40.8 39.6 West Virginia ............. 31.8 31.7 30.2 30.2 30.1 30.1 75.5 77.8 * 39.6 Wisconsin .................. 29.3 29.2 23.6 23.2 22.0 21.8 82.1 83.5 45.1 43.8 Wyoming ................... 28.8 29.0 27.3 27.1 25.4 25.9 38.6 54.2 45.4 40.2 Puerto Rico ............... 49.6 48.1 48.2 46.8 --- --- 66.5 62.1 --- ---Virgin Islands ............ 65.3 67.1 55.0 51.4 28.9 27.6 70.6 73.6 63.6 66.7 Guam ........................ 53.9 55.9 21.4 21.5 21.7 20.1 * * * * American Samoa ...... --- 35.5 --- * --- --- --- * --- ---Northern Marianas .... --- 47.4 --- * --- --- --- * --- ---* Figure does not meet standards of reliability or precision; see Technical notes. --- Data not available. 1 Includes races other than white and black. 2 Race and Hispanic origin are reported separately on the birth certificate. Data for persons of Hispanic origin are included in the data for each race group according to the mother’s reported race; see Technical notes. 3 Includes all persons of Hispanic origin of any race; see Technical notes. 4 Excludes data for the territories.",references,NOT found in MAS
13108660.pdf,"5 Due to processing problems, Ohio data for 2000 are not shown separately but are included in U.S. totals; see Technical notes. NOTE: Data are subject to sampling and/or random variation. For information on the relative standard errors of the data and further discussion, see Technical notes.",references,NOT found in MAS
