source,citation,relation,ID,title,authors,journal,year,fulltext_online_link,fulltext_location
"13129215Prevention and Control of Influenza Recommendations of the Advisory Committee on Immunization Practices (ACIP), 2008","Sy, L., Liu, I., Solano, Z., et. al, Accuracy of influenza vaccination status in a computer-based immunization tracking system of a managed care organization, Vaccine, 2010",cited-by,10.1016/j.vaccine.2010.05.061,Accuracy of influenza vaccination status in a computer-based immunization tracking system of a managed care organization,"[['Lina', 'S.', 'Sy'], ['In-Lu', 'Amy', 'Liu'], ['Zendi', '', 'Solano'], ['T.', 'Craig', 'Cheetham'], ['Marlene', 'M.', 'Lugg'], ['Sharon', 'K.', 'Greene'], ['Eric', 'S.', 'Weintraub'], ['Steven', 'J.', 'Jacobsen']]",Vaccine,2010,"[u'http://www.sciencedirect.com/science/article/pii/S0264410X10007826', u'http://linkinghub.elsevier.com/retrieve/pii/S0264410X10007826']",
"13129215Prevention and Control of Influenza Recommendations of the Advisory Committee on Immunization Practices (ACIP), 2008","Amendola, A., Pariani, E., Vigan√≤, A., et. al, Influenza surveillance in a cohort of HIV-infected children and adolescents immunized against seasonal influenza, Vaccine, 2010",cited-by,10.1016/j.vaccine.2010.01.021,Influenza surveillance in a cohort of HIV-infected children and adolescents immunized against seasonal influenza,"[['Antonella', '', 'Amendola'], ['Elena', '', 'Pariani'], ['Alessandra', '', 'Vigan\xc3\xb2'], ['Paola', '', 'Erba'], ['Alessandra', '', 'Zappa'], ['Vania', '', 'Giacomet'], ['Elisabetta', '', 'Tanzi'], ['Gian', 'Vincenzo', 'Zuccotti'], ['Alessandro', '', 'Zanetti']]",Vaccine,2010,"[u'http://www.sciencedirect.com/science/article/pii/S0264410X10000538', u'http://linkinghub.elsevier.com/retrieve/pii/S0264410X10000538']",
"13129215Prevention and Control of Influenza Recommendations of the Advisory Committee on Immunization Practices (ACIP), 2008","Hashem, A., Flaman, A., Farnsworth, A., et. al, Aurintricarboxylic Acid Is a Potent Inhibitor of Influenza A and B Virus Neuraminidases, PLOS One, 2009",cited-by,10.1371/journal.pone.0008350.t001,Aurintricarboxylic Acid Is a Potent Inhibitor of Influenza A and B Virus Neuraminidases,"[['Anwar', 'M.', 'Hashem'], ['Anathea', 'S.', 'Flaman'], ['Aaron', '', 'Farnsworth'], ['Earl', 'G.', 'Brown'], ['Gary', 'Van', 'Domselaar'], ['Runtao', '', 'He'], ['Xuguang', '', 'Li']]",PLOS One,2009,"[u'http://www.med.uottawa.ca/bmi/assets/documents/dr%20brown/dr_brown11.pdf', u'http://www.medicine.uottawa.ca/bmi/assets/documents/dr%20brown/dr_brown11.pdf', u'http://dx.plos.org/10.1371/journal.pone.0008350', u'http://dx.plos.org/10.1371/journal.pone.0008350.g001', u'http://dx.plos.org/10.1371/journal.pone.0008350.g002', u'http://dx.plos.org/10.1371/journal.pone.0008350.g003', u'http://dx.plos.org/10.1371/journal.pone.0008350.g004', u'http://dx.plos.org/10.1371/journal.pone.0008350.g005', u'http://dx.plos.org/10.1371/journal.pone.0008350.g006', u'http://dx.plos.org/10.1371/journal.pone.0008350.g007', u'http://dx.plos.org/10.1371/journal.pone.0008350.g008', u'http://dx.plos.org/10.1371/journal.pone.0008350.g009', u'http://dx.plos.org/10.1371/journal.pone.0008350.g010', u'http://dx.plos.org/10.1371/journal.pone.0008350.t001']",./output/10325978.pdf/citedby/10.1371~journal.pone.0008350.t001
"13129215Prevention and Control of Influenza Recommendations of the Advisory Committee on Immunization Practices (ACIP), 2008","Uddin, M., Cherkowski, G., Liu, G., et. al, Demographic and socioeconomic determinants of influenza vaccination disparities among university students, Journal of Epidemiology and Community Health, 2009",cited-by,10.1136/jech.2009.090852,Demographic and socioeconomic determinants of influenza vaccination disparities among university students,"[['M.', '', 'Uddin'], ['G.', 'C.', 'Cherkowski'], ['G.', '', 'Liu'], ['J.', '', 'Zhang'], ['A.', 'S.', 'Monto'], ['A.', 'E.', 'Aiello']]",Journal of Epidemiology and Community Health,2009,"[u'http://jech.bmj.com/cgi/doi/10.1136/jech.2009.090852', u'http://dx.doi.org/10.1136/jech.2009.090852']",./output/10325978.pdf/citedby/10.1136~jech.2009.090852
"13129215Prevention and Control of Influenza Recommendations of the Advisory Committee on Immunization Practices (ACIP), 2008","Levy, D., Ambrose, C., Oleka, N., et. al, A survey of pediatricians' attitudes regarding influenza immunization in children, BMC Pediatrics, 2009",cited-by,10.1186/1471-2431-9-8,A survey of pediatricians' attitudes regarding influenza immunization in children,"[['Daniel', 'J', 'Levy'], ['Christopher', 'S', 'Ambrose'], ['Napoleon', '', 'Oleka'], ['Edward', 'B', 'Lewin']]",BMC Pediatrics,2009,"[u'http://www.biomedcentral.com/1471-2431/9/8', u'http://www.springerlink.com/content/5747542834018483', u'http://www.springerlink.com/index/5747542834018483.pdf', u'http://www.biomedcentral.com/content/pdf/1471-2431-9-8.pdf']",./output/10325978.pdf/citedby/10.1186~1471-2431-9-8
"13129215Prevention and Control of Influenza Recommendations of the Advisory Committee on Immunization Practices (ACIP), 2008","Picone, O., Ami, O., Vauloup-Fellous, C., et. al, Pand√©mie de grippe A H1N1 2009¬†et grossesse¬†: √©pid√©miologie, diagnostic et prise en charge, Journal De Gynecologie Obstetrique Et Biologie De La Reproduction, 2009",cited-by,10.1016/j.jgyn.2009.09.016,"Pand√©mie de grippe A H1N1 2009¬†et grossesse¬†: √©pid√©miologie, diagnostic et prise en charge","[['O.', '', 'Picone'], ['O.', '', 'Ami'], ['C.', '', 'Vauloup-Fellous'], ['V.', '', 'Martinez'], ['M.', '', 'Guillet'], ['C.', '', 'Dupont-Bernab\xc3\xa9'], ['A.-C.', '', 'Donnadieu'], ['C.', '', 'Trichot'], ['M.-V.', '', 'Senat'], ['H.', '', 'Fernandez'], ['R.', '', 'Frydman']]",Journal De Gynecologie Obstetrique Et Biologie De La Reproduction,2009,"[u'http://www.sciencedirect.com/science/article/pii/S0368231509002592', u'http://linkinghub.elsevier.com/retrieve/pii/S0368231509002592']",
"13129215Prevention and Control of Influenza Recommendations of the Advisory Committee on Immunization Practices (ACIP), 2008","Madjid, M., Curkendall, S., Blumentals, W., , The Influence of Oseltamivir Treatment on the Risk of Stroke after Influenza Infection, Cardiology, 2009",cited-by,10.1159/000172796,The Influence of Oseltamivir Treatment on the Risk of Stroke after Influenza Infection,"[['Mohammad', '', 'Madjid'], ['Suellen', '', 'Curkendall'], ['William', 'A.', 'Blumentals']]",Cardiology,2009,"[u'http://www.karger.com/doi/10.1159/000172796', u'http://content.karger.com/ProdukteDB/produkte.asp?doi=10.1159/000172796']",./output/10325978.pdf/citedby/10.1159~000172796
"13129215Prevention and Control of Influenza Recommendations of the Advisory Committee on Immunization Practices (ACIP), 2008","Viboud, C., Miller, M., , Health Benefits of Universal Influenza Vaccination Strategy, PLOS Medicine, 2008",cited-by,10.1371/journal.pmed.0050216,Health Benefits of Universal Influenza Vaccination Strategy,"[['C\xc3\xa9cile', '', 'Viboud'], ['Mark', '', 'Miller']]",PLOS Medicine,2008,"[u'http://origem.info/FIC/pdf/Viboud_Miller_HealthBenefits_PLoS08.pdf', u'http://dx.doi.org/10.1371/journal.pmed.0050216', u'http://www.plosmedicine.org/article/info:doi/10.1371/journal.pmed.0050216']",./output/10325978.pdf/citedby/10.1371~journal.pmed.0050216
"13129215Prevention and Control of Influenza Recommendations of the Advisory Committee on Immunization Practices (ACIP), 2008","Casajuana, J., Iglesias, B., F√†bregas, M., et. al, Safety of intramuscular influenza vaccine in patients receiving oral anticoagulation therapy: a single blinded multi-centre randomized controlled clinical trial, BMC Blood Disorders, 2008",cited-by,10.1186/1471-2326-8-1,Safety of intramuscular influenza vaccine in patients receiving oral anticoagulation therapy: a single blinded multi-centre randomized controlled clinical trial,"[['Josep', '', 'Casajuana'], ['Bego\xc3\xb1a', '', 'Iglesias'], ['Mireia', '', 'F\xc3\xa0bregas'], ['Francesc', '', 'Fina'], ['Joan-Antoni', '', 'Vall\xc3\xa8s'], ['Rosa', '', 'Aragon\xc3\xa8s'], ['M\xc3\xa8ncia', '', 'Ben\xc3\xadtez'], ['Edurne', '', 'Zabaleta']]",BMC Blood Disorders,2008,"[u'http://www.springerlink.com/content/2w616142728042l0', u'http://www.biomedcentral.com/1471-2326/8/1', u'http://www.springerlink.com/index/2w616142728042l0.pdf', u'http://www.biomedcentral.com/content/pdf/1471-2326-8-1.pdf']",./output/10325978.pdf/citedby/10.1186~1471-2326-8-1
"13129215Prevention and Control of Influenza Recommendations of the Advisory Committee on Immunization Practices (ACIP), 2008","Breban, R., Vardavas, R., Blower, S., , Inductive Reasoning Games as Influenza Vaccination Models: Mean Field Analysis, , 2006",cited-by,12738931Inductive Reasoning Games as Influenza Vaccination Models: Mean Field Analysis,Inductive Reasoning Games as Influenza Vaccination Models: Mean Field Analysis,"[['Romulus', '', 'Breban'], ['Raffaele', '', 'Vardavas'], ['Sally', '', 'Blower']]",,2006,"[u'http://arxiv.org/abs/q-bio/0608016', u'http://adsabs.harvard.edu/abs/2006q.bio.....8016B']",./output/10325978.pdf/citedby/12738931Inductive Reasoning Games as Influenza Vaccination Models: Mean Field Analysis
"13129215Prevention and Control of Influenza Recommendations of the Advisory Committee on Immunization Practices (ACIP), 2008","Nardo, G., Tilli, S., Pessione, E., et. al, Structural roles of the active site iron(III) ions in catechol 1,2-dioxygenases and differential secondary structure changes in isoenzymes A and B from Acinetobacter radioresistens S13, Archives of Biochemistry and Biophysics, 2004",cited-by,10.1016/j.abb.2004.07.024,"Structural roles of the active site iron(III) ions in catechol 1,2-dioxygenases and differential secondary structure changes in isoenzymes A and B from Acinetobacter radioresistens S13","[['Giovanna', 'Di', 'Nardo'], ['Silvia', '', 'Tilli'], ['Enrica', '', 'Pessione'], ['Maria', '', 'Cavaletto'], ['Carlo', '', 'Giunta'], ['Fabrizio', '', 'Briganti']]",Archives of Biochemistry and Biophysics,2004,[u'http://www.sciencedirect.com/science/article/pii/S000398610400414X'],
"13129215Prevention and Control of Influenza Recommendations of the Advisory Committee on Immunization Practices (ACIP), 2008","Lorenz, R., Sachwitz, M., Schreiber, H., et. al, First operating experiences of beam position monitors in the TELSA Test Facility Linac, , 1997",cited-by,10.1109/PAC.1997.751133,First operating experiences of beam position monitors in the TELSA Test Facility Linac,"[['R.', '', 'Lorenz'], ['M.', '', 'Sachwitz'], ['H.', 'J.', 'Schreiber'], ['E.', '', 'Tonisch'], ['M.', '', 'Castellano'], ['P.', '', 'Patteri'], ['E.', '', 'Tazzioli'], ['L.', '', 'Catani']]",,1997,"[u'http://ieeexplore.ieee.org/stamp/stamp.jsp?arnumber=00751133', u'http://ieeexplore.ieee.org/xpls/abs_all.jsp?arnumber=751133', u'http://adsabs.harvard.edu/abs/1997APS..PAC..9P90L']",./output/10325978.pdf/citedby/10.1109~PAC.1997.751133
"13129215Prevention and Control of Influenza Recommendations of the Advisory Committee on Immunization Practices (ACIP), 2008","Jamieson, D., Honein, M., Rasmussen, S., et. al, the USA, , 0",cited-by,10325978the USA,the USA,"[['Denise', 'J', 'Jamieson'], ['Margaret', 'A', 'Honein'], ['Sonja', 'A', 'Rasmussen'], ['Jennifer', 'L', 'Williams'], ['David', 'L', 'Swerdlow'], ['Matthew', 'S', 'Biggerstaff'], ['Stephen', '', 'Lindstrom'], ['Janice', 'K', 'Louie'], ['Cara', 'M', 'Christ'], ['Susan', 'R', 'Bohm'], ['Vincent', 'P', 'Fonseca'], ['Kathleen', 'A', 'Ritger'], ['Daniel', 'J', 'Kuhles'], ['Paula', '', 'Eggers'], ['Hollianne', '', 'Bruce'], ['Heidi', 'A', 'Davidson'], ['Emily', '', 'Lutterloh'], ['Meghan', 'L', 'Harris'], ['Colleen', '', 'Burke'], ['Noelle', '', 'Cocoros'], ['Lyn', '', 'Finelli'], ['Kitty', 'F', 'MacFarlane'], ['Bo', '', 'Shu'], ['Sonja', 'J', 'Olsen'], ['S', 'A', 'Rasmussen']]",,0,"[u'http://www.amchp.org/MCH-Topics/H-N/Documents/h1n1-pregnancy-usa.pdf', u'http://publish.amchp.org/MCH-Topics/H-N/Documents/h1n1-pregnancy-usa.pdf', u'http://www.degam.de/H1N1/H1N1%202009%20influenza%20virus%20infection%20during%20pregnancy%20in%20the%20USA-Lancet2009.pdf', u'http://www.srlf.org/Data/upload/file/Grippe%20A/100%20-%20H1N1%20pregnant%20-%20Lancet%2029%20july%2009.pdf', u'http://hospitals.unm.edu/h1n1/documents/Jamieson_2009_The-Lancet.pdf', u'http://www.jaog.or.jp/News/influ/H1N1_Lancet_article.pdf', u'http://www.fertilitas.it/centrale/doc/h1n1%202009%20influenza%20virus%20infection%20during%20pregnancy%20in%20the%20usa.pdf', u'http://download.thelancet.com/flatcontentassets/H1N1-flu/epidemiology/epidemiology-72.pdf', u'http://www.apt.ubc.ca/__shared/assets/h1n1_and_pregnancy11927.pdf', u'http://195.134.113.71/hygiene/images/jamieson%20lancet%202009.pdf']",./output/10325978.pdf/citedby/10325978the USA
"13129215Prevention and Control of Influenza Recommendations of the Advisory Committee on Immunization Practices (ACIP), 2008","Brooks, W., Erdman, D., Terebuh, P., et. al, Human Metapneumovirus Infection among Children, Bangladesh, , 0",cited-by,"10702226Human Metapneumovirus Infection among Children, Bangladesh","Human Metapneumovirus Infection among Children, Bangladesh","[['W.', 'Abdullah', 'Brooks'], ['Dean', '', 'Erdman'], ['Pauline', '', 'Terebuh'], ['Alexander', '', 'Klimov'], ['Doli', '', 'Goswami'], ['Amina', 'Tahia', 'Sharmeen'], ['Tasnim', '', 'Azim'], ['Stephen', '', 'Luby'], ['Carolyn', '', 'Bridges'], ['Robert', '', 'Breiman']]",,0,"[u'http://origin.cdc.gov/eid/content/13/10/pdfs/1611.pdf', u'http://www.cdc.gov/EID/content/13/10/pdfs/1611.pdf']","./output/10325978.pdf/citedby/10702226Human Metapneumovirus Infection among Children, Bangladesh"
"13129215Prevention and Control of Influenza Recommendations of the Advisory Committee on Immunization Practices (ACIP), 2008","Nailescu, C., Xu, X., Zhou, H., et. al, Influenza vaccine after pediatric kidney transplant: a Midwest Pediatric Nephrology Consortium study, Pediatric Nephrology, 2011",cited-by,10.1007/s00467-010-1729-1,Influenza vaccine after pediatric kidney transplant: a Midwest Pediatric Nephrology Consortium study,"[['Corina', '', 'Nailescu'], ['Xiyan', '', 'Xu'], ['Hong', '', 'Zhou'], ['Henrietta', '', 'Hall'], ['Amy', 'C.', 'Wilson'], ['Jeffrey', 'D.', 'Leiser'], ['Deepa', 'H.', 'Chand'], ['Rudolph', 'P.', 'Valentini'], ['Diane', '', 'Hebert'], ['John', 'D.', 'Mahan']]",Pediatric Nephrology,2011,"[u'http://www.springerlink.com/index/0487kr46q6v02v11.pdf', u'http://www.springerlink.com/content/0487kr46q6v02v11']",./output/10325978.pdf/citedby/10.1007~s00467-010-1729-1
"13129215Prevention and Control of Influenza Recommendations of the Advisory Committee on Immunization Practices (ACIP), 2008","Yi, H., Kim, M., Back, S., et. al, A novel rat forelimb model of neuropathic pain produced by partial injury of the median and ulnar nerves, European Journal of Pain, 2011",cited-by,10.1016/j.ejpain.2010.09.014,A novel rat forelimb model of neuropathic pain produced by partial injury of the median and ulnar nerves,"[['Hanju', '', 'Yi'], ['Myung', 'Ah', 'Kim'], ['Seung', 'Keun', 'Back'], ['Jong', 'Shin', 'Eun'], ['Heung', 'Sik', 'Na']]",European Journal of Pain,2011,[u'http://www.sciencedirect.com/science/article/pii/S1090380110002405'],
"13129215Prevention and Control of Influenza Recommendations of the Advisory Committee on Immunization Practices (ACIP), 2008","Saha, D., , Dismembered ophiolites in Paleoproterozoic nappe complexes of Kandra and Gurramkonda, South India, Journal of Asian Earth Sciences, 2011",cited-by,10.1016/j.jseaes.2011.04.024,"Dismembered ophiolites in Paleoproterozoic nappe complexes of Kandra and Gurramkonda, South India","[['Dilip', '', 'Saha']]",Journal of Asian Earth Sciences,2011,"[u'http://www.sciencedirect.com/science/article/pii/S1367912011002057', u'http://adsabs.harvard.edu/abs/2011JAESc..42..158S']",./output/10325978.pdf/citedby/10.1016~j.jseaes.2011.04.024
10325978,"Cono J, Cragan JD, Jamieson DJ, Rasmussen SA. Prophylaxis and treatment of pregnant women for emerging infections and bioterrorism emergencies. Emerg Infect Dis 2006; 12: 1631‚Äì37.",references,14108055Prophylaxis and Treatment of Pregnant Women for Emerging Infections and Bioterrorism Emergencies,Prophylaxis and Treatment of Pregnant Women for Emerging Infections and Bioterrorism Emergencies,"[[u'Joanne', u'', u'Cono'], [u'Janet', u'D.', u'Cragan'], [u'Denise', u'J.', u'Jamieson'], [u'Sonja', u'A.', u'Rasmussen']]",,2006,[u'http://198.246.98.21/ncidod/EID/vol12no11/pdfs/06-0618.pdf'],
14108055Prophylaxis and Treatment of Pregnant Women for Emerging Infections and Bioterrorism Emergencies,"Jamieson, D., Honein, M., Rasmussen, S., et. al, H1N1 2009 influenza virus infection during pregnancy in the USA, Lancet, 2009",cited-by,10.1016/S0140-6736(09)61304-0,H1N1 2009 influenza virus infection during pregnancy in the USA,"[['Denise', 'J', 'Jamieson'], ['Margaret', 'A', 'Honein'], ['Sonja', 'A', 'Rasmussen'], ['Jennifer', 'L', 'Williams'], ['David', 'L', 'Swerdlow'], ['Matthew', 'S', 'Biggerstaff'], ['Stephen', '', 'Lindstrom'], ['Janice', 'K', 'Louie'], ['Cara', 'M', 'Christ'], ['Susan', 'R', 'Bohm'], ['Vincent', 'P', 'Fonseca'], ['Kathleen', 'A', 'Ritger'], ['Daniel', 'J', 'Kuhles'], ['Paula', '', 'Eggers'], ['Hollianne', '', 'Bruce'], ['Heidi', 'A', 'Davidson'], ['Emily', '', 'Lutterloh'], ['Meghan', 'L', 'Harris'], ['Colleen', '', 'Burke'], ['Noelle', '', 'Cocoros'], ['Lyn', '', 'Finelli'], ['Kitty', 'F', 'MacFarlane'], ['Bo', '', 'Shu'], ['Sonja', 'J', 'Olsen']]",Lancet,2009,"[u'http://www.sciencedirect.com/science/article/pii/S0140673609613040', u'http://linkinghub.elsevier.com/retrieve/pii/S0140673609613040']",
14108055Prophylaxis and Treatment of Pregnant Women for Emerging Infections and Bioterrorism Emergencies,"Theiler, R., Rasmussen, S., Treadwell, T., et. al, Emerging and Zoonotic Infections in Women, Infectious Disease Clinics of North America, 2008",cited-by,10.1016/j.idc.2008.05.007,Emerging and Zoonotic Infections in Women,"[['Regan', 'N.', 'Theiler'], ['Sonja', 'A.', 'Rasmussen'], ['Tracee', 'A.', 'Treadwell'], ['Denise', 'J.', 'Jamieson']]",Infectious Disease Clinics of North America,2008,"[u'http://www.sciencedirect.com/science/article/pii/S0891552008000470', u'http://linkinghub.elsevier.com/retrieve/pii/S0891552008000470']",./output/10325978.pdf/citedby/10.1016~j.idc.2008.05.007
14108055Prophylaxis and Treatment of Pregnant Women for Emerging Infections and Bioterrorism Emergencies,"Jim√©nez, M., Beitune, P., Salcedo, M., et. al, Outcomes for pregnant women infected with the influenza A (H1N1) virus during the 2009 pandemic in Porto Alegre, Brazil, International Journal of Gynecology & Obstetrics, 2010",cited-by,10.1016/j.ijgo.2010.06.024,"Outcomes for pregnant women infected with the influenza A (H1N1) virus during the 2009 pandemic in Porto Alegre, Brazil","[['Mirela', 'Foresti', 'Jim\xc3\xa9nez'], ['Patr\xc3\xadcia', 'El', 'Beitune'], ['Mila', 'Pontremoli', 'Salcedo'], ['Alexandra', 'Veleda Von', 'Ameln'], ['Fabiane', 'Pinto', 'Mastalir'], ['Luciane', 'Desimon', 'Braun']]",International Journal of Gynecology & Obstetrics,2010,"[u'http://www.sciencedirect.com/science/article/pii/S0020729210003802', u'http://linkinghub.elsevier.com/retrieve/pii/S0020729210003802']",
14108055Prophylaxis and Treatment of Pregnant Women for Emerging Infections and Bioterrorism Emergencies,"Azizi, F., , Islamic Fasting and Health, Annals of Nutrition and Metabolism, 2010",cited-by,10.1159/000295848,Islamic Fasting and Health,"[['Fereidoun', '', 'Azizi']]",Annals of Nutrition and Metabolism,2010,"[u'http://www.karger.com/doi/10.1159/000295848', u'http://content.karger.com/ProdukteDB/produkte.asp?doi=10.1159/000295848']",./output/10325978.pdf/citedby/10.1159~000295848
14108055Prophylaxis and Treatment of Pregnant Women for Emerging Infections and Bioterrorism Emergencies,"Jamieson, D., Honein, M., Rasmussen, S., et. al, the USA, , 0",cited-by,10325978the USA,the USA,"[['Denise', 'J', 'Jamieson'], ['Margaret', 'A', 'Honein'], ['Sonja', 'A', 'Rasmussen'], ['Jennifer', 'L', 'Williams'], ['David', 'L', 'Swerdlow'], ['Matthew', 'S', 'Biggerstaff'], ['Stephen', '', 'Lindstrom'], ['Janice', 'K', 'Louie'], ['Cara', 'M', 'Christ'], ['Susan', 'R', 'Bohm'], ['Vincent', 'P', 'Fonseca'], ['Kathleen', 'A', 'Ritger'], ['Daniel', 'J', 'Kuhles'], ['Paula', '', 'Eggers'], ['Hollianne', '', 'Bruce'], ['Heidi', 'A', 'Davidson'], ['Emily', '', 'Lutterloh'], ['Meghan', 'L', 'Harris'], ['Colleen', '', 'Burke'], ['Noelle', '', 'Cocoros'], ['Lyn', '', 'Finelli'], ['Kitty', 'F', 'MacFarlane'], ['Bo', '', 'Shu'], ['Sonja', 'J', 'Olsen'], ['S', 'A', 'Rasmussen']]",,0,"[u'http://www.amchp.org/MCH-Topics/H-N/Documents/h1n1-pregnancy-usa.pdf', u'http://publish.amchp.org/MCH-Topics/H-N/Documents/h1n1-pregnancy-usa.pdf', u'http://www.degam.de/H1N1/H1N1%202009%20influenza%20virus%20infection%20during%20pregnancy%20in%20the%20USA-Lancet2009.pdf', u'http://www.srlf.org/Data/upload/file/Grippe%20A/100%20-%20H1N1%20pregnant%20-%20Lancet%2029%20july%2009.pdf', u'http://hospitals.unm.edu/h1n1/documents/Jamieson_2009_The-Lancet.pdf', u'http://www.jaog.or.jp/News/influ/H1N1_Lancet_article.pdf', u'http://www.fertilitas.it/centrale/doc/h1n1%202009%20influenza%20virus%20infection%20during%20pregnancy%20in%20the%20usa.pdf', u'http://download.thelancet.com/flatcontentassets/H1N1-flu/epidemiology/epidemiology-72.pdf', u'http://www.apt.ubc.ca/__shared/assets/h1n1_and_pregnancy11927.pdf', u'http://195.134.113.71/hygiene/images/jamieson%20lancet%202009.pdf']",./output/10325978.pdf/citedby/10325978the USA
14108055Prophylaxis and Treatment of Pregnant Women for Emerging Infections and Bioterrorism Emergencies,"Jorgensen, A., Mendoza, G., Henderson, J., , Emergency Preparedness and Disaster Response Core Competency Set for Perinatal and Neonatal Nurses: Emergency Preparedness for Perinatal and Neonatal Nurses, Jognn-journal of Obstetric Gynecologic and Neonatal Nursing, 2010",cited-by,10.1111/j.1552-6909.2010.01157.x,Emergency Preparedness and Disaster Response Core Competency Set for Perinatal and Neonatal Nurses: Emergency Preparedness for Perinatal and Neonatal Nurses,"[['Anne', 'M.', 'Jorgensen'], ['Glenn', 'J.', 'Mendoza'], ['Joy', 'L.', 'Henderson']]",Jognn-journal of Obstetric Gynecologic and Neonatal Nursing,2010,[u'http://blackwell-synergy.com/doi/abs/10.1111/j.1552-6909.2010.01157.x'],
14108055Prophylaxis and Treatment of Pregnant Women for Emerging Infections and Bioterrorism Emergencies,"MARTINEZ, M., MODRIC, S., , Patient variation in veterinary medicine: part I. Influence of altered physiological states: Variability in drug response, Journal of Veterinary Pharmacology and Therapeutics, 2010",cited-by,10.1111/j.1365-2885.2009.01139.x,Patient variation in veterinary medicine: part I. Influence of altered physiological states: Variability in drug response,"[['M.', '', 'MARTINEZ'], ['S.', '', 'MODRIC']]",Journal of Veterinary Pharmacology and Therapeutics,2010,[u'http://blackwell-synergy.com/doi/abs/10.1111/j.1365-2885.2009.01139.x'],
14108055Prophylaxis and Treatment of Pregnant Women for Emerging Infections and Bioterrorism Emergencies,"Lodi, K., Felipe, L., Carvalho, S., et. al, Rational use of antimicrobials in dentistry during pregnancy, , 2009",cited-by,5031616Rational use of antimicrobials in dentistry during pregnancy,Rational use of antimicrobials in dentistry during pregnancy,"[['Karina', 'Bortolin', 'Lodi'], ['Luis', '', 'Felipe'], ['Silva', 'de', 'Carvalho'], ['Cristiane', 'Yumi', 'Koga-Ito'], ['Val\xc3\xa9ria', '', 'Abrantes'], ['Cristiane', '', 'Yumi'], ['Koga', '', 'Ito']]",,2009,[u'http://www.medicinaoral.com/medoralfree01/v14i1/medoralv14i1p15.pdf'],./output/10325978.pdf/citedby/5031616Rational use of antimicrobials in dentistry during pregnancy
10325978,"Lo WY, Friedman JM. Teratogenicity of recently introduced medications in human pregnancy. Obstet Gynecol 2002; 100: 465‚Äì73.",references,10.1016/S0029-7844(02)02122-1,Teratogenicity of recently introduced medications in human pregnancy,"[[u'W.', u'Y', u'Lo'], [u'J.', u'M', u'Friedman']]",Obstetrics and Gynecology,2002,"[u'http://www.sciencedirect.com/science/article/pii/S0029784402021221', u'http://linkinghub.elsevier.com/retrieve/pii/S0029784402021221']",
10.1016/S0029-7844(02)02122-1,"Jamieson, D., Honein, M., Rasmussen, S., et. al, H1N1 2009 influenza virus infection during pregnancy in the USA, Lancet, 2009",cited-by,10.1016/S0140-6736(09)61304-0,H1N1 2009 influenza virus infection during pregnancy in the USA,"[['Denise', 'J', 'Jamieson'], ['Margaret', 'A', 'Honein'], ['Sonja', 'A', 'Rasmussen'], ['Jennifer', 'L', 'Williams'], ['David', 'L', 'Swerdlow'], ['Matthew', 'S', 'Biggerstaff'], ['Stephen', '', 'Lindstrom'], ['Janice', 'K', 'Louie'], ['Cara', 'M', 'Christ'], ['Susan', 'R', 'Bohm'], ['Vincent', 'P', 'Fonseca'], ['Kathleen', 'A', 'Ritger'], ['Daniel', 'J', 'Kuhles'], ['Paula', '', 'Eggers'], ['Hollianne', '', 'Bruce'], ['Heidi', 'A', 'Davidson'], ['Emily', '', 'Lutterloh'], ['Meghan', 'L', 'Harris'], ['Colleen', '', 'Burke'], ['Noelle', '', 'Cocoros'], ['Lyn', '', 'Finelli'], ['Kitty', 'F', 'MacFarlane'], ['Bo', '', 'Shu'], ['Sonja', 'J', 'Olsen']]",Lancet,2009,"[u'http://www.sciencedirect.com/science/article/pii/S0140673609613040', u'http://linkinghub.elsevier.com/retrieve/pii/S0140673609613040']",
10.1016/S0029-7844(02)02122-1,"Barrett, C., Richens, A., , Epilepsy and pregnancy: Report of an Epilepsy Research Foundation Workshop, Epilepsy Research, 2003",cited-by,10.1016/S0920-1211(02)00237-1,Epilepsy and pregnancy: Report of an Epilepsy Research Foundation Workshop,"[['Camilla', '', 'Barrett'], ['Alan', '', 'Richens']]",Epilepsy Research,2003,"[u'http://www.sciencedirect.com/science/article/pii/S0920121102002371', u'http://linkinghub.elsevier.com/retrieve/pii/S0920121102002371']",
