source,citation,relation,ID,title,authors,journal,year,fulltext_online_link,fulltext_location
10.1001/jama.278.3.207,", C., , R., , A lower rate of preterm birth after clotrimazole therapy during pregnancy, Paediatric and Perinatal Epidemiology, 1999",cited-by,10.1046/j.1365-3016.1999.00157.x,A lower rate of preterm birth after clotrimazole therapy during pregnancy,"[['Czeizel', '', ''], ['Rockenbauer', '', '']]",Paediatric and Perinatal Epidemiology,1999,[u'http://www.blackwell-synergy.com/links/doi/10.1046%2Fj.1365-3016.1999.00157.x'],./output/10325978.pdf/citedby/10.1046~j.1365-3016.1999.00157.x
10.1001/jama.278.3.207,"Reiman, M., Kujari, H., Maunu, J., et. al, Does Placental Inflammation Relate to Brain Lesions and Volume in Preterm Infants?, Journal of Pediatrics, 2008",cited-by,10.1016/j.jpeds.2007.09.051,Does Placental Inflammation Relate to Brain Lesions and Volume in Preterm Infants?,"[['Milla', '', 'Reiman'], ['Harry', '', 'Kujari'], ['Jonna', '', 'Maunu'], ['Riitta', '', 'Parkkola'], ['Hellevi', '', 'Rikalainen'], ['Helena', '', 'Lapinleimu'], ['Liisa', '', 'Lehtonen'], ['Leena', '', 'Haataja']]",Journal of Pediatrics,2008,"[u'http://www.sciencedirect.com/science/article/pii/S0022347607009456', u'http://linkinghub.elsevier.com/retrieve/pii/S0022347607009456']",./output/10325978.pdf/citedby/10.1016~j.jpeds.2007.09.051
10.1001/jama.278.3.207,"Blume, H., Li, C., Loch, C., et. al, Intrapartum fever and chorioamnionitis as risks for encephalopathy in term newborns: a case-control study, Developmental Medicine and Child Neurology, 2008",cited-by,10.1111/j.1469-8749.2007.02007.x,Intrapartum fever and chorioamnionitis as risks for encephalopathy in term newborns: a case-control study,"[['Heidi', 'K', 'Blume'], ['Christopher', 'I', 'Li'], ['Christian', 'M', 'Loch'], ['Thomas', 'D', 'Koepsell']]",Developmental Medicine and Child Neurology,2008,[u'http://blackwell-synergy.com/doi/abs/10.1111/j.1469-8749.2007.02007.x'],
10.1001/jama.278.3.207,"Hermansen, M., Hermansen, M., , Perinatal Infections and Cerebral Palsy, Clinics in Perinatology, 2006",cited-by,10.1016/j.clp.2006.03.002,Perinatal Infections and Cerebral Palsy,"[['Marcus', 'C.', 'Hermansen'], ['Mary', 'Goetz', 'Hermansen']]",Clinics in Perinatology,2006,"[u'http://www.sciencedirect.com/science/article/pii/S0095510806000169', u'http://linkinghub.elsevier.com/retrieve/pii/S0095510806000169']",
10.1001/jama.278.3.207,"Garnier, Y., Berger, R., Alm, S., et. al, Systemic endotoxin administration results in increased S100B protein blood levels and periventricular brain white matter injury in the preterm fetal sheep, European Journal of Obstetrics & Gynecology and Reproductive Biology, 2006",cited-by,10.1016/j.ejogrb.2005.05.014,Systemic endotoxin administration results in increased S100B protein blood levels and periventricular brain white matter injury in the preterm fetal sheep,"[['Yves', '', 'Garnier'], ['Richard', '', 'Berger'], ['Stephanie', '', 'Alm'], ['Monika', 'U. von', 'Duering'], ['Audrey', 'B. C.', 'Coumans'], ['Fabrizio', '', 'Michetti'], ['Matteo', '', 'Bruschettini'], ['Mario', '', 'Lituania'], ['Tom', 'H. M.', 'Hasaart'], ['Diego', '', 'Gazzolo']]",European Journal of Obstetrics & Gynecology and Reproductive Biology,2006,"[u'http://www.sciencedirect.com/science/article/pii/S0301211505002356', u'http://linkinghub.elsevier.com/retrieve/pii/S0301211505002356']",
10.1001/jama.278.3.207,"Briscoe, T., Duncan, J., Cock, M., et. al, Activation of NF-Œ∫B transcription factor in the preterm ovine brain and placenta after acute LPS exposure, Journal of Neuroscience Research, 2006",cited-by,10.1002/jnr.20757,Activation of NF-Œ∫B transcription factor in the preterm ovine brain and placenta after acute LPS exposure,"[['T.', '', 'Briscoe'], ['J.', '', 'Duncan'], ['M.', '', 'Cock'], ['J.', '', 'Choo'], ['G.', '', 'Rice'], ['R.', '', 'Harding'], ['J.-P.', 'Y.', 'Scheerlinck'], ['S.', '', 'Rees']]",Journal of Neuroscience Research,2006,[u'http://doi.wiley.com/10.1002/jnr.20757'],./output/10325978.pdf/citedby/10.1002~jnr.20757
10.1001/jama.278.3.207,"Polam, S., Koons, A., Anwar, M., et. al, Effect of Chorioamnionitis on Neurodevelopmental Outcome in Preterm Infants, , 2005",cited-by,13652741Effect of Chorioamnionitis on Neurodevelopmental Outcome in Preterm Infants,Effect of Chorioamnionitis on Neurodevelopmental Outcome in Preterm Infants,"[['Sharadha', '', 'Polam'], ['Anne', '', 'Koons'], ['Mujahid', '', 'Anwar'], ['Susan', '', 'Shen-Schwarz'], ['Thomas', '', 'Hegyi']]",,2005,[u'http://archpedi.ama-assn.org/cgi/reprint/159/11/1032.pdf'],./output/10325978.pdf/citedby/13652741Effect of Chorioamnionitis on Neurodevelopmental Outcome in Preterm Infants
10325978,"Petrova A, Demissie K, Rhoads GG, Smulian JC, Marcella S, Ananth CV. Association of maternal fever during labor with neonatal and infant morbidity and mortality. Obstet Gynecol 2001; 98: 20‚Äì27.",references,10.1016/S0029-7844(01)01361-8,Association of maternal fever during labor with neonatal and infant morbidity and mortality,"[[u'Anna', u'', u'Petrova'], [u'Kitaw', u'', u'Demissie'], [u'George', u'G', u'Rhoads'], [u'John', u'C', u'Smulian'], [u'Stephen', u'', u'Marcella'], [u'Cande', u'V', u'Ananth']]",Obstetrics and Gynecology,2001,"[u'http://www.sciencedirect.com/science/article/pii/S0029784401013618', u'http://linkinghub.elsevier.com/retrieve/pii/S0029784401013618']",
10.1016/S0029-7844(01)01361-8,"Jamieson, D., Honein, M., Rasmussen, S., et. al, H1N1 2009 influenza virus infection during pregnancy in the USA, Lancet, 2009",cited-by,10.1016/S0140-6736(09)61304-0,H1N1 2009 influenza virus infection during pregnancy in the USA,"[['Denise', 'J', 'Jamieson'], ['Margaret', 'A', 'Honein'], ['Sonja', 'A', 'Rasmussen'], ['Jennifer', 'L', 'Williams'], ['David', 'L', 'Swerdlow'], ['Matthew', 'S', 'Biggerstaff'], ['Stephen', '', 'Lindstrom'], ['Janice', 'K', 'Louie'], ['Cara', 'M', 'Christ'], ['Susan', 'R', 'Bohm'], ['Vincent', 'P', 'Fonseca'], ['Kathleen', 'A', 'Ritger'], ['Daniel', 'J', 'Kuhles'], ['Paula', '', 'Eggers'], ['Hollianne', '', 'Bruce'], ['Heidi', 'A', 'Davidson'], ['Emily', '', 'Lutterloh'], ['Meghan', 'L', 'Harris'], ['Colleen', '', 'Burke'], ['Noelle', '', 'Cocoros'], ['Lyn', '', 'Finelli'], ['Kitty', 'F', 'MacFarlane'], ['Bo', '', 'Shu'], ['Sonja', 'J', 'Olsen']]",Lancet,2009,"[u'http://www.sciencedirect.com/science/article/pii/S0140673609613040', u'http://linkinghub.elsevier.com/retrieve/pii/S0140673609613040']",
10.1016/S0029-7844(01)01361-8,"Hofmeyr, G., Haws, R., Bergstr√∂m, S., et. al, Obstetric care in low-resource settings: What, who, and how to overcome challenges to scale up?, International Journal of Gynecology & Obstetrics, 2009",cited-by,10.1016/j.ijgo.2009.07.017,"Obstetric care in low-resource settings: What, who, and how to overcome challenges to scale up?","[['G.', 'Justus', 'Hofmeyr'], ['Rachel', 'A.', 'Haws'], ['Staffan', '', 'Bergstr\xc3\xb6m'], ['Anne', 'CC', 'Lee'], ['Pius', '', 'Okong'], ['Gary', 'L.', 'Darmstadt'], ['Luke', 'C.', 'Mullany'], ['Eh', 'Kalu Shwe', 'Oo'], ['Joy', 'E.', 'Lawn']]",International Journal of Gynecology & Obstetrics,2009,"[u'http://www.sciencedirect.com/science/article/pii/S002072920900366X', u'http://linkinghub.elsevier.com/retrieve/pii/S002072920900366X']",
10.1016/S0029-7844(01)01361-8,"Punyasiri, P., Abeysinghe, I., Kumar, V., et. al, Flavonoid biosynthesis in the tea plant Camellia sinensis: properties of enzymes of the prominent epicatechin and catechin pathways, Archives of Biochemistry and Biophysics, 2004",cited-by,10.1016/j.abb.2004.08.003,Flavonoid biosynthesis in the tea plant Camellia sinensis: properties of enzymes of the prominent epicatechin and catechin pathways,"[['P.', 'A. N.', 'Punyasiri'], ['I.', 'S. B.', 'Abeysinghe'], ['V.', '', 'Kumar'], ['D.', '', 'Treutter'], ['D.', '', 'Duy'], ['C.', '', 'Gosch'], ['S.', '', 'Martens'], ['G.', '', 'Forkmann'], ['T.', 'C.', 'Fischer']]",Archives of Biochemistry and Biophysics,2004,[u'http://www.sciencedirect.com/science/article/pii/S0003986104004497'],
10.1016/S0029-7844(01)01361-8,"Blume, H., Li, C., Loch, C., et. al, Intrapartum fever and chorioamnionitis as risks for encephalopathy in term newborns: a case-control study, Developmental Medicine and Child Neurology, 2008",cited-by,10.1111/j.1469-8749.2007.02007.x,Intrapartum fever and chorioamnionitis as risks for encephalopathy in term newborns: a case-control study,"[['Heidi', 'K', 'Blume'], ['Christopher', 'I', 'Li'], ['Christian', 'M', 'Loch'], ['Thomas', 'D', 'Koepsell']]",Developmental Medicine and Child Neurology,2008,[u'http://blackwell-synergy.com/doi/abs/10.1111/j.1469-8749.2007.02007.x'],
10.1016/S0029-7844(01)01361-8,"Glass, H., Pham, T., Danielsen, B., et. al, Antenatal and Intrapartum Risk Factors for Seizures in Term Newborns: A Population-Based Study, California 1998-2002, Journal of Pediatrics, 2009",cited-by,10.1016/j.jpeds.2008.07.008,"Antenatal and Intrapartum Risk Factors for Seizures in Term Newborns: A Population-Based Study, California 1998-2002","[['Hannah', 'C.', 'Glass'], ['Trinh', 'N.', 'Pham'], ['Beate', '', 'Danielsen'], ['Dena', '', 'Towner'], ['David', '', 'Glidden'], ['Yvonne', 'W.', 'Wu']]",Journal of Pediatrics,2009,"[u'http://www.sciencedirect.com/science/article/pii/S0022347608005854', u'http://linkinghub.elsevier.com/retrieve/pii/S0022347608005854']",./output/10325978.pdf/citedby/10.1016~j.jpeds.2008.07.008
10.1016/S0029-7844(01)01361-8,"Perlman, J., , Hyperthermia in the Delivery: Potential Impact on Neonatal Mortality and Morbidity, Clinics in Perinatology, 2006",cited-by,10.1016/j.clp.2005.11.002,Hyperthermia in the Delivery: Potential Impact on Neonatal Mortality and Morbidity,"[['Jeffrey', 'M.', 'Perlman']]",Clinics in Perinatology,2006,"[u'http://www.sciencedirect.com/science/article/pii/S0095510805001144', u'http://linkinghub.elsevier.com/retrieve/pii/S0095510805001144']",
10.1016/S0029-7844(01)01361-8,"Tasci, Y., Dilbaz, B., Onal, B., et. al, The value of cord blood interleukin-6 levels for predicting chorioamnionitis, funisitis and neonatal infection in term premature rupture of membranes, European Journal of Obstetrics & Gynecology and Reproductive Biology, 2006",cited-by,10.1016/j.ejogrb.2005.11.049,"The value of cord blood interleukin-6 levels for predicting chorioamnionitis, funisitis and neonatal infection in term premature rupture of membranes","[['Yasemin', '', 'Tasci'], ['Berna', '', 'Dilbaz'], ['Binnur', 'Uzmez', 'Onal'], ['Eray', '', 'Caliskan'], ['Serdar', '', 'Dilbaz'], ['Levent', '', 'Doganci'], ['Unsal', '', 'Han']]",European Journal of Obstetrics & Gynecology and Reproductive Biology,2006,"[u'http://www.sciencedirect.com/science/article/pii/S0301211506000376', u'http://linkinghub.elsevier.com/retrieve/pii/S0301211506000376']",
10.1016/S0029-7844(01)01361-8,"Kuczkowski, K., Reisner, L., , Anesthetic management of the parturient with fever and infection, Journal of Clinical Anesthesia, 2003",cited-by,10.1016/S0952-8180(03)00081-3,Anesthetic management of the parturient with fever and infection,"[['Krzysztof', 'M', 'Kuczkowski'], ['Laurence', 'S', 'Reisner']]",Journal of Clinical Anesthesia,2003,"[u'http://www.sciencedirect.com/science/article/pii/S0952818003000813', u'http://linkinghub.elsevier.com/retrieve/pii/S0952818003000813']",./output/10325978.pdf/citedby/10.1016~S0952-8180(03)00081-3
10.1016/S0029-7844(01)01361-8,"Mouihate, A., Harr√©, E., Martin, S., et. al, Suppression of the Febrile Response in Late Gestation: Evidence, Mechanisms and Outcomes, Journal of Neuroendocrinology, 2008",cited-by,10.1111/j.1365-2826.2008.01666.x,"Suppression of the Febrile Response in Late Gestation: Evidence, Mechanisms and Outcomes","[['A.', '', 'Mouihate'], ['E.-M.', '', 'Harr\xc3\xa9'], ['S.', '', 'Martin'], ['Q.', 'J.', 'Pittman']]",Journal of Neuroendocrinology,2008,[u'http://www.blackwell-synergy.com/doi/abs/10.1111/j.1365-2826.2008.01666.x'],./output/10325978.pdf/citedby/10.1111~j.1365-2826.2008.01666.x
10.1016/S0029-7844(01)01361-8,"Shalak, L., Perlman, J., Jackson, G., et. al, Depression at Birth in Term Infants Exposed to Maternal Chorioamnionitis: Does Neonatal Fever Play a Role?, Journal of Perinatology, 2005",cited-by,10.1038/sj.jp.7211326,Depression at Birth in Term Infants Exposed to Maternal Chorioamnionitis: Does Neonatal Fever Play a Role?,"[['Lina', 'F', 'Shalak'], ['Jeffrey', 'M', 'Perlman'], ['Gregory', 'L', 'Jackson'], ['Abbot', 'R', 'Laptook']]",Journal of Perinatology,2005,"[u'http://www.nature.com/doifinder/10.1038/sj.jp.7211326', u'http://dx.doi.org/10.1038/sj.jp.7211326']",./output/10325978.pdf/citedby/10.1038~sj.jp.7211326
10.1016/S0029-7844(01)01361-8,"Hauth, J., , Spontaneous Preterm Labor and Premature Rupture of Membranes at Late Preterm Gestations: To Deliver or Not to Deliver, Seminars in Perinatology, 2006",cited-by,10.1053/j.semperi.2006.02.008,Spontaneous Preterm Labor and Premature Rupture of Membranes at Late Preterm Gestations: To Deliver or Not to Deliver,"[['John', 'C.', 'Hauth']]",Seminars in Perinatology,2006,"[u'http://www.sciencedirect.com/science/article/pii/S0146000506000450', u'http://linkinghub.elsevier.com/retrieve/pii/S0146000506000450']",
10.1016/S0029-7844(01)01361-8,"Saugstad, O., , New guidelines for newborn resuscitation, Acta Paediatrica, 2007",cited-by,10.1111/j.1651-2227.2006.00181.x,New guidelines for newborn resuscitation,"[['Ola', 'Didrik', 'Saugstad']]",Acta Paediatrica,2007,[u'http://www.blackwell-synergy.com/doi/abs/10.1111/j.1651-2227.2006.00181.x'],./output/10325978.pdf/citedby/10.1111~j.1651-2227.2006.00181.x
10.1016/S0029-7844(01)01361-8,"Blond, M., Poulain, P., Gold, F., et. al, Infection bact√©rienne maternof≈ìtale, , 2005",cited-by,10.1016/j.emcgo.2004.08.001,Infection bact√©rienne maternof≈ìtale,"[['M.-H.', '', 'Blond'], ['P.', '', 'Poulain'], ['F.', '', 'Gold'], ['E.', '', 'Bingen'], ['H.', '', 'Watier'], ['R.', '', 'Quentin']]",,2005,"[u'http://www.sciencedirect.com/science/article/pii/S1762614504000204', u'http://linkinghub.elsevier.com/retrieve/pii/S1762614504000204']",
10.1016/S0029-7844(01)01361-8,"Bartholomew, M., Ashkin, E., Schiffman, A., et. al, Maternal temperature variation during parturition, Obstetrics and Gynecology, 2002",cited-by,10.1016/S0029-7844(02)02163-4,Maternal temperature variation during parturition,"[['M.', 'Lisa', 'Bartholomew'], ['Eric', '', 'Ashkin'], ['Amy', '', 'Schiffman'], ['John', 'W', 'Larsen']]",Obstetrics and Gynecology,2002,"[u'http://www.sciencedirect.com/science/article/pii/S0029784402021634', u'http://linkinghub.elsevier.com/retrieve/pii/S0029784402021634']",
10.1016/S0029-7844(01)01361-8,"Jamieson, D., Honein, M., Rasmussen, S., et. al, the USA, , 0",cited-by,10325978the USA,the USA,"[['Denise', 'J', 'Jamieson'], ['Margaret', 'A', 'Honein'], ['Sonja', 'A', 'Rasmussen'], ['Jennifer', 'L', 'Williams'], ['David', 'L', 'Swerdlow'], ['Matthew', 'S', 'Biggerstaff'], ['Stephen', '', 'Lindstrom'], ['Janice', 'K', 'Louie'], ['Cara', 'M', 'Christ'], ['Susan', 'R', 'Bohm'], ['Vincent', 'P', 'Fonseca'], ['Kathleen', 'A', 'Ritger'], ['Daniel', 'J', 'Kuhles'], ['Paula', '', 'Eggers'], ['Hollianne', '', 'Bruce'], ['Heidi', 'A', 'Davidson'], ['Emily', '', 'Lutterloh'], ['Meghan', 'L', 'Harris'], ['Colleen', '', 'Burke'], ['Noelle', '', 'Cocoros'], ['Lyn', '', 'Finelli'], ['Kitty', 'F', 'MacFarlane'], ['Bo', '', 'Shu'], ['Sonja', 'J', 'Olsen'], ['S', 'A', 'Rasmussen']]",,0,"[u'http://www.amchp.org/MCH-Topics/H-N/Documents/h1n1-pregnancy-usa.pdf', u'http://publish.amchp.org/MCH-Topics/H-N/Documents/h1n1-pregnancy-usa.pdf', u'http://www.degam.de/H1N1/H1N1%202009%20influenza%20virus%20infection%20during%20pregnancy%20in%20the%20USA-Lancet2009.pdf', u'http://www.srlf.org/Data/upload/file/Grippe%20A/100%20-%20H1N1%20pregnant%20-%20Lancet%2029%20july%2009.pdf', u'http://hospitals.unm.edu/h1n1/documents/Jamieson_2009_The-Lancet.pdf', u'http://www.jaog.or.jp/News/influ/H1N1_Lancet_article.pdf', u'http://www.fertilitas.it/centrale/doc/h1n1%202009%20influenza%20virus%20infection%20during%20pregnancy%20in%20the%20usa.pdf', u'http://download.thelancet.com/flatcontentassets/H1N1-flu/epidemiology/epidemiology-72.pdf', u'http://www.apt.ubc.ca/__shared/assets/h1n1_and_pregnancy11927.pdf', u'http://195.134.113.71/hygiene/images/jamieson%20lancet%202009.pdf']",./output/10325978.pdf/citedby/10325978the USA
10.1016/S0029-7844(01)01361-8,"Impey, L., Greenwood, C., Black, R., et. al, The relationship between intrapartum maternal fever and neonatal acidosis as risk factors for neonatal encephalopathy, American Journal of Obstetrics and Gynecology, 2008",cited-by,10.1016/j.ajog.2007.06.011,The relationship between intrapartum maternal fever and neonatal acidosis as risk factors for neonatal encephalopathy,"[['Lawrence', 'W. M.', 'Impey'], ['Catherine', 'E. L.', 'Greenwood'], ['Rebecca', 'S.', 'Black'], ['Peter', 'S.-Y.', 'Yeh'], ['Orla', '', 'Sheil'], ['Pat', '', 'Doyle']]",American Journal of Obstetrics and Gynecology,2008,"[u'http://www.sciencedirect.com/science/article/pii/S0002937807007405', u'http://linkinghub.elsevier.com/retrieve/pii/S0002937807007405']",./output/10325978.pdf/citedby/10.1016~j.ajog.2007.06.011
10.1016/S0029-7844(01)01361-8,"Stringer, M., Brooks, P., King, K., et. al, New Guidelines for Maternal and Neonatal Resuscitation, Jognn-journal of Obstetric Gynecologic and Neonatal Nursing, 2007",cited-by,10.1111/j.1552-6909.2007.00195.x,New Guidelines for Maternal and Neonatal Resuscitation,"[['Marilyn', '', 'Stringer'], ['Pamela', 'Mack', 'Brooks'], ['Karen', '', 'King'], ['Babette', '', 'Biesecker']]",Jognn-journal of Obstetric Gynecologic and Neonatal Nursing,2007,[u'http://doi.wiley.com/10.1111/j.1552-6909.2007.00195.x'],./output/10325978.pdf/citedby/10.1111~j.1552-6909.2007.00195.x
10.1016/S0029-7844(01)01361-8,"Wyllie, J., , Resuscitation of the depressed newborn, Seminars in Fetal & Neonatal Medicine, 2006",cited-by,10.1016/j.siny.2006.02.001,Resuscitation of the depressed newborn,"[['Jonathan', '', 'Wyllie']]",Seminars in Fetal & Neonatal Medicine,2006,"[u'http://www.sciencedirect.com/science/article/pii/S1744165X06000187', u'http://linkinghub.elsevier.com/retrieve/pii/S1744165X06000187']",
10.1016/S0029-7844(01)01361-8,"Laburn, H., Faurie, A., Mitchell, D., , The fetus and fever, Journal of Thermal Biology, 2003",cited-by,10.1016/S0306-4565(02)00050-5,The fetus and fever,"[['Helen', 'P.', 'Laburn'], ['Alida', '', 'Faurie'], ['Duncan', '', 'Mitchell']]",Journal of Thermal Biology,2003,"[u'http://www.sciencedirect.com/science/article/pii/S0306456502000505', u'http://linkinghub.elsevier.com/retrieve/pii/S0306456502000505']",
10.1016/S0029-7844(01)01361-8,"Tam, K., Watson, C., Massah, S., et. al, Regulatory function of conserved sequences upstream of the long-wave sensitive opsin genes in teleost fishes, Vision Research, 2011",cited-by,10.1016/j.visres.2011.09.010,Regulatory function of conserved sequences upstream of the long-wave sensitive opsin genes in teleost fishes,"[['Kevin', 'J.', 'Tam'], ['Corey', 'T.', 'Watson'], ['Shabnam', '', 'Massah'], ['Addie', 'M.', 'Kolybaba'], ['Felix', '', 'Breden'], ['Gratien', 'G.', 'Prefontaine'], ['Timothy', 'V.', 'Beischlag']]",Vision Research,2011,[u'http://www.sciencedirect.com/science/article/pii/S0042698911003403'],
10.1016/S0029-7844(01)01361-8,"Schindel, W., , Innovation as emergence: Hybrid agent enablers for evolutionary competence, Procedia Computer Science, 2011",cited-by,10.1016/j.procs.2011.08.019,Innovation as emergence: Hybrid agent enablers for evolutionary competence,"[['William', 'D.', 'Schindel']]",Procedia Computer Science,2011,[u'http://www.sciencedirect.com/science/article/pii/S1877050911004844'],
10.1016/S0029-7844(01)01361-8,"Soenen, M., Migaud, H., Bonnomet, F., et. al, Fractures f√©morales interproth√©tiques¬†: analyse de 14¬†cas. Plaidoyer pour un grade suppl√©mentaire dans les classifications de Vancouver ou de la Sofcot, Resuscitation, 2011",cited-by,10.1016/j.rcot.2011.09.010,Fractures f√©morales interproth√©tiques¬†: analyse de 14¬†cas. Plaidoyer pour un grade suppl√©mentaire dans les classifications de Vancouver ou de la Sofcot,"[['M.', '', 'Soenen'], ['H.', '', 'Migaud'], ['F.', '', 'Bonnomet'], ['J.', '', 'Girard'], ['H.', '', 'Mathevon'], ['M.', '', 'Ehlinger']]",Resuscitation,2011,[u'http://www.sciencedirect.com/science/article/pii/S1877051711005545'],
10.1016/S0029-7844(01)01361-8,"Schouten, F., Wolf, H., Smit, B., et. al, Maternal temperature during labour, Bjog-an International Journal of Obstetrics and Gynaecology, 2008",cited-by,10.1111/j.1471-0528.2008.01781.x,Maternal temperature during labour,"[['FD', '', 'Schouten'], ['H', '', 'Wolf'], ['BJ', '', 'Smit'], ['DJ', '', 'Bekedam'], ['R', 'de', 'Vos'], ['I', '', 'Wahlen']]",Bjog-an International Journal of Obstetrics and Gynaecology,2008,[u'http://blackwell-synergy.com/doi/abs/10.1111/j.1471-0528.2008.01781.x'],
10.1016/S0029-7844(01)01361-8,"Poulain, P., Mercier, C., , √âvaluation du f≈ìtus √† l‚Äôadmission des grossesses ¬´¬†a priori¬†¬ª √† bas risque, Journal De Gynecologie Obstetrique Et Biologie De La Reproduction, 2008",cited-by,10.1016/j.jgyn.2007.11.007,√âvaluation du f≈ìtus √† l‚Äôadmission des grossesses ¬´¬†a priori¬†¬ª √† bas risque,"[['P.', '', 'Poulain'], ['C.', '', 'Mercier']]",Journal De Gynecologie Obstetrique Et Biologie De La Reproduction,2008,"[u'http://www.sciencedirect.com/science/article/pii/S0368231507004589', u'http://linkinghub.elsevier.com/retrieve/pii/S0368231507004589']",
10.1016/S0029-7844(01)01361-8,"Houfflin-Debarge, V., Closset, E., Deruelle, P., , Surveillance du travail dans les situations √† risque, Journal De Gynecologie Obstetrique Et Biologie De La Reproduction, 2008",cited-by,10.1016/j.jgyn.2007.11.014,Surveillance du travail dans les situations √† risque,"[['V.', '', 'Houfflin-Debarge'], ['E.', '', 'Closset'], ['P.', '', 'Deruelle']]",Journal De Gynecologie Obstetrique Et Biologie De La Reproduction,2008,"[u'http://www.sciencedirect.com/science/article/pii/S0368231507004656', u'http://linkinghub.elsevier.com/retrieve/pii/S0368231507004656']",
10.1016/S0029-7844(01)01361-8,"Blume, H., Loch, C., Li, C., , Neonatal Encephalopathy and Socioeconomic Status, , 2007",cited-by,6357024Neonatal Encephalopathy and Socioeconomic Status,Neonatal Encephalopathy and Socioeconomic Status,"[['Heidi', 'K.', 'Blume'], ['Christian', 'M.', 'Loch'], ['Christopher', 'I.', 'Li']]",,2007,[u'http://archpedi.ama-assn.org/cgi/reprint/161/7/663.pdf'],./output/10325978.pdf/citedby/6357024Neonatal Encephalopathy and Socioeconomic Status
10.1016/S0029-7844(01)01361-8,"Makhoul, I., Sprecher, H., Smolkin, T., et. al, Approach to Term Neonates Born After Maternal Intrapartum Fever and Unknown Maternal Group B Streptococcus Status: Value of Serum C-Reactive Protein and 16S rRNA Gene PCR Amplification, Pediatric Infectious Disease Journal, 2007",cited-by,10.1097/INF.0b013e31812f5701,Approach to Term Neonates Born After Maternal Intrapartum Fever and Unknown Maternal Group B Streptococcus Status: Value of Serum C-Reactive Protein and 16S rRNA Gene PCR Amplification,"[['Imad', 'R.', 'Makhoul'], ['Hanna', '', 'Sprecher'], ['Tatiana', '', 'Smolkin'], ['Raneen', '', 'Sawaid'], ['Shlomit', '', 'Ben-David'], ['Polo', '', 'Sujov'], ['Ada', '', 'Tamir'], ['Imad', '', 'Kassis'], ['Shraga', '', 'Blazer']]",Pediatric Infectious Disease Journal,2007,[u'http://content.wkhealth.com/linkback/openurl?sid=WKPTLP:landingpage&an=00006454-200711000-00020'],
10.1016/S0029-7844(01)01361-8,"Helpman, L., Pauzner, D., Lessing, J., et. al, Chorioamnionitis associated with Crohn's disease and azathioprine treatment: a case report, Journal of Medical Microbiology, 2005",cited-by,10.1099/jmm.0.46060-0,Chorioamnionitis associated with Crohn's disease and azathioprine treatment: a case report,"[['L.', '', 'Helpman'], ['David', '', 'Pauzner'], ['Joseph', 'B.', 'Lessing'], ['Michael', 'J.', 'Kupferminc']]",Journal of Medical Microbiology,2005,"[u'http://jmm.sgmjournals.org/cgi/reprint/54/8/803.pdf', u'http://jmm.sgmjournals.org/cgi/doi/10.1099/jmm.0.46060-0']",./output/10325978.pdf/citedby/10.1099~jmm.0.46060-0
10.1016/S0029-7844(01)01361-8,"Petrova, A., Demissie, K., Smulian, J., , Association of maternal fever during labor with neonatal and infant morbidity and mortality, Obstetrics and Gynecology, 2001",cited-by,10.1016/S0029-7844(01)01680-5,Association of maternal fever during labor with neonatal and infant morbidity and mortality,"[['Anna', '', 'Petrova'], ['Kitaw', '', 'Demissie'], ['John', 'C', 'Smulian']]",Obstetrics and Gynecology,2001,"[u'http://www.sciencedirect.com/science/article/pii/S0029784401016805', u'http://linkinghub.elsevier.com/retrieve/pii/S0029784401016805']",
10.1016/S0029-7844(01)01361-8,"Pradayrol, C., Casanovas, A., Casanovas, J., , Influence of O2 and H2O on the spark decomposition of SF6 and SF6+50% CF4 mixtures, , 1996",cited-by,10.1109/ELINSL.1996.549471,Influence of O2 and H2O on the spark decomposition of SF6 and SF6+50% CF4 mixtures,"[['Catherine', '', 'Pradayrol'], ['Anne-Marie', '', 'Casanovas'], ['Joseph', '', 'Casanovas']]",,1996,"[u'http://ieeexplore.ieee.org/stamp/stamp.jsp?arnumber=00549471', u'http://ieeexplore.ieee.org/xpls/abs_all.jsp?arnumber=549471']",./output/10325978.pdf/citedby/10.1109~ELINSL.1996.549471
10.1016/S0029-7844(01)01361-8,"Cremades-Granja, L., Velizquez-Berumen, A., , Proposal for the administrative control of a clinical engineering department, , 1993",cited-by,10.1109/IEMBS.1993.978761,Proposal for the administrative control of a clinical engineering department,"[['L.', '', 'Cremades-Granja'], ['A.', '', 'Velizquez-Berumen']]",,1993,"[u'http://ieeexplore.ieee.org/stamp/stamp.jsp?arnumber=00978761', u'http://ieeexplore.ieee.org/xpls/abs_all.jsp?arnumber=978761']",./output/10325978.pdf/citedby/10.1109~IEMBS.1993.978761
