source,citation string,ID,title,authors,journal,year,fulltext online link,fulltext location
10.1016/j.diagmicrobio.2005.02.007,cited-by,10.1128/JCM.00154-08,Molecular Epidemiology of Methicillin-Resistant Staphylococcus aureus Bloodstream Isolates in Urban Detroit,"[['Thea', '', 'Chua'], ['Carol', 'L.', 'Moore'], ['Mary', 'B.', 'Perri'], ['Susan', 'M.', 'Donabedian'], ['William', '', 'Masch'], ['Dora', '', 'Vager'], ['Susan', 'L.', 'Davis'], ['Kaitlin', '', 'Lulek'], ['Benjamin', '', 'Zimnicki'], ['Marcus', 'J.', 'Zervos']]",Journal of Clinical Microbiology,2008,"[u'http://jcm.asm.org/cgi/reprint/46/7/2345.pdf', u'http://jcm.asm.org/cgi/doi/10.1128/JCM.00154-08']"
10.1016/j.diagmicrobio.2005.02.007,cited-by,10.1016/j.ajic.2007.02.005,Risk factors and mortality in patients with nosocomial Staphylococcus aureus bacteremia,"[['Fu-Der', '', 'Wang'], ['Yin-Yin', '', 'Chen'], ['Te-Li', '', 'Chen'], ['Cheng-Yi', '', 'Liu']]",American Journal of Infection Control,2008,"[u'http://www.sciencedirect.com/science/article/pii/S0196655307004683', u'http://linkinghub.elsevier.com/retrieve/pii/S0196655307004683']"
10.1016/j.diagmicrobio.2005.02.007,cited-by,10.1007/s15010-008-7462-z,"Quantitative Antibiotic Use in Hospitals: Comparison of Measurements, Literature Review, and Recommendations for a Standard of Reporting","[['S.', 'P.', 'Kuster'], ['C.', '', 'Ruef'], ['B.', '', 'Ledergerber'], ['A.', '', 'Hintermann'], ['C.', '', 'Deplazes'], ['L.', '', 'Neuber'], ['R.', '', 'Weber']]",Infection,2008,"[u'http://www.springerlink.com/index/b2730063r508771j.pdf', u'http://www.springerlink.com/content/b2730063r508771j', u'http://www.springerlink.com/index/10.1007/s15010-008-7462-z', u'http://www.springerlink.com/index/pdf/10.1007/s15010-008-7462-z']"
10.1016/j.diagmicrobio.2005.02.007,cited-by,10.1016/j.diagmicrobio.2006.12.017,Use of real-time polymerase chain reaction for identification of methicillin-resistant Staphylococcus aureus directly from positive blood culture bottles,"[['John', '', 'Stratidis'], ['Frank', 'J.', 'Bia'], ['Stephen', 'C.', 'Edberg']]",Diagnostic Microbiology and Infectious Disease,2007,"[u'http://www.sciencedirect.com/science/article/pii/S0732889306005256', u'http://linkinghub.elsevier.com/retrieve/pii/S0732889306005256']"
10.1016/j.diagmicrobio.2005.02.007,cited-by,10.1038/sj.bmt.1705654,"Clinical impact of MRSA in a stem cell transplant unit: analysis before, during and after an MRSA outbreak","[['B', 'E', 'Shaw'], ['T', '', 'Boswell'], ['J', 'L', 'Byrne'], ['C', '', 'Yates'], ['N', 'H', 'Russell']]",Bone Marrow Transplantation,2007,"[u'http://dx.doi.org/10.1038/sj.bmt.1705654', u'http://www.nature.com/doifinder/10.1038/sj.bmt.1705654']"
10.1016/j.diagmicrobio.2005.02.007,cited-by,10.1186/1471-2334-6-125,"Antimicrobial susceptibility patterns and characterization of clinical isolates of Staphylococcus aureus in KwaZulu-Natal province, South Africa","[['Adebayo', 'O', 'Shittu'], ['Johnson', '', 'Lin']]",BMC Infectious Diseases,2006,"[u'http://www.biomedcentral.com/1471-2334/6/125', u'http://www.biomedcentral.com/content/pdf/1471-2334-6-125.pdf', u'http://www.springerlink.com/content/w805231841416672', u'http://www.springerlink.com/index/w805231841416672.pdf']"
10.1016/j.diagmicrobio.2005.02.007,cited-by,10.1016/j.disamonth.2008.09.007,MRSA: An Evolving Pathogen,"[['Mark', 'D.', 'Corriere'], ['Catherine', 'F.', 'Decker']]",Dm Disease-a-month,2008,"[u'http://www.sciencedirect.com/science/article/pii/S0011502908001211', u'http://linkinghub.elsevier.com/retrieve/pii/S0011502908001211']"
10.1016/j.diagmicrobio.2005.02.007,cited-by,10.1128/AAC.00506-06,Lysostaphin in Treatment of Neonatal Staphylococcus aureus Infection,"[['Okunola', '', 'Oluola'], ['Lingkun', '', 'Kong'], ['Mindy', '', 'Fein'], ['Leonard', 'E.', 'Weisman']]",Antimicrobial Agents and Chemotherapy,2007,"[u'http://aac.asm.org/cgi/reprint/51/6/2198.pdf', u'http://aac.asm.org/cgi/doi/10.1128/AAC.00506-06']"
10.1016/j.diagmicrobio.2005.02.007,cited-by,6792396Molecular Epidemiology of Methicillin-Resistant Staphylococcus aureus Bloodstream Isolates in Urban Detroit,Molecular Epidemiology of Methicillin-Resistant Staphylococcus aureus Bloodstream Isolates in Urban Detroit,"[['Thea', '', 'Chua'], ['Carol', 'L.', 'Moore'], ['Mary', 'B.', 'Perri'], ['Susan', 'M.', 'Donabedian'], ['William', '', 'Masch'], ['Dora', '', 'Vager'], ['Susan', 'L.', 'Davis'], ['Kaitlin', '', 'Lulek'], ['Benjamin', '', 'Zimnicki'], ['Marcus', 'J.', 'Zervos']]",,0,[u'http://jcm.asm.org/cgi/reprint/46/7/2345.pdf']
10.1016/j.diagmicrobio.2005.02.007,cited-by,10.1016/j.jinf.2010.07.011,Clinical impact of methicillin resistance on outcome of patients with Staphylococcus aureus infection: A stratified analysis according to underlying diseases and sites of infection in a large prospective cohort,"[['Cheol-In', '', 'Kang'], ['Jae-Hoon', '', 'Song'], ['Doo', 'Ryeon', 'Chung'], ['Kyong', 'Ran', 'Peck'], ['Kwan', 'Soo', 'Ko'], ['Joon-Sup', '', 'Yeom'], ['Shin-Woo', '', 'Kim'], ['Hyun-Ha', '', 'Chang'], ['Yeon-Sook', '', 'Kim'], ['Sook-In', '', 'Jung'], ['Jun', 'Seong', 'Son'], ['Po-Ren', '', 'Hsueh'], ['Thomas', 'Man-kit', 'So'], ['M.', 'K.', 'Lalitha'], ['Yonghong', '', 'Yang'], ['Shao-Guang', '', 'Huang'], ['Hui', '', 'Wang'], ['Quan', '', 'Lu'], ['Celia', 'C.', 'Carlos'], ['Jennifer', 'A.', 'Perera'], ['Cheng-Hsun', '', 'Chiu'], ['Jien-Wei', '', 'Liu'], ['Anan', '', 'Chongthaleong'], ['Visanu', '', 'Thamlikitkul'], ['Hung', 'Van', 'Pham']]",Journal of Infection,2010,"[u'http://www.sciencedirect.com/science/article/pii/S0163445310002082', u'http://linkinghub.elsevier.com/retrieve/pii/S0163445310002082']"
10.1016/j.diagmicrobio.2005.02.007,cited-by,10.1016/j.ijantimicag.2008.03.002,"Antimicrobial resistance: international control strategies, with a focus on limited-resource settings","[['Carlos', 'A.', 'DiazGranados'], ['Denise', 'M.', 'Cardo'], ['John', 'E.', 'McGowan']]",International Journal of Antimicrobial Agents,2008,"[u'http://www.sciencedirect.com/science/article/pii/S0924857908001209', u'http://linkinghub.elsevier.com/retrieve/pii/S0924857908001209']"
10.1016/j.diagmicrobio.2005.02.007,cited-by,10.1016/j.ajic.2006.11.004,"Distribution of resistant gram-positive organisms across the census regions of the United States and in vitro activity of tigecycline, a new glycylcycline antimicrobial","[['Gerald', 'A.', 'Denys'], ['Kim', 'M.', 'Koch'], ['Michael', 'J.', 'Dowzicky']]",American Journal of Infection Control,2007,"[u'http://www.sciencedirect.com/science/article/pii/S0196655307000545', u'http://linkinghub.elsevier.com/retrieve/pii/S0196655307000545']"
10.1016/j.diagmicrobio.2005.02.007,cited-by,10.1157/13086552,Staphylococcus aureus Infections: New Challenges from an Old Pathogen,"[['Zeina', 'A.', 'Kanafani'], ['Vance', 'G.', 'Fowler']]",Enfermedades Infecciosas Y Microbiologia Clinica,2006,"[u'http://www.sciencedirect.com/science/article/pii/S0213005X06737545', u'http://linkinghub.elsevier.com/retrieve/pii/S0213005X06737545']"
10.1016/j.diagmicrobio.2005.02.007,cited-by,10.1016/j.ajic.2008.09.013,Methicillin resistance of airborne coagulase-negative staphylococci in homes of persons having contact with a hospital environment,"[['Danuta', 'O.', 'Lis'], ['Jerzy', 'Z.', 'Pacha'], ['Danuta', '', 'Idzik']]",American Journal of Infection Control,2009,"[u'http://www.sciencedirect.com/science/article/pii/S0196655308007852', u'http://linkinghub.elsevier.com/retrieve/pii/S0196655308007852']"
10.1016/j.diagmicrobio.2005.02.007,cited-by,10.1016/S1473-3099(08)70151-8,Overcrowding and understaffing in modern health-care systems: key determinants in meticillin-resistant Staphylococcus aureus transmission,"[['Archie', '', 'Clements'], ['Kate', '', 'Halton'], ['Nicholas', '', 'Graves'], ['Anthony', '', 'Pettitt'], ['Anthony', '', 'Morton'], ['David', '', 'Looke'], ['Michael', '', 'Whitby']]",Lancet Infectious Diseases,2008,"[u'http://www.sciencedirect.com/science/article/pii/S1473309908701518', u'http://linkinghub.elsevier.com/retrieve/pii/S1473309908701518']"
10.1016/j.diagmicrobio.2005.02.007,cited-by,10.1016/j.diagmicrobio.2008.10.005,"One-year experience with modified BD GeneOhm™ MRSA assay for detection of methicillin-resistant Staphylococcus aureus from pooled nasal, skin, and throat samples","[['Natasa', '', 'Svent-Kucina'], ['Mateja', '', 'Pirs'], ['Manica', '', 'Mueller-Premru'], ['Vesna', '', 'Cvitkovic-Spik'], ['Romina', '', 'Kofol'], ['Katja', '', 'Seme']]",Diagnostic Microbiology and Infectious Disease,2009,"[u'http://www.sciencedirect.com/science/article/pii/S0732889308004380', u'http://linkinghub.elsevier.com/retrieve/pii/S0732889308004380']"
10.1016/j.diagmicrobio.2005.02.007,cited-by,10.1007/s10096-008-0675-3,Methicillin-resistant Staphylococcus aureus bacteraemia and mortality in a teaching hospital,"[['C.', 'J.', 'Beeston'], ['R.', '', 'Gupta'], ['P.', 'R.', 'Chadwick'], ['R.', 'J.', 'Young']]",European Journal of Clinical Microbiology & Infectious Diseases,2009,"[u'http://www.springerlink.com/index/lw620590446637g1.pdf', u'http://www.springerlink.com/content/lw620590446637g1', u'http://www.springerlink.com/index/10.1007/s10096-008-0675-3', u'http://www.springerlink.com/index/pdf/10.1007/s10096-008-0675-3']"
10.1016/j.diagmicrobio.2005.02.007,cited-by,10.1586/14787210.6.4.523,Economics of antibiotic resistance,"[['Oguz', 'Resat', 'Sipahi']]",Expert Review of Anti-infective Therapy,2008,"[u'http://www.sld.cu/galerias/pdf/sitios/apua-cuba/economics_of_antibiotic_resistance.pdf', u'http://www.expert-reviews.com/doi/abs/10.1586/14787210.6.4.523']"
10.1016/j.diagmicrobio.2005.02.007,cited-by,10.1186/1471-2334-9-137,Control of MRSA infection and colonisation in an intensive care unit by GeneOhm MRSA assay and culture methods,"[['Claudia', 'Dalla', 'Valle'], ['Maria', 'Rosalia', 'Pasca'], ['Debora', 'De', 'Vitis'], ['Federico', 'Capra', 'Marzani'], ['Vincenzo', '', 'Emmi'], ['Piero', '', 'Marone']]",BMC Infectious Diseases,2009,"[u'http://www.biomedcentral.com/content/pdf/1471-2334-9-137.pdf', u'http://www.biomedcentral.com/1471-2334/9/137', u'http://www.springerlink.com/index/27w01q43772u515n.pdf', u'http://www.springerlink.com/content/27w01q43772u515n']"
10.1016/j.diagmicrobio.2005.02.007,cited-by,10.1007/s10096-008-0593-4,MRSA detection: comparison of two molecular methods (BD GeneOhm ® PCR assay and  Easy  Plex) with two selective MRSA agars (MRSA-ID and Oxoid MRSA) for nasal swabs,"[['S.', 'J. van', 'Hal'], ['Z.', '', 'Jennings'], ['D.', '', 'Stark'], ['D.', '', 'Marriott'], ['J.', '', 'Harkness']]",European Journal of Clinical Microbiology & Infectious Diseases,2009,"[u'http://www.springerlink.com/index/w7q0763u11042336.pdf', u'http://www.springerlink.com/content/w7q0763u11042336', u'http://www.springerlink.com/index/10.1007/s10096-008-0593-4', u'http://www.springerlink.com/index/pdf/10.1007/s10096-008-0593-4']"
10.1016/j.diagmicrobio.2005.02.007,cited-by,10.1007/s10198-008-0104-7,Cost-effectiveness of linezolid versus vancomycin for hospitalised patients with complicated skin and soft-tissue infections in Germany,"[['Dirk', '', 'Sch\xc3\xbcrmann'], ['Sonja', 'V.', 'Sorensen'], ['Erwin', 'De', 'Cock'], ['Sandeep', '', 'Duttagupta'], ['Ansgar', '', 'Resch']]",European Journal of Health Economics,2009,"[u'http://www.springerlink.com/index/11544r6x39513116.pdf', u'http://www.springerlink.com/content/11544r6x39513116', u'http://www.springerlink.com/index/10.1007/s10198-008-0104-7', u'http://www.springerlink.com/index/pdf/10.1007/s10198-008-0104-7', u'http://hdl.handle.net/10.1007/s10198-008-0104-7']"
10.1016/j.diagmicrobio.2005.02.007,cited-by,10.1109/ICC.1999.768012,Adaptive location management in wireless mobile communications,"[['Jiann-Liang', '', 'Chen'], ['Jyh-Wei', '', 'Wu']]",,1999,"[u'http://ieeexplore.ieee.org/xpls/abs_all.jsp?arnumber=768012', u'http://ieeexplore.ieee.org/stamp/stamp.jsp?arnumber=00768012']"
10.1016/j.diagmicrobio.2005.02.007,cited-by,10.1109/PACRIM.1991.160784,A 3-D nonlinear recursive digital filter for video image processing,"[['P.', 'H.', 'Bauer'], ['W.', '', 'Qian']]",,1991,"[u'http://ieeexplore.ieee.org/stamp/stamp.jsp?arnumber=00160784', u'http://ieeexplore.ieee.org/xpls/abs_all.jsp?arnumber=160784']"
10.1016/j.diagmicrobio.2005.02.007,cited-by,10.1016/j.medmal.2009.01.005,Cost-effectiveness of linezolid versus vancomycin for hospitalized patients with complicated skin and soft-tissue infections in France,"[['E.', 'De', 'Cock'], ['S.', '', 'Sorensen'], ['F.', '', 'Levrat'], ['J.-M.', '', 'Besnier'], ['M.', '', 'Dupon'], ['B.', '', 'Guery'], ['S.', '', 'Duttagupta']]",Medecine Et Maladies Infectieuses,2009,"[u'http://www.sciencedirect.com/science/article/pii/S0399077X09000274', u'http://linkinghub.elsevier.com/retrieve/pii/S0399077X09000274']"
10.1016/j.diagmicrobio.2005.02.007,cited-by,10.1093/qjmed/hcn114,"Development, impact and outcomes of the Hull Bacteraemia Service","[['P.', '', 'Lillie'], ['P.', '', 'Moss'], ['H.', '', 'Thaker'], ['M.', '', 'Parsonage'], ['K.', '', 'Adams'], ['J.', '', 'Meigh'], ['R.', '', 'Meigh'], ['S.', '', 'Mawer'], ['W.', '', 'Dibb'], ['J.', '', 'Wilson'], ['S.', '', 'Musaad'], ['P.', '', ""O'Brien""], ['G.', '', 'Barlow']]",Qjm-an International Journal of Medicine,2008,"[u'http://qjmed.oxfordjournals.org/cgi/reprint/hcn114v1.pdf', u'http://www.qjmed.oxfordjournals.org/cgi/doi/10.1093/qjmed/hcn114']"
10.1016/j.diagmicrobio.2005.02.007,cited-by,12178420Rapid Differentiation of Methicillin-Resistant Staphylococcus aureus and Methicillin-Susceptible Staphylococcus aureus from Blood Cultures by Use of a Direct Cefoxitin Disk Diffusion Test,Rapid Differentiation of Methicillin-Resistant Staphylococcus aureus and Methicillin-Susceptible Staphylococcus aureus from Blood Cultures by Use of a Direct Cefoxitin Disk Diffusion Test,"[['Kelly', '', 'Bennett'], ['Susan', 'E.', 'Sharp']]",,0,[u'http://jcm.asm.org/cgi/reprint/46/11/3836.pdf']
10.1016/j.diagmicrobio.2005.02.007,cited-by,10.1007/s15010-011-0100-1,Clinical impact of methicillin-resistant Staphylococcus aureus bacteremia based on propensity scores,"[['S.', 'Y.', 'Park'], ['J.', 'S.', 'Son'], ['I.', 'H.', 'Oh'], ['J.', 'M.', 'Choi'], ['M.', 'S.', 'Lee']]",Infection,2011,"[u'http://www.springerlink.com/content/dl4617u174u24567', u'http://www.springerlink.com/index/dl4617u174u24567.pdf']"
10.1016/j.diagmicrobio.2005.02.007,cited-by,10.1177/0009922809352805,Staphylococcus aureus Osteomyelitis in Hawaii,"[['Guliz', '', 'Erdem'], ['Raymond', '', 'Salazar'], ['Chieko', '', 'Kimata'], ['Thitiwan', '', 'Simasathien'], ['Kyra', 'A.', 'Len'], ['Lora', '', 'Bergert'], ['Marian', '', 'Melish']]",Clinical Pediatrics,2010,"[u'http://cpj.sagepub.com/cgi/doi/10.1177/0009922809352805', u'http://dx.doi.org/10.1177/0009922809352805']"
10.1016/j.diagmicrobio.2005.02.007,cited-by,10.1245/s10434-010-0923-5,Characteristics and Outcomes of Methicillin-Resistant Staphylococcus aureus Surgical-Site Infections in Patients with Cancer: a Case–Control Study,"[['Roy', 'F.', 'Chemaly'], ['Ray', 'Y.', 'Hachem'], ['Rola', 'N.', 'Husni'], ['Boulos', '', 'Bahna'], ['Georges', 'Abou', 'Rjaili'], ['Alain', '', 'Waked'], ['Linda', '', 'Graviss'], ['B.', 'Nebiyou', 'Bekele'], ['Jharna', 'N.', 'Shah'], ['Issam', 'I.', 'Raad']]",Annals of Surgical Oncology,2010,"[u'http://www.springerlink.com/index/p437u647h52357l2.pdf', u'http://www.springerlink.com/content/p437u647h52357l2', u'http://www.springerlink.com/index/10.1245/s10434-010-0923-5', u'http://www.springerlink.com/index/pdf/10.1245/s10434-010-0923-5']"
10.1016/j.diagmicrobio.2005.02.007,cited-by,10.1016/j.diagmicrobio.2010.02.018,Direct detection of methicillin-resistant Staphylococcus aureus from blood cultures using an immunochromatographic immunoassay-based MRSA rapid kit for the detection of penicillin-binding protein 2a,"[['Kyeong', 'Seob', 'Shin'], ['Hyung', 'Geun', 'Song'], ['Haejung', '', 'Kim'], ['Sangsun', '', 'Yoon'], ['Seung', 'Bok', 'Hong'], ['Sun', 'Hoe', 'Koo'], ['Jimyung', '', 'Kim'], ['Jongwan', '', 'Kim'], ['Kyoung', 'Ho', 'Roh']]",Diagnostic Microbiology and Infectious Disease,2010,"[u'http://www.sciencedirect.com/science/article/pii/S0732889310000544', u'http://linkinghub.elsevier.com/retrieve/pii/S0732889310000544']"
10.1016/j.diagmicrobio.2005.02.007,cited-by,10.1016/j.jhin.2010.02.023,Speed of molecular detection techniques for meticillin-resistant Staphylococcus aureus admission screening in an acute care hospital,"[['K.', '', 'Flor\xc3\xa9'], ['A.-M.', 'Van den', 'Abeele'], ['G.', '', 'Verschraegen']]",Journal of Hospital Infection,2010,"[u'http://www.sciencedirect.com/science/article/pii/S0195670110001180', u'http://linkinghub.elsevier.com/retrieve/pii/S0195670110001180']"
10.1016/j.diagmicrobio.2005.02.007,cited-by,10.1016/j.regg.2009.07.003,Repercusión asistencial y coste hospitalario de la infección por Staphylococcus aureus meticilina resistente en una unidad geriátrica de agudos,"[['Javier', '', 'G\xc3\xb3mez-Pav\xc3\xb3n'], ['Jaime', 'Rodr\xc3\xadguez', 'Salazar'], ['Eva', 'Fern\xc3\xa1ndez de la', 'Puente'], ['Juan', 'Jos\xc3\xa9 Bazt\xc3\xa1n', 'Cort\xc3\xa9s'], ['Isidoro', 'Ruip\xc3\xa9rez', 'Cantera'], ['Isabel', '', 'Gonz\xc3\xa1lez'], ['Rosario', 'Cort\xc3\xa9s', 'Boh\xc3\xb3rquez']]",,2010,"[u'http://www.sciencedirect.com/science/article/pii/S0211139X0900225X', u'http://linkinghub.elsevier.com/retrieve/pii/S0211139X0900225X']"
10.1016/j.diagmicrobio.2005.02.007,cited-by,10.1371/journal.pone.0014011,Different Patterns of Inappropriate Antimicrobial Use in Surgical and Medical Units at a Tertiary Care Hospital in Switzerland: A Prevalence Survey,"[['Alexia', '', 'Cusini'], ['Silvana', 'K.', 'Rampini'], ['Vineeta', '', 'Bansal'], ['Bruno', '', 'Ledergerber'], ['Stefan', 'P.', 'Kuster'], ['Christian', '', 'Ruef'], ['Rainer', '', 'Weber'], ['Aric', '', 'Gregson']]",PLOS One,2010,"[u'http://dx.doi.org/10.1371/journal.pone.0014011', u'http://adsabs.harvard.edu/abs/2010PLoSO...514011C']"
10.1016/j.diagmicrobio.2005.02.007,cited-by,"13605087Characterization of Staphylococcus aureus isolates obtained from health care institutions in Ekiti and Ondo States, South-Western Nigeria","Characterization of Staphylococcus aureus isolates obtained from health care institutions in Ekiti and Ondo States, South-Western Nigeria","[['Clement', 'Olawale', 'Esan'], ['Oladiran', '', 'Famurewa'], ['Johnson', '', 'Lin'], ['Adebayo', 'Osagie', 'Shittu']]",,2009,[u'http://www.academicjournals.org/ajmr/pdf/pdf2009/dec/esan%20et%20al.pdf']
10.1016/j.diagmicrobio.2005.02.007,cited-by,10.1016/S0924-8579(09)70563-1,Early appropriate therapy of Gram-positive bloodstream infections: the conservative use of new drugs,"[['Paolo', 'A.', 'Grossi']]",International Journal of Antimicrobial Agents,2009,"[u'http://www.sciencedirect.com/science/article/pii/S0924857909705631', u'http://linkinghub.elsevier.com/retrieve/pii/S0924857909705631']"
10.1016/j.diagmicrobio.2005.02.007,cited-by,6375321APPLICATIONS OF DECISION ANALYSIS TO HEALTH CARE,APPLICATIONS OF DECISION ANALYSIS TO HEALTH CARE,"[['Reidar', '', 'Hagtvedt']]",,2008,"[u'http://smartech.gatech.edu/dspace/bitstream/1853/22535/1/hagtvedt_reidar_200805_phd.pdf', u'http://smartech.gatech.edu/bitstream/1853/22535/1/hagtvedt_reidar_200805_phd.pdf', u'http://etd.gatech.edu/theses/available/etd-11302007-202448/unrestricted/hagtvedt_reidar_200805_phd.pdf']"
10.1016/j.diagmicrobio.2005.02.007,cited-by,10.1186/1471-2334-8-14,Epidemiology and outcomes of community-onset methicillin-susceptible Staphylococcus aureus bacteraemia in a university hospital in Singapore,"[['Jonathan', 'Wei-Zhong', 'Chia'], ['Li-Yang', '', 'Hsu'], ['Louis', 'Yi-Ann', 'Chai'], ['Paul', 'Ananth', 'Tambyah']]",BMC Infectious Diseases,2008,"[u'http://www.springerlink.com/index/g35ku23m56342h0x.pdf', u'http://www.biomedcentral.com/1471-2334/8/14', u'http://www.biomedcentral.com/content/pdf/1471-2334-8-14.pdf', u'http://www.springerlink.com/content/g35ku23m56342h0x']"
10.1016/j.diagmicrobio.2005.02.007,cited-by,10.1016/j.revmed.2006.11.014,Bactériémies à  Staphylococcus aureus résistant à la méthicilline : aspects épidémiologiques et thérapeutiques récents,"[['E.', '', 'Forestier'], ['V.', '', 'R\xc3\xa9my'], ['M.', '', 'Mohseni-Zadeh'], ['O.', '', 'Lesens'], ['B.', '', 'Jauhlac'], ['D.', '', 'Christmann'], ['Y.', '', 'Hansmann']]",Revue De Medecine Interne,2007,"[u'http://www.sciencedirect.com/science/article/pii/S0248866306007934', u'http://linkinghub.elsevier.com/retrieve/pii/S0248866306007934']"
10.1016/j.diagmicrobio.2005.02.007,cited-by,140289042006 MRSA Summit Steering Committee,2006 MRSA Summit Steering Committee,"[['A.', '', 'Shorr'], ['Thomas', 'P.', 'Lodise']]",,2006,[u'http://www.microresistance.org/docs/ismr-burden-of-mrsa-on-healthcare-cost.pdf']
10.1016/j.diagmicrobio.2005.02.007,cited-by,102206602006 MRSA Summit Steering Committee,2006 MRSA Summit Steering Committee,"[['Dennis', 'L.', 'Stevens'], ['Kamal', 'M. F.', 'Itani']]",,0,[]
10.1016/j.diagmicrobio.2005.02.007,cited-by,"11626460Preventing infection in MRI: Best practices for infection control in and around MRI suites, part I","Preventing infection in MRI: Best practices for infection control in and around MRI suites, part I","[['Peter', 'A.', 'Rothschild']]",,0,"[u'http://www.patientcomfortsystems.com/PR/AuntMinnie_Prevent_Inf_MRI_Part1_062008.pdf', u'http://www.iespcs.com/PR/AuntMinnie_Prevent_Inf_MRI_Part1_062008.pdf']"
10.1016/j.diagmicrobio.2005.02.007,cited-by,13352970Perceptions of Certified Athletic Trainers regarding Methicillin-Resistant Staphylococcus Aureus Prevention Strategies,Perceptions of Certified Athletic Trainers regarding Methicillin-Resistant Staphylococcus Aureus Prevention Strategies,"[['Megan', 'Elizabeth', 'Rittler']]",,0,[u'http://scholar.lib.vt.edu/theses/available/etd-05202009-170637/unrestricted/rittlerdissertation.pdf']
10.1016/j.diagmicrobio.2005.02.007,cited-by,10.1007/978-1-60327-595-8_41,Antimicrobial Resistance: An International Public Health Problem,"[['Carlos', 'A.', 'DiazGranados'], ['John', 'E. Jr.', 'McGowan']]",,0,"[u'http://www.springerlink.com/index/w4k13775308488j7.pdf', u'http://www.springerlink.com/content/w4k13775308488j7']"
10.1016/j.diagmicrobio.2005.02.007,cited-by,10.1016/j.ejpain.2011.07.003,The effect of post-surgical neuroplasticity on the stability of systemic pain perception: A psychophysical study,"[['Michal', '', 'Granot'], ['Irit', '', 'Weissman-Fogel']]",European Journal of Pain,0,[u'http://www.sciencedirect.com/science/article/pii/S1090380111001807']
10.1128~AAC.00338-07,"Lodise, T. P., P. S. McKinnon, L. Swiderski, and M. J. Rybak. 2003. Outcomes analysis of delayed antibiotic treatment for hospital-acquired Staphylococcus aureus bacteremia. Clin. Infect. Dis. 36:1418–1423.",10.1086/375057,Outcomes Analysis of Delayed Antibiotic Treatment for Hospital‐Acquired Staphylococcus aureus Bacteremia,"[[u'Thomas', u'P.', u'Lodise'], [u'Peggy', u'S.', u'McKinnon'], [u'Linda', u'', u'Swiderski'], [u'Michael', u'J.', u'Rybak']]",Clinical Infectious Diseases,2003,[u'http://www.journals.uchicago.edu/doi/abs/10.1086/375057'],./output/10.1128~AAC.00338-07/10.1086~375057
10.1086/375057,cited-by,10.1097/01.CCM.0000217961.75225.E9,Duration of hypotension before initiation of effective antimicrobial therapy is the critical determinant of survival in human septic shock,"[['Anand', '', 'Kumar'], ['Daniel', '', 'Roberts'], ['Kenneth', 'E.', 'Wood'], ['Bruce', '', 'Light'], ['Joseph', 'E.', 'Parrillo'], ['Satendra', '', 'Sharma'], ['Robert', '', 'Suppes'], ['Daniel', '', 'Feinstein'], ['Sergio', '', 'Zanotti'], ['Leo', '', 'Taiberg'], ['David', '', 'Gurka'], ['Aseem', '', 'Kumar'], ['Mary', '', 'Cheang']]",Critical Care Medicine,2006,[u'http://content.wkhealth.com/linkback/openurl?sid=WKPTLP:landingpage&an=00003246-200606000-00001']
10.1086/375057,cited-by,10.1086/502522,"The Impact of Methicillin Resistance in Staphylococcus aureus Bacteremia on Patient Outcomes: Mortality, Length of Stay, and Hospital Charges","[['Sara', 'E.', 'Cosgrove'], ['Youlin', '', 'Qi'], ['Keith', 'S.', 'Kaye'], ['Stephan', '', 'Harbarth'], ['Adolf', 'W.', 'Karchmer'], ['Yehuda', '', 'Carmeli']]",Infection Control and Hospital Epidemiology,2005,[u'http://www.journals.uchicago.edu/doi/abs/10.1086/502522']
10.1086/375057,cited-by,10.1086/524667,Influence of Vancomycin Minimum Inhibitory Concentration on the Treatment of Methicillin‐Resistant Staphylococcus aureus Bacteremia,"[['Alex', '', 'Soriano'], ['Francesc', '', 'Marco'], ['Jose', 'A.', 'Martinez'], ['Elena', '', 'Pisos'], ['Manel', '', 'Almela'], ['Veselka', 'P.', 'Dimova'], ['Dolores', '', 'Alamo'], ['Mar', '', 'Ortega'], ['Josefina', '', 'Lopez'], ['Josep', '', 'Mensa']]",Clinical Infectious Diseases,2008,[u'http://www.journals.uchicago.edu/doi/abs/10.1086/524667']
10.1086/375057,cited-by,10.1128/AAC.49.4.1306-1311.2005,Pseudomonas aeruginosa Bloodstream Infection: Importance of Appropriate Initial Antimicrobial Treatment,"[['Scott', 'T.', 'Micek'], ['Ann', 'E.', 'Lloyd'], ['David', 'J.', 'Ritchie'], ['Richard', 'M.', 'Reichley'], ['Victoria', 'J.', 'Fraser'], ['Marin', 'H.', 'Kollef']]",Antimicrobial Agents and Chemotherapy,2005,[u'http://aac.asm.org/cgi/doi/10.1128/AAC.49.4.1306-1311.2005']
10.1086/375057,cited-by,10.1086/499406,"The Relationship between Antimicrobial Resistance and Patient Outcomes: Mortality, Length of Hospital Stay, and Health Care Costs","[['Sara', 'E.', 'Cosgrove']]",Clinical Infectious Diseases,2006,[u'http://www.journals.uchicago.edu/doi/abs/10.1086/499406']
