source,citation string,ID,title,authors,journal,year,fulltext online link,fulltext location
10.1086/377200,cited-by,10.1371/journal.ppat.0030035,Dynorphin Activates Quorum Sensing Quinolone Signaling in Pseudomonas aeruginosa,"[['Olga', '', 'Zaborina'], ['Francois', '', 'Lepine'], ['Gaoping', '', 'Xiao'], ['Vesta', '', 'Valuckaite'], ['Yimei', '', 'Chen'], ['Terry', '', 'Li'], ['Mae', '', 'Ciancio'], ['Alex', '', 'Zaborin'], ['Elaine', '', 'Petroff'], ['Jerrold', 'R.', 'Turner'], ['Laurence', 'G.', 'Rahme'], ['Eugene', '', 'Chang'], ['John', 'C.', 'Alverdy']]",PLOS Pathogens,2007,"[u'http://dx.plos.org/10.1371/journal.ppat.0030035', u'http://dx.doi.org/10.1371/journal.ppat.0030035']"
10.1086/377200,cited-by,10.1128/AAC.00338-07,Predictors of 30Day Mortality among Patients with Pseudomonas aeruginosa Bloodstream Infections: Impact of Delayed Appropriate Antibiotic Selection,"[['Thomas', 'P.', 'Lodise'], ['N.', '', 'Patel'], ['A.', '', 'Kwa'], ['J.', '', 'Graves'], ['J.', 'P.', 'Furuno'], ['E.', '', 'Graffunder'], ['B.', '', 'Lomaestro'], ['J.', 'C.', 'McGregor']]",Antimicrobial Agents and Chemotherapy,2007,"[u'http://aac.asm.org/cgi/reprint/51/10/3510.pdf', u'http://aac.asm.org/cgi/doi/10.1128/AAC.00338-07']"
10.1086/377200,cited-by,10.1128/JB.01623-06,Identification of Genes Involved in Swarming Motility Using a Pseudomonas aeruginosa PAO1 Mini-Tn5-lux Mutant Library,"[['Joerg', '', 'Overhage'], ['Shawn', '', 'Lewenza'], ['Alexandra', 'K.', 'Marr'], ['Robert', 'E. W.', 'Hancock']]",Journal of Bacteriology,2007,"[u'http://cmdr.ubc.ca/bobh/327_JBac_189_p2164_2007.pdf', u'http://jb.asm.org/cgi/reprint/189/5/2164.pdf', u'http://jb.asm.org/cgi/doi/10.1128/JB.01623-06']"
10.1086/377200,cited-by,10.1093/jac/dkm279,Impact of antibiotic resistance and of adequate empirical antibiotic treatment in the prognosis of patients with Escherichia coli bacteraemia,"[['Galo', '', 'Peralta'], ['M.', 'Blanca', 'Sanchez'], ['J.', 'Carlos', 'Garrido'], ['Ines', 'De', 'Benito'], ['M.', 'Eliecer', 'Cano'], ['L.', '', 'Martinez-Martinez'], ['M.', 'P.', 'Roiz']]",Journal of Antimicrobial Chemotherapy,2007,"[u'http://jac.oxfordjournals.org/cgi/reprint/60/4/855.pdf', u'http://www.jac.oxfordjournals.org/cgi/doi/10.1093/jac/dkm279']"
10.1086/377200,cited-by,10.1086/423382,Bloodstream Infections Caused by Enterobacter Species: Predictors of 30‐Day Mortality Rate and Impact of Broad‐Spectrum Cephalosporin Resistance on Outcome,"[['Wan', 'Beom', 'Park']]",Clinical Infectious Diseases,2004,[u'http://www.journals.uchicago.edu/doi/abs/10.1086/423382']
10.1086/377200,cited-by,11060330Severe Sepsis and Septic Shock: Review of the Literature and Emergency Department Management Guidelines,Severe Sepsis and Septic Shock: Review of the Literature and Emergency Department Management Guidelines,"[['H.', 'Bryant', 'Nguyen'], ['Emanuel', 'P.', 'Rivers'], ['Fredrick', 'M.', 'Abrahamian'], ['Gregory', 'J.', 'Moran'], ['Edward', '', 'Abraham'], ['Stephen', '', 'Trzeciak'], ['David', 'T.', 'Huang'], ['Tiffany', '', 'Osborn'], ['Dennis', '', 'Stevens'], ['David', 'A.', 'Talan']]",,0,"[u'http://kallus.com/er/resident/julycourse/reading/sepsis.pdf', u'https://secure.muhealth.org/~ed/students/articles/aem_48_p0028.pdf', u'http://www.ptolemy.ca/members/archives/2006/gyn/Nguyen2006.pdf']"
10.1086/377200,cited-by,10.1089/mdr.2005.11.68,Risk Factors for Antimicrobial Resistance and Influence of Resistance on Mortality in Patients with Bloodstream Infection Caused by Pseudomonas aeruginosa,"[['Cheol-In', '', 'Kang'], ['Sung-Han', '', 'Kim'], ['Wan', 'Beom', 'Park'], ['Ki-Deok', '', 'Lee'], ['Hong-Bin', '', 'Kim'], ['Eui-Chong', '', 'Kim'], ['Myoung-Don', '', 'Oh'], ['Kang-Won', '', 'Choe']]",Microbial Drug Resistance,2005,[u'http://www.liebertonline.com/doi/abs/10.1089/mdr.2005.11.68']
10.1086/377200,cited-by,10.1016/j.mib.2003.12.009,Analysis of regulatory networks in Pseudomonas aeruginosa by genomewide transcriptional profiling,"[['Andrew', 'L', 'Goodman'], ['Stephen', '', 'Lory']]",Current Opinion in Microbiology,2004,"[u'http://www.sciencedirect.com/science/article/pii/S1369527403001747', u'http://linkinghub.elsevier.com/retrieve/pii/S1369527403001747']"
10.1086/377200,cited-by,10.1128/AAC.00901-06,Impact of Empiric Antibiotic Therapy on Outcomes in Patients with Pseudomonas aeruginosa Bacteremia,"[['Regina', 'B.', 'Osih'], ['Jessina', 'C.', 'McGregor'], ['Shayna', 'E.', 'Rich'], ['Anita', 'C.', 'Moore'], ['Jon', 'P.', 'Furuno'], ['Eli', 'N.', 'Perencevich'], ['Anthony', 'D.', 'Harris']]",Antimicrobial Agents and Chemotherapy,2007,"[u'http://aac.asm.org/cgi/reprint/51/3/839.pdf', u'http://aac.asm.org/cgi/doi/10.1128/AAC.00901-06']"
10.1086/377200,cited-by,10.1086/528712,Outcomes of Bacteremia due to Pseudomonas aeruginosa with Reduced Susceptibility to Piperacillin‐Tazobactam: Implications on the Appropriateness of the Resistance Breakpoint,"[['Vincent', 'H.', 'Tam'], ['Eric', 'A.', 'Gamez'], ['Jaye', 'S.', 'Weston'], ['Laura', 'N.', 'Gerard'], ['Mark', 'T.', 'LaRocco'], ['Juan', 'Pablo', 'Caeiro'], ['Layne', 'O.', 'Gentry'], ['Kevin', 'W.', 'Garey']]",Clinical Infectious Diseases,2008,[u'http://www.journals.uchicago.edu/doi/abs/10.1086/528712']
10.1086/377200,cited-by,6316560Risk Factors for Ineffective Therapy in Patients With Bloodstream Infection,Risk Factors for Ineffective Therapy in Patients With Bloodstream Infection,"[['Jay', 'R.', 'McDonald'], ['N.', 'Deborah', 'Friedman'], ['Jason', 'E.', 'Stout'], ['Daniel', 'J.', 'Sexton'], ['Keith', 'S.', 'Kaye']]",,2005,[u'https://dicon.mc.duke.edu/wysiwyg/downloads/M15_-_McDonald_et_al._RF_for_ineffective_tx_for_MRSA._ArchIM_2005.pdf']
10.1086/377200,cited-by,10.1086/430314,The Rising Influx of Multidrug‐Resistant Gram‐Negative Bacilli into a Tertiary Care Hospital,"[['Erika', 'M. C.', 'D\xe2\x80\x99Agata']]",Clinical Infectious Diseases,2005,[u'http://www.journals.uchicago.edu/doi/abs/10.1086/430314']
10.1086/377200,cited-by,10.1016/j.bbrc.2004.02.050,Lysophospholipase A activity of Pseudomonas aeruginosa type III secretory toxin ExoU,"[['Miki', '', 'Tamura'], ['Temitayo', '', 'Ajayi'], ['Leonard', 'R.', 'Allmond'], ['Kiyoshi', '', 'Moriyama'], ['Jeanine', 'P.', 'Wiener-Kronish'], ['Teiji', '', 'Sawa']]",Biochemical and Biophysical Research Communications,2004,"[u'http://www.sciencedirect.com/science/article/pii/S0006291X04002955', u'http://linkinghub.elsevier.com/retrieve/pii/S0006291X04002955']"
10.1086/377200,cited-by,10.1128/AAC.50.5.1715-1720.2006,Predictors of Mortality in Patients with Bloodstream Infection Due to Ceftazidime-Resistant Klebsiella pneumoniae,"[['Deverick', 'J.', 'Anderson'], ['John', 'J.', 'Engemann'], ['Lizzie', 'J.', 'Harrell'], ['Yehuda', '', 'Carmeli'], ['L.', 'Barth', 'Reller'], ['Keith', 'S.', 'Kaye']]",Antimicrobial Agents and Chemotherapy,2006,"[u'http://aac.asm.org/cgi/reprint/50/5/1715.pdf', u'http://aac.asm.org/cgi/doi/10.1128/AAC.50.5.1715-1720.2006']"
10.1086/377200,cited-by,10.1159/000086574,Importance of Adequate Initial Antimicrobial Therapy,"[['Reuben', '', 'Ramphal']]",Chemotherapy,2005,"[u'http://content.karger.com/ProdukteDB/produkte.asp?doi=10.1159/000086574', u'http://www.karger.com/doi/10.1159/000086574']"
10.1086/377200,cited-by,6249262Fluoroquinolone-resistant Pseudomonas aeruginosa: risk factors for acquisition and impact on outcomes,Fluoroquinolone-resistant Pseudomonas aeruginosa: risk factors for acquisition and impact on outcomes,"[['Donald', 'I.', 'Hsu'], ['Mark', 'P.', 'Okamoto'], ['Rekha', '', 'Murthy'], ['Annie', '', 'Wong-Beringer']]",,2005,"[u'http://jac.oxfordjournals.org/cgi/reprint/dki026v1.pdf', u'http://jac.oxfordjournals.org/cgi/reprint/55/4/535.pdf']"
10.1086/377200,cited-by,10.1586/14787210.6.5.751,Clinical and economic burden of antimicrobial resistance,"[['Lisa', 'L', 'Maragakis'], ['Eli', 'N', 'Perencevich'], ['Sara', 'E', 'Cosgrove']]",Expert Review of Anti-infective Therapy,2008,[u'http://www.expert-reviews.com/doi/abs/10.1586/14787210.6.5.751']
10.1086/377200,cited-by,10.1093/intqhc/mzi095,Reduction of broad-spectrum antibiotic use with computerized decision support in an intensive care unit,"[['KARIN', 'A.', 'THURSKY'], ['KIRSTY', 'L.', 'BUISING'], ['NARIN', '', 'BAK'], ['LACHLAN', '', 'MACGREGOR'], ['C.', 'RAINA', 'MACINTYRE'], ['JEFFREY', 'J.', 'PRESNEILL'], ['JOHN', 'F.', 'CADE'], ['GRAHAM', 'V.', 'BROWN']]",International Journal for Quality in Health Care,2006,"[u'http://intqhc.oxfordjournals.org/cgi/reprint/mzi095v1.pdf', u'http://intqhc.oxfordjournals.org/cgi/reprint/18/3/224.pdf', u'http://intqhc.oxfordjournals.org/cgi/doi/10.1093/intqhc/mzi095']"
10.1086/377200,cited-by,10.1097/CCM.0b013e3181cb0ddf,Bundled care for septic shock: An analysis of clinical trials,"[['Amisha', 'V.', 'Barochia'], ['Xizhong', '', 'Cui'], ['David', '', 'Vitberg'], ['Anthony', 'F.', 'Suffredini'], ['Steven', 'M.', 'Banks'], ['Peter', '', 'Minneci'], ['Steven', 'J.', 'Kern'], ['Robert', 'L.', 'Danner'], ['Charles', '', 'Natanson'], ['Peter', 'Q.', 'Eichacker']]",Critical Care Medicine,2010,[u'http://content.wkhealth.com/linkback/openurl?sid=WKPTLP:landingpage&an=00003246-201002000-00041']
10.1086/377200,cited-by,10.1016/j.jcrc.2007.08.007,Impact of inappropriate antibiotic therapy on mortality in patients with ventilator-associated pneumonia and blood stream infection: A meta-analysis,"[['Effie', 'L.', 'Kuti'], ['Aarti', 'A.', 'Patel'], ['Craig', 'I.', 'Coleman']]",Journal of Critical Care,2008,"[u'http://www.sciencedirect.com/science/article/pii/S0883944107001487', u'http://linkinghub.elsevier.com/retrieve/pii/S0883944107001487']"
10.1086/377200,cited-by,10.1128/AAC.00466-06,Impact of Inactive Empiric Antimicrobial Therapy on Inpatient Mortality and Length of Stay,"[['Kimberly', 'K.', 'Scarsi'], ['Joe', 'M.', 'Feinglass'], ['Marc', 'H.', 'Scheetz'], ['Michael', 'J.', 'Postelnick'], ['Maureen', 'K.', 'Bolon'], ['Gary', 'A.', 'Noskin']]",Antimicrobial Agents and Chemotherapy,2006,"[u'http://aac.asm.org/cgi/reprint/50/10/3355.pdf', u'http://aac.asm.org/cgi/doi/10.1128/AAC.00466-06']"
10.1086/377200,cited-by,10.1007/s00134-006-0355-7,Impact of piperacillin resistance on the outcome of Pseudomonas ventilator-associated pneumonia,"[['Alain', '', 'Combes'], ['Charles-Edouard', '', 'Luyt'], ['Jean-Yves', '', 'Fagon'], ['Michel', '', 'Wolff'], ['Jean-Louis', '', 'Trouillet'], ['Jean', '', 'Chastre']]",Intensive Care Medicine,2006,"[u'http://www.springerlink.com/content/v88w71m29l1k850l', u'http://www.springerlink.com/index/v88w71m29l1k850l.pdf', u'http://www.springerlink.com/index/10.1007/s00134-006-0355-7', u'http://www.springerlink.com/index/pdf/10.1007/s00134-006-0355-7']"
10.1086/377200,cited-by,10.1111/j.1469-0691.2009.02940.x,Preliminary clinical study using a multiplex real-time PCR test for the detection of bacterial and fungal DNA directly in blood,"[['F.', '', 'Wallet'], ['S.', '', 'Nseir'], ['L.', '', 'Baumann'], ['S.', '', 'Herwegh'], ['B.', '', 'Sendid'], ['M.', '', 'Boulo'], ['M.', '', 'Roussel-Delvallez'], ['A.', 'V.', 'Durocher'], ['R.', 'J.', 'Courcol']]",Clinical Microbiology and Infection,2009,[u'http://blackwell-synergy.com/doi/abs/10.1111/j.1469-0691.2009.02940.x']
10.1086/377200,cited-by,10.1016/j.amjmed.2008.03.034,Clinical Significance and Predictors of Community-Onset Pseudomonas aeruginosa Bacteremia,"[['Hae', 'Suk', 'Cheong'], ['Cheol-In', '', 'Kang'], ['Yu', 'Mi', 'Wi'], ['Eun', 'Seok', 'Kim'], ['Jin', 'Seo', 'Lee'], ['Kwan', 'Soo', 'Ko'], ['Doo', 'Ryeon', 'Chung'], ['Nam', 'Yong', 'Lee'], ['Jae-Hoon', '', 'Song'], ['Kyong', 'Ran', 'Peck']]",American Journal of Medicine,2008,"[u'http://www.sciencedirect.com/science/article/pii/S0002934308003574', u'http://linkinghub.elsevier.com/retrieve/pii/S0002934308003574']"
10.1086/377200,cited-by,10.1111/j.1469-0691.2005.01102.x,Clinical features and outcome of patients with community-acquired Pseudomonas aeruginosa bacteraemia,"[['C.-I.', '', 'Kang'], ['S.-H.', '', 'Kim'], ['W.', 'B.', 'Park'], ['K.-D.', '', 'Lee'], ['H.-B.', '', 'Kim'], ['E.-C.', '', 'Kim'], ['M.-D.', '', 'Oh'], ['K.-W.', '', 'Choe']]",Clinical Microbiology and Infection,2005,[u'http://www.blackwell-synergy.com/links/doi/10.1111%2Fj.1469-0691.2005.01102.x']
10.1086/377200,cited-by,10.1016/j.amjmed.2008.03.029,Incidence of Pseudomonas aeruginosa Bacteremia: A Population-Based Study,"[['Majdi', 'N.', 'Al-Hasan'], ['John', 'W.', 'Wilson'], ['Brian', 'D.', 'Lahr'], ['Jeanette', 'E.', 'Eckel-Passow'], ['Larry', 'M.', 'Baddour']]",American Journal of Medicine,2008,"[u'http://www.sciencedirect.com/science/article/pii/S000293430800301X', u'http://linkinghub.elsevier.com/retrieve/pii/S000293430800301X']"
10.1086/377200,cited-by,10.1097/01.shk.0000246899.73315.cb,WHEN TO INCLUDE POLYMYXINS IN THE EMPIRICAL ANTIBIOTIC REGIMEN IN CRITICALLY ILL PATIENTS WITH FEVER? A DECISION ANALYSIS APPROACH,"[['Matthew', 'E.', 'Falagas'], ['Petros', 'I.', 'Rafailidis']]",Shock,2007,[u'http://content.wkhealth.com/linkback/openurl?sid=WKPTLP:landingpage&an=00024382-200706000-00003']
10.1086/377200,cited-by,10.1128/AAC.00851-06,Clinical Prediction Tool To Identify Patients with Pseudomonas aeruginosa Respiratory Tract Infections at Greatest Risk for Multidrug Resistance,"[['Thomas', 'P.', 'Lodise'], ['Christopher', 'D.', 'Miller'], ['Jeffrey', '', 'Graves'], ['Jon', 'P.', 'Furuno'], ['Jessina', 'C.', 'McGregor'], ['Ben', '', 'Lomaestro'], ['Eileen', '', 'Graffunder'], ['Louise-Anne', '', 'McNutt']]",Antimicrobial Agents and Chemotherapy,2007,"[u'http://aac.asm.org/cgi/reprint/51/2/417.pdf', u'http://aac.asm.org/cgi/doi/10.1128/AAC.00851-06']"
10.1086/377200,cited-by,10.1517/14656566.6.6.873,Defining the need for new antimicrobials: clinical and economic implications of resistance in the hospitalised patient,"[['C', 'Andrew', 'DeRyke'], ['Dana', '', 'Maglio'], ['David', 'P', 'Nicolau']]",Expert Opinion on Pharmacotherapy,2005,[u'http://www.informapharmascience.com/doi/abs/10.1517/14656566.6.6.873']
10.1086/377200,cited-by,10.1007/s10096-008-0568-5,Inappropriate initial antimicrobial therapy as a risk factor for mortality in patients with community-onset  Pseudomonas aeruginosa  bacteraemia,"[['H.', 'S.', 'Cheong'], ['C.-I.', '', 'Kang'], ['Y.', 'M.', 'Wi'], ['K.', 'S.', 'Ko'], ['D.', 'R.', 'Chung'], ['N.', 'Y.', 'Lee'], ['J.-H.', '', 'Song'], ['K.', 'R.', 'Peck']]",European Journal of Clinical Microbiology & Infectious Diseases,2008,"[u'http://www.springerlink.com/index/9116h6h412u62158.pdf', u'http://www.springerlink.com/content/9116h6h412u62158', u'http://www.springerlink.com/index/10.1007/s10096-008-0568-5', u'http://www.springerlink.com/index/pdf/10.1007/s10096-008-0568-5']"
10.1086/377200,cited-by,10.1186/cc6153,Diagnosis and treatment of severe sepsis,"[['Yann-Erick', '', 'Claessens'], ['Jean-Fran\xc3\xa7ois', '', 'Dhainaut']]",Critical Care,2007,"[u'http://www.springerlink.com/content/5451621010083n6n', u'http://ccforum.com/content/11/S5/S2', u'http://ccforum.com/supplements/notes/ccv11s5-info.pdf', u'http://www.biomedcentral.com/content/pdf/cc6153.pdf']"
10.1086/377200,cited-by,10.1371/journal.pmed.1000094,The GRADE System for Rating Clinical Guidelines,"[['Brian', 'P.', 'Kavanagh']]",PLOS Medicine,2009,"[u'http://dx.doi.org/10.1371/journal.pmed.1000094', u'http://dx.plos.org/10.1371/journal.pmed.1000094']"
10.1086/377200,cited-by,10.1016/j.idc.2007.09.005,Severe Sepsis and Septic Shock in the Emergency Department,"[['David', 'A.', 'Talan'], ['Gregory', 'J.', 'Moran'], ['Fredrick', 'M.', 'Abrahamian']]",Infectious Disease Clinics of North America,2008,"[u'http://www.sciencedirect.com/science/article/pii/S0891552007000992', u'http://linkinghub.elsevier.com/retrieve/pii/S0891552007000992']"
10.1086/377200,cited-by,10.1186/cc5006,Reappraisal of Pseudomonas aeruginosa hospital-acquired pneumonia mortality in the era of metallo-β-lactamase-mediated multidrug resistance: a prospective observational study,"[['Alexandre', 'Prehn', 'Zavascki'], ['Afonso', 'Lu\xc3\xads', 'Barth'], ['Juliana', 'Fernandez', 'Fernandes'], ['Ana', '', 'Moro'], ['Ana', 'L\xc3\xbacia Saraiva', 'Gon\xc3\xa7alves'], ['Luciano', 'Zubaran', 'Goldani']]",Critical Care,2006,"[u'http://www.springerlink.com/content/xk73785652208188', u'http://ccforum.com/content/10/4/R114', u'http://www.biomedcentral.com/content/pdf/cc5006.pdf', u'http://www.springerlink.com/index/xk73785652208188.pdf']"
10.1086/377200,cited-by,10.1016/j.clinthera.2005.07.004,Simulation of Antibiotic Pharmacodynamic Exposure for the Empiric Treatment of Nosocomial Bloodstream Infections: A Report from the OPTAMA Program,[],Clinical Therapeutics,2005,"[u'http://www.sciencedirect.com/science/article/pii/S014929180500127X', u'http://linkinghub.elsevier.com/retrieve/pii/S014929180500127X']"
10.1086/377200,cited-by,10.1016/j.jinf.2009.01.013,Vancomycin-resistant enterococci bacteremia: Risk factors for mortality and influence of antimicrobial therapy on clinical outcome,"[['Sang', 'Hoon', 'Han'], ['Bum', 'Sik', 'Chin'], ['Han', 'Sung', 'Lee'], ['Su', 'Jin', 'Jeong'], ['Hee', 'Kyoung', 'Choi'], ['Chang', 'Oh', 'Kim'], ['Dongeun', '', 'Yong'], ['Jun', 'Yong', 'Choi'], ['Young', 'Goo', 'Song'], ['Kyungwon', '', 'Lee'], ['June', 'Myung', 'Kim']]",Journal of Infection,2009,"[u'http://www.sciencedirect.com/science/article/pii/S016344530900036X', u'http://linkinghub.elsevier.com/retrieve/pii/S016344530900036X']"
10.1086/377200,cited-by,10.1016/j.diagmicrobio.2007.04.024,Prognosis of adult patients with bacteremia caused by extensively resistant Acinetobacter baumannii,"[['Yu-Chen', '', 'Tseng'], ['Jann-Tay', '', 'Wang'], ['Fe-Lin', 'Lin', 'Wu'], ['Yee-Chun', '', 'Chen'], ['Wei-Chu', '', 'Chie'], ['Shan-Chwen', '', 'Chang']]",Diagnostic Microbiology and Infectious Disease,2007,"[u'http://www.sciencedirect.com/science/article/pii/S0732889307001940', u'http://linkinghub.elsevier.com/retrieve/pii/S0732889307001940']"
10.1086/377200,cited-by,10.1186/1471-2334-6-132,Comparison of severity of illness scoring systems for patients with nosocomial bloodstream infection due to Pseudomonas aeruginosa,"[['Alexandre', 'R', 'Marra'], ['Gonzalo', 'ML', 'Bearman'], ['Richard', 'P', 'Wenzel'], ['Michael', 'B', 'Edmond']]",BMC Infectious Diseases,2006,"[u'http://www.biomedcentral.com/1471-2334/6/132', u'http://www.biomedcentral.com/content/pdf/1471-2334-6-132.pdf', u'http://www.springerlink.com/index/g366562788014h51.pdf', u'http://www.springerlink.com/content/g366562788014h51']"
10.1086/377200,cited-by,10.1007/s15010-009-9145-9,Population-Based Study of the Epidemiology and the Risk Factors for Pseudomonas aeruginosa Bloodstream Infection,"[['M.', 'D.', 'Parkins'], ['D.', 'B.', 'Gregson'], ['J.', 'D. D.', 'Pitout'], ['T.', '', 'Ross'], ['K.', 'B.', 'Laupland']]",Infection,2010,"[u'http://www.springerlink.com/index/7h4105564942087g.pdf', u'http://www.springerlink.com/content/7h4105564942087g', u'http://www.springerlink.com/index/10.1007/s15010-009-9145-9', u'http://www.springerlink.com/index/pdf/10.1007/s15010-009-9145-9']"
10.1086/377200,cited-by,10.1016/j.ijantimicag.2007.06.015,Pseudomonas aeruginosa bloodstream infections: how should we treat them?,"[['Christian', 'van', 'Delden']]",International Journal of Antimicrobial Agents,2007,"[u'http://www.sciencedirect.com/science/article/pii/S0924857907002907', u'http://linkinghub.elsevier.com/retrieve/pii/S0924857907002907']"
10.1086/377200,cited-by,10.1016/j.jhin.2005.03.006,Prognostic factors for nosocomial bacteraemia outcome: a prospective study in a Greek teaching hospital,"[['M.', '', 'Arvanitidou'], ['E.', '', 'Katikaridou'], ['J.', '', 'Douboyas'], ['A.', '', 'Tsakris']]",Journal of Hospital Infection,2005,"[u'http://www.sciencedirect.com/science/article/pii/S0195670105001581', u'http://linkinghub.elsevier.com/retrieve/pii/S0195670105001581']"
10.1086/377200,cited-by,10.1086/518972,Identification of Patients With Pseudomonas aeruginosa Respiratory Tract Infections at Greatest Risk of Infection With Carbapenem‐Resistant Isolates,"[['Chris', '', 'Miller'], ['Nimish', '', 'Patel'], ['Jeffrey', '', 'Graves']]",Infection Control and Hospital Epidemiology,2007,[u'http://www.journals.uchicago.edu/doi/abs/10.1086/518972']
10.1086/377200,cited-by,10.1159/000100388,Risk Factors for Mortality of Nosocomial Bacteraemia in Intensive Care Units,"[['Perihan', 'Ergin', '\xc3\x96zcan'], ['Leyla', '', 'Gulec'], ['Nurhan', '', 'Ince'], ['Simru', '', 'Tugrul'], ['Halit', '', '\xc3\x96zs\xc3\xbct'], ['Nahit', '', 'Cakar'], ['Figen', '', 'Esen'], ['Haluk', '', 'Eraksoy'], ['Semra', '', 'Calangu']]",Medical Principles and Practice,2007,"[u'http://www.karger.com/doi/10.1159/000100388', u'http://content.karger.com/ProdukteDB/produkte.asp?doi=10.1159/000100388']"
10.1086/377200,cited-by,10.1186/1471-2334-6-52,Pseudomonas aeruginosa bloodstream infections: risk factors and treatment outcome related to expression of the PER1 extended-spectrum beta-lactamase,"[['Andrea', '', 'Endimiani'], ['Francesco', '', 'Luzzaro'], ['Beatrice', '', 'Pini'], ['Gianfranco', '', 'Amicosante'], ['Gian', 'Maria', 'Rossolini'], ['Antonio', 'Q', 'Toniolo']]",BMC Infectious Diseases,2006,"[u'http://www.biomedcentral.com/content/pdf/1471-2334-6-52.pdf', u'http://www.springerlink.com/index/g633912mu2uk3714.pdf', u'http://www.biomedcentral.com/1471-2334/6/52', u'http://www.springerlink.com/content/g633912mu2uk3714']"
10.1086/377200,cited-by,10.1016/j.jinf.2005.08.032,Systemic inflammatory response syndrome in adult patients with nosocomial bloodstream infection due to Pseudomonas aeruginosa,"[['Alexandre', 'R.', 'Marra'], ['Katharine', '', 'Bar'], ['Gonzalo', 'M. L.', 'Bearman'], ['Richard', 'P.', 'Wenzel'], ['Michael', 'B.', 'Edmond']]",Journal of Infection,2006,"[u'http://www.sciencedirect.com/science/article/pii/S0163445305002616', u'http://linkinghub.elsevier.com/retrieve/pii/S0163445305002616']"
10.1086/377200,cited-by,10.1086/502492,Clinical Epidemiology of Ciprofloxacin Resistance and Its Relationship to Broad‐Spectrum Cephalosporin Resistance in Bloodstream Infections Caused by Enterobacter Species,"[['Wan', 'Beom', 'Park']]",Infection Control and Hospital Epidemiology,2005,[u'http://www.journals.uchicago.edu/doi/abs/10.1086/502492']
10.1086/377200,cited-by,10.1517/17425255.1.3.351,Pharmacodynamics of antimicrobials: treatment optimisation,"[['Effie', 'L', 'Gillespie'], ['Joseph', 'L', 'Kuti'], ['David', 'P', 'Nicolau']]",Expert Opinion on Drug Metabolism & Toxicology,2005,[u'http://informahealthcare.com/doi/abs/10.1517/17425255.1.3.351']
10.1086/377200,cited-by,6945020Timing of Specimen Collection for Blood Cultures from Febrile Patients with Bacteremia,Timing of Specimen Collection for Blood Cultures from Febrile Patients with Bacteremia,"[['Stefan', '', 'Riedel'], ['Paul', '', 'Bourbeau'], ['Brandi', '', 'Swartz'], ['Steven', '', 'Brecher'], ['Karen', 'C.', 'Carroll'], ['Paul', 'D.', 'Stamper'], ['W.', 'Michael', 'Dunne'], ['Timothy', '', 'McCardle'], ['Nathan', '', 'Walk'], ['Kristin', '', 'Fiebelkorn'], ['David', '', 'Sewell'], ['Sandra', 'S.', 'Richter'], ['Susan', '', 'Beekmann'], ['Gary', 'V.', 'Doern']]",,2008,[u'http://jcm.asm.org/cgi/reprint/46/4/1381.pdf']
10.1086/377200,cited-by,10.1186/cc5019,Antimicrobial resistance and patient outcomes: the hazards of adjustment,"[['Mitchell', 'J', 'Schwaber'], ['Yehuda', '', 'Carmeli']]",Critical Care,2006,"[u'http://www.springerlink.com/index/55715521j21640wn.pdf', u'http://www.springerlink.com/content/55715521j21640wn']"
10.1086/377200,cited-by,11327714Serratia marcescens bacteremia at a medical center in southern Taiwan: high prevalence of cefotaxime resistance,Serratia marcescens bacteremia at a medical center in southern Taiwan: high prevalence of cefotaxime resistance,"[['Hsin-I', '', 'Shih'], ['Hsin-Chun', '', 'Lee'], ['Nan-Yao', '', 'Lee'], ['Chia-Ming', '', 'Chang'], ['Chi-Jung', '', 'Wu'], ['Li-Rong', '', 'Wang'], ['Nai-Ying', '', 'Ko'], ['Wen-Chien', '', 'Ko']]",,0,[u'http://jmii.org/content/pdf/v38n5p350.pdf']
10.1086/377200,cited-by,11818831An 18-case outbreak of drug-resistant Pseudomonas aeruginosa bacteriemia in hematology patients,An 18-case outbreak of drug-resistant Pseudomonas aeruginosa bacteriemia in hematology patients,"[['Jean', 'Baptiste', 'Micol'], ['St\xc3\xa9phane', 'de', 'Botton'], ['Romain', '', 'Guieze'], ['Val\xc3\xa9rie', '', 'Coiteux'], ['St\xc3\xa9phane', '', 'Darre'], ['Rodrigue', '', 'Dessein'], ['Olivier', '', 'Leroy'], ['Ibrahim', '', 'Yakoub-Agha'], ['Bruno', '', 'Quesnel'], ['Francis', '', 'Bauters'], ['Gilles', '', 'Beaucaire'], ['Serge', '', 'Alfandari']]",,0,"[u'http://www.haematologica.it/cgi/reprint/91/8/1134.pdf', u'http://www.haematologica.org/cgi/reprint/91/8/1134.pdf']"
10.1086/377200,cited-by,10.1016/j.diagmicrobio.2009.02.006,Morbidity associated with Pseudomonas aeruginosa bloodstream infections,"[['Marc', 'H.', 'Scheetz'], ['Michael', '', 'Hoffman'], ['Maureen', 'K.', 'Bolon'], ['Grant', '', 'Schulert'], ['Wendy', '', 'Estrellado'], ['Ioannis', 'G.', 'Baraboutis'], ['Padman', '', 'Sriram'], ['Minh', '', 'Dinh'], ['Linda', 'K.', 'Owens'], ['Alan', 'R.', 'Hauser']]",Diagnostic Microbiology and Infectious Disease,2009,"[u'http://www.sciencedirect.com/science/article/pii/S0732889309000637', u'http://linkinghub.elsevier.com/retrieve/pii/S0732889309000637']"
10.1086/377200,cited-by,10.1086/591453,Controlling for Severity of Illness in Outcome Studies Involving Infectious Diseases: Impact of Measurement at Different Time Points ,[],Infection Control and Hospital Epidemiology,2008,[u'http://www.journals.uchicago.edu/doi/abs/10.1086/591453']
