source,citation string,ID,title,authors,journal,year,fulltext online link,fulltext location
3790959Standards of Medical Care in Diabetes—2008,cited-by,10.1016/j.clinthera.2007.11.016,"Mealtime 50/50 basal + prandial insulin analogue mixture with a basal insulin analogue, both plus metformin, in the achievement of target HbA 1c and pre- and postprandial blood glucose levels in patients with type 2 diabetes: A multinational, 24-week, randomized, open-label, parallel-group comparison","[['David', 'C.', 'Robbins'], ['Paul', 'J.', 'Beisswenger'], ['Antonio', '', 'Ceriello'], ['Ronald', 'B.', 'Goldberg'], ['Robert', 'G.', 'Moses'], ['Emmanuil', 'M.', 'Pagkalos'], ['Zvonko', '', 'Milicevic'], ['Cate', 'A.', 'Jones'], ['Samiha', '', 'Sarwat'], ['Meng', 'H.', 'Tan']]",Clinical Therapeutics,2007,"[u'http://www.sciencedirect.com/science/article/pii/S0149291807003657', u'http://linkinghub.elsevier.com/retrieve/pii/S0149291807003657']"
3790959Standards of Medical Care in Diabetes—2008,cited-by,10.1053/j.ajkd.2008.07.048,Conceptual Model of CKD: Applications and Implications,"[['Andrew', 'S.', 'Levey'], ['Lesley', 'A.', 'Stevens'], ['Josef', '', 'Coresh']]",American Journal of Kidney Diseases,2009,"[u'http://www.sciencedirect.com/science/article/pii/S0272638608017186', u'http://linkinghub.elsevier.com/retrieve/pii/S0272638608017186']"
3790959Standards of Medical Care in Diabetes—2008,cited-by,10.1097/01.hjr.0b013e328308ba61,Adherence to a Mediterranean-type diet and reduced prevalence of clustered cardiovascular risk factors in a cohort of 3204 high-risk patients,"[['Ana', '', 'S\xc3\xa1nchez-Ta\xc3\xadnta'], ['Ram\xc3\xb3n', '', 'Estruch'], ['M\xc3\xb3nica', '', 'Bull\xc3\xb3'], ['Dolores', '', 'Corella'], ['Enrique', '', 'G\xc3\xb3mez-Gracia'], ['Miquel', '', 'Fiol'], ['Jaime', '', 'Algorta'], ['Mar\xc3\xada-Isabel', '', 'Covas'], ['Jos\xc3\xa9', '', 'Lapetra'], ['Itziar', '', 'Zazpe'], ['Valentina', '', 'Ruiz-Guti\xc3\xa9rrez'], ['Emilio', '', 'Ros'], ['Miguel', 'A.', 'Mart\xc3\xadnez-Gonz\xc3\xa1lez']]",European Journal of Cardiovascular Prevention & Rehabilitation,2008,"[u'http://predimed.onmedic.net/Portals/0/2008%2013.pdf', u'http://www.sciencedirect.com/science/article/pii/S1741826708155153']"
3790959Standards of Medical Care in Diabetes—2008,cited-by,13856800Evidence-Based Nutrition Practice Guidelines for Diabetes and Scope and Standards of Practice,Evidence-Based Nutrition Practice Guidelines for Diabetes and Scope and Standards of Practice,"[['MARION', 'J.', 'FRANZ'], ['JACKIE', 'L.', 'BOUCHER'], ['JOYCE', '', 'GREEN-PASTORS'], ['MARGARET', 'A.', 'POWERS']]",,2008,[u'http://www.pcrm.org/DoctorsForum/090204/Evidence%20Based%20Nutrition%20Practice%20Guidelines%20for%20Diabetes%20and%20Scope%20and%20Standards%20of%20Pracitce.pdf']
3790959Standards of Medical Care in Diabetes—2008,cited-by,10.1089/dia.2007.0293,Characterizing Glucose Exposure for Individuals with Normal Glucose Tolerance Using Continuous Glucose Monitoring and Ambulatory Glucose Profile Analysis,"[['Roger', 'S.', 'Mazze'], ['Ellie', '', 'Strock'], ['David', '', 'Wesley'], ['Sarah', '', 'Borgman'], ['Blaine', '', 'Morgan'], ['Richard', '', 'Bergenstal'], ['Robert', '', 'Cuddihy']]",Diabetes Technology & Therapeutics,2008,[u'http://www.liebertonline.com/doi/abs/10.1089/dia.2007.0293']
3790959Standards of Medical Care in Diabetes—2008,cited-by,10.1089/dia.2008.0016,Clinical Application of Emerging Sensor Technologies in Diabetes Management: Consensus Guidelines for Continuous Glucose Monitoring (CGM),"[['Irl', 'B.', 'Hirsch'], ['Dana', '', 'Armstrong'], ['Richard', 'M.', 'Bergenstal'], ['Bruce', '', 'Buckingham'], ['Belinda', 'P.', 'Childs'], ['William', 'L.', 'Clarke'], ['Anne', '', 'Peters'], ['Howard', '', 'Wolpert']]",Diabetes Technology & Therapeutics,2008,[u'http://www.liebertonline.com/doi/abs/10.1089/dia.2008.0016']
3790959Standards of Medical Care in Diabetes—2008,cited-by,10.1007/s11883-008-0062-7,Rosiglitazone and cardiovascular risk,"[['Sanjay', '', 'Kaul'], ['George', 'A.', 'Diamond']]",Current Atherosclerosis Reports,2008,"[u'http://www.springerlink.com/index/n921832300156724.pdf', u'http://www.springerlink.com/content/n921832300156724', u'http://www.springerlink.com/index/10.1007/s11883-008-0062-7', u'http://www.springerlink.com/index/pdf/10.1007/s11883-008-0062-7']"
3790959Standards of Medical Care in Diabetes—2008,cited-by,10.1007/s00125-007-0616-1,"Estimated glomerular filtration rate, albuminuria and mortality in type 2 diabetes: the Casale Monferrato study","[['G.', '', 'Bruno'], ['F.', '', 'Merletti'], ['G.', '', 'Bargero'], ['G.', '', 'Novelli'], ['D.', '', 'Melis'], ['A.', '', 'Soddu'], ['M.', '', 'Perotto'], ['G.', '', 'Pagano'], ['P.', '', 'Cavallo-Perin']]",Diabetologia,2007,"[u'http://www.springerlink.com/index/q82h83337162568k.pdf', u'http://www.springerlink.com/content/q82h83337162568k', u'http://www.springerlink.com/index/10.1007/s00125-007-0616-1', u'http://www.springerlink.com/index/pdf/10.1007/s00125-007-0616-1']"
3790959Standards of Medical Care in Diabetes—2008,cited-by,10.1186/1741-7015-4-30,Chronic kidney disease care delivered by US family medicine and internal medicine trainees: results from an online survey,"[['Oliver', '', 'Lenz'], ['Alessia', '', 'Fornoni']]",BMC Medicine,2006,"[u'http://www.springerlink.com/content/050783675732017g', u'http://www.biomedcentral.com/content/pdf/1741-7015-4-30.pdf', u'http://www.biomedcentral.com/1741-7015/4/30', u'http://www.springerlink.com/index/050783675732017g.pdf']"
3790959Standards of Medical Care in Diabetes—2008,cited-by,10121564DIAgNOsIs AND MANAgEMENT Of PREDIAbETEs IN ThE CONTINuuM Of hyPERglyCEMIA—WhEN DO ThE RIsks Of DIAbETEs bEgIN? A CONsENsus sTATEMENT fROM ThE AMERICAN COllEgE Of ENDOCRINOlOgy AND ThE AMERICAN AssOCIATION Of ClINICAl ENDOCRINOlOgIsTs,DIAgNOsIs AND MANAgEMENT Of PREDIAbETEs IN ThE CONTINuuM Of hyPERglyCEMIA—WhEN DO ThE RIsks Of DIAbETEs bEgIN? A CONsENsus sTATEMENT fROM ThE AMERICAN COllEgE Of ENDOCRINOlOgy AND ThE AMERICAN AssOCIATION Of ClINICAl ENDOCRINOlOgIsTs,"[['Alan', 'J.', 'Garber'], ['Yehuda', '', 'Handelsman'], ['Daniel', '', 'Einhorn'], ['Donald', 'A.', 'Bergman'], ['Zachary', 'T.', 'Bloomgarden'], ['Vivian', '', 'Fonseca'], ['W.', 'Timothy', 'Garvey'], ['James', 'R. Gavin', 'III'], ['George', '', 'Grunberger'], ['Edward', 'S.', 'Horton'], ['Paul', 'S.', 'Jellinger'], ['Kenneth', 'L.', 'Jones'], ['Harold', '', 'Lebovitz'], ['Philip', '', 'Levy'], ['Darren', 'K.', 'McGuire'], ['Etie', 'S.', 'Moghissi'], ['Richard', 'W.', 'Nesto']]",,0,"[u'http://www.aace.com/pub/pdf/guidelines/prediabetesConsensus.pdf', u'http://www.aace.com/meetings/consensus/hyperglycemia/hyperglycemia.pdf', u'http://www.aace.com/meetings/consensus/hyperglycemia/hyperglycemia.pdf?dbp']"
3790959Standards of Medical Care in Diabetes—2008,cited-by,10227184AACVPR/ACC/AHA 2007 Performance Measures on Cardiac Rehabilitation for Referral to and Delivery of Cardiac Rehabilitation/Secondary Prevention Services,AACVPR/ACC/AHA 2007 Performance Measures on Cardiac Rehabilitation for Referral to and Delivery of Cardiac Rehabilitation/Secondary Prevention Services,"[['Randal', 'J.', 'Thomas'], ['Marjorie', '', 'King'], ['Neil', '', 'Oldridge'], ['Ileana', 'L.', 'Pi\xc3\xb1a'], ['John', '', 'Spertus']]",,0,[u'http://www.macvpr.org/pdfs/crperformance_measures_jcrpsept07.pdf']
3790959Standards of Medical Care in Diabetes—2008,cited-by,11356080State of Diabetes Care in the United States,State of Diabetes Care in the United States,"[['Lawrence', '', 'Blonde']]",,0,[u'http://www.hcplive.com/_micro/ajmc/_picture/folder_12/A169_07aprl_BlondeS36toS40.pdf']
3790959Standards of Medical Care in Diabetes—2008,cited-by,10.1007/s00125-009-1369-9,Masked nocturnal hypertension—a novel marker of risk in type 2 diabetes,"[['M.', '', 'Wijkman'], ['T.', '', 'L\xc3\xa4nne'], ['J.', '', 'Engvall'], ['T.', '', 'Lindstr\xc3\xb6m'], ['C.', 'J.', '\xc3\x96stgren'], ['F.', 'H.', 'Nystrom']]",Diabetologia,2009,"[u'http://www.springerlink.com/index/2115130274xp0312.pdf', u'http://www.springerlink.com/content/2115130274xp0312', u'http://www.springerlink.com/index/10.1007/s00125-009-1369-9', u'http://www.springerlink.com/index/pdf/10.1007/s00125-009-1369-9']"
3790959Standards of Medical Care in Diabetes—2008,cited-by,10.1016/S0140-6736(09)60870-9,"Effect of the dual peroxisome proliferator-activated receptor-α/γ agonist aleglitazar on risk of cardiovascular disease in patients with type 2 diabetes (SYNCHRONY): a phase II, randomised, dose-ranging study","[['Robert', 'R', 'Henry'], ['A', 'Michael', 'Lincoff'], ['Sunder', '', 'Mudaliar'], ['Michael', '', 'Rabbia'], ['Cathy', '', 'Chognot'], ['Matthias', '', 'Herz']]",Lancet,2009,"[u'http://www.sciencedirect.com/science/article/pii/S0140673609608709', u'http://linkinghub.elsevier.com/retrieve/pii/S0140673609608709']"
3790959Standards of Medical Care in Diabetes—2008,cited-by,10.1007/s00268-009-0062-y,Obesity and Diabetes: The Impact of Bariatric Surgery on Type2 Diabetes,"[['John', 'B.', 'Dixon']]",World Journal of Surgery,2009,"[u'http://www.springerlink.com/content/3740726v50l202rm', u'http://www.springerlink.com/index/3740726v50l202rm.pdf', u'http://www.springerlink.com/index/10.1007/s00268-009-0062-y', u'http://www.springerlink.com/index/pdf/10.1007/s00268-009-0062-y']"
3790959Standards of Medical Care in Diabetes—2008,cited-by,10.1517/13543784.17.2.145,Glucokinase activators in diabetes management,"[['Matthew', '', 'Coghlan'], ['Brendan', '', 'Leighton']]",Expert Opinion on Investigational Drugs,2008,[u'http://www.informapharmascience.com/doi/abs/10.1517/13543784.17.2.145']
3790959Standards of Medical Care in Diabetes—2008,cited-by,10.1016/j.nut.2007.10.008,A randomized clinical trial comparing low–glycemic index versus ADA dietary education among individuals with type 2 diabetes,"[['Yunsheng', '', 'Ma'], ['Barbara', 'C.', 'Olendzki'], ['Philip', 'A.', 'Merriam'], ['David', 'E.', 'Chiriboga'], ['Annie', 'L.', 'Culver'], ['Wenjun', '', 'Li'], ['James', 'R.', 'H\xc3\xa9bert'], ['Ira', 'S.', 'Ockene'], ['Jennifer', 'A.', 'Griffith'], ['Sherry', 'L.', 'Pagoto']]",Nutrition,2008,"[u'http://www.sciencedirect.com/science/article/pii/S0899900707003140', u'http://linkinghub.elsevier.com/retrieve/pii/S0899900707003140']"
3790959Standards of Medical Care in Diabetes—2008,cited-by,10.1016/S1098-3597(07)80025-1,Cardiovascular disease and modifiable cardiometabolic risk factors,"[['Christopher', 'P.', 'Cannon']]",Clinical Cornerstone,2007,"[u'http://www.sciencedirect.com/science/article/pii/S1098359707800251', u'http://linkinghub.elsevier.com/retrieve/pii/S1098359707800251']"
3790959Standards of Medical Care in Diabetes—2008,cited-by,10.1016/j.diabet.2006.11.007,Continuous glucose monitoring in patients with type 2 diabetes: Why? When? Whom?,"[['L.', '', 'Monnier'], ['C.', '', 'Colette'], ['C.', '', 'Boegner'], ['T.', 'C.', 'Pham'], ['H.', '', 'Lapinski'], ['H.', '', 'Boniface']]",Diabetes & Metabolism,2007,"[u'http://www.sciencedirect.com/science/article/pii/S1262363607000183', u'http://linkinghub.elsevier.com/retrieve/pii/S1262363607000183']"
3790959Standards of Medical Care in Diabetes—2008,cited-by,10.1109/IROS.2004.1390048,Control parameters for an active type SAW tactile display,"[['Masaya', '', 'Takasaki'], ['Takeshi', '', 'Mizuno'], ['Takaaki', '', 'Nara']]",,2004,"[u'http://ieeexplore.ieee.org/xpls/abs_all.jsp?arnumber=1390048', u'http://ieeexplore.ieee.org/stamp/stamp.jsp?arnumber=01390048']"
3790959Standards of Medical Care in Diabetes—2008,cited-by,10.1016/j.amjmed.2008.10.016,Prevention and Treatment of Atherosclerosis: A Practitioner's Guide for 2008,"[['Sandra', 'J.', 'Lewis']]",American Journal of Medicine,2009,"[u'http://www.sefap.it/servizi_lineeguida_200902/sdarticleCVlg.pdf', u'http://www.sciencedirect.com/science/article/pii/S0002934308010206', u'http://linkinghub.elsevier.com/retrieve/pii/S0002934308010206']"
3790959Standards of Medical Care in Diabetes—2008,cited-by,10.1111/j.1463-1326.2008.00933.x,Glycaemic separation and risk factor control in the Veterans Affairs Diabetes Trial: an interim report,"[['C.', '', 'Abraira'], ['W.', 'C.', 'Duckworth'], ['T.', '', 'Moritz']]",Diabetes Obesity & Metabolism,2009,[u'http://blackwell-synergy.com/doi/abs/10.1111/j.1463-1326.2008.00933.x']
10.1016~j.clinthera.2007.10.001,"From the Centers for Disease Control and Prevention. Influenza and pneumococcal vaccination rates among persons with diabetes mellitus—United States, 1997. JAMA. 2000;283:48–50. Clinical Therapeutics 2254 Volume 29 Number 10 2246_ET_orzeck 11/2/07 10:35 AM Page 2254",NOT found in MAS
10.1016~j.clinthera.2007.10.001,Egede LE. Association between number of physician visits and influenza vaccination coverage among diabetic adults with access to care. Diabetes Care. 2003;26:2562–2567.,10.2337/diacare.26.9.2562,Association Between Number of Physician Visits and Influenza Vaccination Coverage Among Diabetic Adults With Access to Care,"[[u'L.', u'E.', u'Egede']]",Diabetes Care,2003,[u'http://care.diabetesjournals.org/cgi/doi/10.2337/diacare.26.9.2562'],./output/10.1016~j.clinthera.2007.10.001/10.2337~diacare.26.9.2562
10.2337/diacare.26.9.2562,cited-by,10.1007/s11892-004-0067-8,Recognizing and treating depression in patients with diabetes,"[['Richard', 'R.', 'Rubin'], ['Paul', '', 'Ciechanowski'], ['Leonard', 'E.', 'Egede'], ['Elizabeth', 'H. B.', 'Lin'], ['Patrick', 'J.', 'Lustman']]",Current Diabetes Reports,2004,"[u'http://www.springerlink.com/content/av23462474176k32', u'http://www.springerlink.com/index/av23462474176k32.pdf', u'http://www.springerlink.com/index/10.1007/s11892-004-0067-8', u'http://www.springerlink.com/index/pdf/10.1007/s11892-004-0067-8']"
10.2337/diacare.26.9.2562,cited-by,10.1016/j.mcna.2005.03.004,Epidemiology of Type 2 Diabetes: Focus on Ethnic Minorities,"[['Leonard', 'E.', 'Egede'], ['Samuel', '', 'Dagogo-Jack']]",Medical Clinics of North America,2005,"[u'http://www.sciencedirect.com/science/article/pii/S0025712505000271', u'http://linkinghub.elsevier.com/retrieve/pii/S0025712505000271']"
10.2337/diacare.26.9.2562,cited-by,10.1016/j.vaccine.2005.12.020,"Influenza vaccination coverage in adults belonging to defined target groups, Germany, 2003/2004","[['Miriam', '', 'Wiese-Posselt'], ['Katrin', '', 'Leitmeyer'], ['Osamah', '', 'Hamouda'], ['Nikolaus', '', 'Bocter'], ['Iris', '', 'Z\xc3\xb6llner'], ['Walter', '', 'Haas'], ['Andrea', '', 'Ammon']]",Vaccine,2006,"[u'http://www.sciencedirect.com/science/article/pii/S0264410X05012569', u'http://linkinghub.elsevier.com/retrieve/pii/S0264410X05012569']"
10.2337/diacare.26.9.2562,cited-by,10.1016/j.jinf.2008.10.005,"Influenza vaccination coverages among children, adults, health care workers and immigrants in Spain: Related factors and trends, 2003–2006","[['Rodrigo', '', 'Jim\xc3\xa9nez-Garc\xc3\xada'], ['Valent\xc3\xadn', '', 'Hern\xc3\xa1ndez-Barrera'], ['Pilar', '', 'Carrasco-Garrido'], ['Ana', 'L\xc3\xb3pez de', 'Andr\xc3\xa9s'], ['Napole\xc3\xb3n', '', 'P\xc3\xa9rez'], ['\xc3\x81ngel', 'Gil de', 'Miguel']]",Journal of Infection,2008,"[u'http://www.sciencedirect.com/science/article/pii/S0163445308003496', u'http://linkinghub.elsevier.com/retrieve/pii/S0163445308003496']"
10.2337/diacare.26.9.2562,cited-by,10.1016/j.clinthera.2007.10.001,Oseltamivir and the risk of influenza-related complications and hospitalizations in patients with diabetes,"[['Eric', 'A.', 'Orzeck'], ['Nianwen', '', 'Shi'], ['William', 'A.', 'Blumentals']]",Clinical Therapeutics,2007,"[u'http://www.sciencedirect.com/science/article/pii/S0149291807003165', u'http://linkinghub.elsevier.com/retrieve/pii/S0149291807003165']"
10.2337/diacare.26.9.2562,cited-by,10.1016/j.mcna.2006.04.001,Disease-Focused or Integrated Treatment: Diabetes and Depression,"[['Leonard', 'E.', 'Egede']]",Medical Clinics of North America,2006,"[u'http://www.sciencedirect.com/science/article/pii/S0025712506000319', u'http://linkinghub.elsevier.com/retrieve/pii/S0025712506000319']"
10.2337/diacare.26.9.2562,cited-by,10.1111/j.1746-1561.2009.00482.x,Strategies for Implementing School-Located Influenza Vaccination of Children: A Systematic Literature Review,"[['John', '', 'Cawley'], ['Harry', 'F.', 'Hull'], ['Matthew', 'D.', 'Rousculp']]",Journal of School Health,2010,[u'http://blackwell-synergy.com/doi/abs/10.1111/j.1746-1561.2009.00482.x']
10.2337/diacare.26.9.2562,cited-by,10.1016/j.jdiacomp.2007.11.005,Racial differences in diabetes self-management and quality of care in Texas,"[['Chiagozie', '', 'Nwasuruba'], ['Christie', '', 'Osuagwu'], ['Sejong', '', 'Bae'], ['Karan', 'P.', 'Singh'], ['Leonard', 'E.', 'Egede']]",Journal of Diabetes and Its Complications,2009,"[u'http://www.sciencedirect.com/science/article/pii/S1056872707001390', u'http://linkinghub.elsevier.com/retrieve/pii/S1056872707001390']"
10.2337/diacare.26.9.2562,cited-by,10.1016/j.diabres.2007.10.013,Coverage and predictors of influenza vaccination among adults with diabetes in Spain,"[['Rodrigo', '', 'Jim\xc3\xa9nez-Garc\xc3\xada'], ['Isabel', '', 'Jimenez'], ['Pilar', 'Carrasco', 'Garrido'], ['Valent\xc3\xadn', '', 'Hern\xc3\xa1ndez-Barrera'], ['Ana', 'Lopez de', 'Andres'], ['Jose', 'Luis del', 'Barrio'], ['\xc3\x81ngel', 'Gil de', 'Miguel']]",Diabetes Research and Clinical Practice,2008,"[u'http://www.sciencedirect.com/science/article/pii/S0168822707005244', u'http://linkinghub.elsevier.com/retrieve/pii/S0168822707005244']"
10.2337/diacare.26.9.2562,cited-by,10.1016/j.vaccine.2009.12.032,"Meningococcal conjugate vaccination among adolescents aged 13–17 years, United States, 2007","[['Peng-jun', '', 'Lu'], ['Nidhi', '', 'Jain'], ['Amanda', 'C.', 'Cohn']]",Vaccine,2010,"[u'http://www.sciencedirect.com/science/article/pii/S0264410X09019367', u'http://linkinghub.elsevier.com/retrieve/pii/S0264410X09019367']"
10.2337/diacare.26.9.2562,cited-by,10.1016/S1576-9887(06)73191-0,Desigualdades en la recomendación o el consejo médico de la vacuna antigripal en población adulta,"[['S.', 'V\xc3\xa1zquez-Fern\xc3\xa1ndez del', 'Pozo'], ['I.', '', 'Jim\xc3\xa9nez-Trujillo'], ['P.', '', 'Carrasco-Garrido'], ['A.', 'Gil-De', 'Miguel'], ['R.', '', 'Jim\xc3\xa9nez-Garc\xc3\xada']]",Vacunas,2006,"[u'http://www.sciencedirect.com/science/article/pii/S1576988706731910', u'http://linkinghub.elsevier.com/retrieve/pii/S1576988706731910']"
10.2337/diacare.26.9.2562,cited-by,10.1111/j.1464-5491.2005.01365.x,Influenza and pneumococcal vaccination rates among Greek diabetic patients in primary care,"[['A.', '', 'Sotiropoulos'], ['P.', '', 'Merkouris'], ['A.', '', 'Gikas'], ['S.', '', 'Skourtis'], ['E.', '', 'Skliros'], ['L.', '', 'Lanaras'], ['T.', '', 'Nikolaou'], ['S.', '', 'Pappas']]",Diabetic Medicine,2005,[u'http://www.blackwell-synergy.com/links/doi/10.1111%2Fj.1464-5491.2005.01365.x']
10.1016~j.clinthera.2007.10.001,"Influenza and pneumococcal vaccination coverage among persons aged ≥65 years and persons aged 18– 64 years with diabetes or asthma— United States, 2003. MMWR Morb Mortal Wkly Rep. 2004;53:1007–1012.",NOT found in MAS
10.1016~j.clinthera.2007.10.001,"Ross JS, Bradley EH, Busch SH. Use of health care services by lowerincome and higher-income uninsured adults. JAMA. 2006;295:2027– 2036.",NOT found in MAS
10.1016~j.clinthera.2007.10.001,"Jefferson T, Demicheli V, Rivetti D, et al. Antivirals for influenza in healthy adults: Systematic review [published correction appears in Lancet. 2006;367:2060]. Lancet. 2006; 367:303–313.",10.1016/S0140-6736(06)67970-1,Antivirals for influenza in healthy adults: systematic review,"[[u'T', u'', u'Jefferson'], [u'V', u'', u'Demicheli'], [u'D', u'', u'Rivetti'], [u'M', u'', u'Jones'], [u'C', u'Di', u'Pietrantonj'], [u'A', u'', u'Rivetti']]",Lancet,2006,"[u'http://www.sciencedirect.com/science/article/pii/S0140673606679701', u'http://download.thelancet.com/flatcontentassets/h1n1-flu/treatment/treatment-9.pdf', u'http://influenza.rhove.gob.mx/RetornoSudafrica/archivos/influenza_TB/Bibliografia/antiviral for influenza.pdf', u'http://linkinghub.elsevier.com/retrieve/pii/S0140673606679701']",./output/10.1016~j.clinthera.2007.10.001/10.1016~S0140-6736(06)67970-1
10.1016/S0140-6736(06)67970-1,cited-by,10.1086/511159,Infectious Diseases Society of America/American Thoracic Society Consensus Guidelines on the Management of Community‐Acquired Pneumonia in Adults,"[['Lionel', 'A.', 'Mandell'], ['Richard', 'G.', 'Wunderink'], ['Antonio', '', 'Anzueto'], ['John', 'G.', 'Bartlett'], ['G.', 'Douglas', 'Campbell'], ['Nathan', 'C.', 'Dean'], ['Scott', 'F.', 'Dowell'], ['Daniel', 'M.', 'Musher'], ['Michael', 'S.', 'Niederman'], ['Antonio', '', 'Torres'], ['Cynthia', 'G.', 'Whitney']]",Clinical Infectious Diseases,2007,"[u'http://www.med.unc.edu/medselect/files/ATSguidelinesforpnuemonia.pdf', u'http://www.thoracic.org/sections/publications/statements/resources/idsaats-cap.pdf', u'http://www.grg-bs.it/usr_files/eventi/journal_club/programma/CAPadulti2007ATS.pdf', u'http://www.co.washington.wi.us/uploads/docs/CHN_IDSA-ATS_CAP.pdf', u'https://maine.gov/dhhs/boh/41620.web.pdf', u'http://www.svneumo.org/html/informacion/GUIA-ATS-2007.pdf', u'https://www.med.unc.edu/medselect/files/ATSguidelinesforpnuemonia.pdf', u'http://www.state.me.us/dhhs/boh/41620.web.pdf', u'http://maladiesinfectieuses.hug-ge.ch/_library/pdf/communityaquiredpneumonia.pdf', u'http://maladiesinfectieuses.hug-ge.ch/cahier_interne/jurc/ConsensusGuidelinesCAP.pdf', u'http://www.acutemed.co.uk/docs/pneumonia_extra.pdf', u'http://www.uphs.upenn.edu/bugdrug/antibiotic_manual/idsacap2007.pdf', u'http://www.dhmc.org/dhmc-internet-upload/file_collection/CAParticle.pdf', u'http://www.matheny.info/clinical/CAP_ISD_AATS_2007.pdf', u'http://maladiesinfectieuses.hug-ge.ch/_library/pdf/GuidelinesPneumonia.pdf', u'http://www.thoracic.org/statements/resources/mtpi/idsaats-cap.pdf', u'http://www.sbpt.org.br/downloads/arquivos/Dir_Infec_Int/Consensus_Guidelines_Management_Community_Acquired_Pneumonia_Adults_IDSA_ATS_2007.pdf', u'http://www.sh.lsuhsc.edu/pharmacy/antibiotic%20guidelines/cap.pdf', u'http://www.sepeap.org/archivos/pdf/10476.pdf', u'http://scalpel.stanford.edu/2007-2008/articles/CAP,%20ATS%202007.pdf', u'http://www.bago.com/Bolivia/html/doc_pdf/management_cap.pdf', u'http://chicago.medicine.uic.edu/userfiles/servers/server_442934/file/pulmonary/recommended%20reading%202009-10/infections%20and%20sepsis/community%20acquired%20pneumonia.pdf', u'http://www.maine.gov/dhhs/boh/41620.web.pdf', u'http://www.courses.ahc.umn.edu/pharmacy/6124/handouts/IDSACAPGUIDELINES.pdf', u'http://inf-diseases.ru/2010/1400/1404.pdf', u'http://www.journals.uchicago.edu/doi/abs/10.1086/511159']"
10.1016/S0140-6736(06)67970-1,cited-by,"13129215Prevention and Control of Influenza Recommendations of the Advisory Committee on Immunization Practices (ACIP), 2008","Prevention and Control of Influenza Recommendations of the Advisory Committee on Immunization Practices (ACIP), 2008","[['David', 'K.', 'Shay'], ['Karen', '', 'Broder'], ['John', 'K.', 'Iskander'], ['Timothy', 'M.', 'Uyeki'], ['Joseph', 'S.', 'Bresee'], ['Nancy', 'J.', 'Cox'], ['James', '', 'LeDuc'], ['Stephen', '', 'Cochi'], ['Gina', '', 'Mootrey']]",,2007,"[u'http://ftp.cdc.gov/pub/publications/mmwr/rr/rr5707.pdf', u'http://bret.mc.vanderbilt.edu/microbiology/html/Harper_2005.pdf']"
10.1016/S0140-6736(06)67970-1,cited-by,10.1136/bmj.39393.510347.BE,Physical interventions to interrupt or reduce the spread of respiratory viruses: systematic review,"[['Tom', '', 'Jefferson'], ['Ruth', '', 'Foxlee'], ['Chris', 'Del', 'Mar'], ['Liz', '', 'Dooley'], ['Eliana', '', 'Ferroni'], ['Bill', '', 'Hewak'], ['Adi', '', 'Prabhala'], ['Sree', '', 'Nair'], ['Alex', '', 'Rivetti']]",British Medical Journal,2008,"[u'http://www.bmj.com/cgi/reprint_abr/336/7635/77.pdf', u'http://www.aqp.org.mx/attachments/068_influenzarevisionsistematica.pdf', u'http://www.bmj.com/cgi/doi/10.1136/bmj.39393.510347.BE', u'http://dx.doi.org/10.1136/bmj.39393.510347.BE']"
10.1016/S0140-6736(06)67970-1,cited-by,10.1016/S1473-3099(06)70684-3,WHO Rapid Advice Guidelines for pharmacological management of sporadic human infection with avian influenza A (H5N1) virus,"[['Holger', 'J', 'Sch\xc3\xbcnemann'], ['Suzanne', 'R', 'Hill'], ['Meetali', '', 'Kakad'], ['Richard', '', 'Bellamy'], ['Timothy', 'M', 'Uyeki'], ['Frederick', 'G', 'Hayden'], ['Yazdan', '', 'Yazdanpanah'], ['John', '', 'Beigel'], ['Tawee', '', 'Chotpitayasunondh'], ['Chris', 'Del', 'Mar'], ['Jeremy', '', 'Farrar'], ['Tran', 'Tinh', 'Hien'], ['B\xc3\xbclent', '', '\xc3\x96zbay'], ['Norio', '', 'Sugaya'], ['Keiji', '', 'Fukuda'], ['Nikki', '', 'Shindo'], ['Lauren', '', 'Stockman'], ['Gunn', 'E', 'Vist'], ['Alice', '', 'Croisier'], ['Azim', '', 'Nagjdaliyev'], ['Cathy', '', 'Roth'], ['Gail', '', 'Thomson'], ['Howard', '', 'Zucker'], ['Andrew', 'D', 'Oxman']]",Lancet Infectious Diseases,2007,"[u'http://www.sciencedirect.com/science/article/pii/S1473309906706843', u'http://linkinghub.elsevier.com/retrieve/pii/S1473309906706843']"
10.1016/S0140-6736(06)67970-1,cited-by,10.1086/598513,"Seasonal Influenza in Adults and Children—Diagnosis, Treatment, Chemoprophylaxis, and Institutional Outbreak Management: Clinical Practice Guidelines of the Infectious Diseases Society of America","[['Stefan', '', 'Gravenstein']]",Clinical Infectious Diseases,2009,"[u'http://www.uphs.upenn.edu/bugdrug/antibiotic_manual/idsainfluenza2009.pdf', u'http://linmed.files.wordpress.com/2009/05/flu_guideline_2009.pdf', u'http://maladiesinfectieuses.hug-ge.ch/_library/pdf/influenza.pdf', u'http://www.srlf.org/Data/upload/file/Grippe%20A/(26)%20-%20Recos%20Flu%20IDSA%202009.pdf', u'http://www.maine.gov/dhhs/boh/ddc/epi/influenzatoolkit/Supporting%20documents/IDSA%20Seasonal%20Guidelines.pdf', u'http://www.journals.uchicago.edu/doi/abs/10.1086/598513']"
