source,citation string,ID,title,authors,journal,year,fulltext online link,fulltext location
10.1128~AAC.00338-07,"Bodey, G. P., L. Jadeja, and L. Elting. 1985. Pseudomonas bacteremia: retrospective analysis of 410 episodes. Arch. Intern. Med. 145:1621–1629.",NOT found in MAS
10.1128~AAC.00338-07,"Clinical Laboratory Standards Institute. 2006. Performance standards for antimicrobial disk susceptibility tests. Approved standard M2-M9, 9th ed. Clinical Laboratory Standards Institute, Wayne, PA.",NOT found in MAS
10.1128~AAC.00338-07,"Garner, J. S., W. R. Jarvis, T. G. Emori, T. C. Horan, and J. M. Hughes. 1988. CDC definitions for nosocomial infections, 1988. Am. J. Infect. Control 16:128–140.",10.1016/0196-6553(88)90053-3,"CDC definitions for nosocomial infections, 1988","[[u'J', u'', u'GARNER'], [u'W', u'', u'JARVIS'], [u'T', u'', u'EMORI'], [u'T', u'', u'HORAN'], [u'J', u'', u'HUGHES']]",American Journal of Infection Control,1988,[u'http://linkinghub.elsevier.com/retrieve/pii/0196655388900533'],./output/10.1128~AAC.00338-07/10.1016~0196-6553(88)90053-3
10.1016/0196-6553(88)90053-3,cited-by,10.1086/344188,Guidelines for the Prevention of Intravascular Catheter–Related Infections,"[['Mary', '', 'Alexander'], ['Henry', '', 'Masur'], ['Adrienne', '', 'Randolph']]",Clinical Infectious Diseases,2002,"[u'http://www.inicc.org/guias/CatheterRelatedInfections.pdf', u'http://maladiesinfectieuses.hug-ge.ch/cahier_interne/jurc/PreventionIntravascularCatheterRelatedInfections.pdf', u'http://medschool.umaryland.edu/surgery/general/resident/website/docs/articles/critical_care/Complication%20Prevention/Central%20Line%20Infection%20Prevention%20Guidelines.pdf', u'http://www.shea-online.org/Assets/files/position_papers/hicpac_catheter.pdf', u'http://www.fmed.uba.ar/depto/medicina/infecciosas/cateter.pdf', u'http://maladiesinfectieuses.hug-ge.ch/_library/pdf/catheterrelatedinfections.pdf', u'http://www.solumed.ca/pages/pdf/EN/bibliographies/Pediatrics-CVL-BSI-prevention-guidelines-2002.pdf', u'http://www.chlorhexidine.ca/pages/pdf/en/bibliographies/pediatrics-cvl-bsi-prevention-guidelines-2002.pdf', u'http://aappolicy.aappublications.org/cgi/reprint/pediatrics;110/5/e51.pdf', u'http://pediatrics.aappublications.org/cgi/reprint/110/5/e51.pdf', u'http://prototype.nachri.org/content/contentgroups/clinicalcare/clinicalcarequality/reportsresources/cvcpreventionguidelinepeds2002.pdf', u'http://www.solumed.biz/pages/pdf/EN/bibliographies/Pediatrics-CVL-BSI-prevention-guidelines-2002.pdf', u'http://medschool.umaryland.edu/surgery/general/resident/website/docs/articles/critical_care/Complication%20Prevention/Prevention%20Guidelines%20for%20Catheter-Related%20Infections.pdf', u'http://www.mc.vanderbilt.edu/root/pdfs/cvctutorial/IDSA_Catheter_Infections.pdf', u'http://www.journals.uchicago.edu/doi/abs/10.1086/502007', u'http://www.journals.uchicago.edu/doi/abs/10.1086/344188']"
10.1016/0196-6553(88)90053-3,cited-by,10.1097/01.CCM.0000217961.75225.E9,Duration of hypotension before initiation of effective antimicrobial therapy is the critical determinant of survival in human septic shock,"[['Anand', '', 'Kumar'], ['Daniel', '', 'Roberts'], ['Kenneth', 'E.', 'Wood'], ['Bruce', '', 'Light'], ['Joseph', 'E.', 'Parrillo'], ['Satendra', '', 'Sharma'], ['Robert', '', 'Suppes'], ['Daniel', '', 'Feinstein'], ['Sergio', '', 'Zanotti'], ['Leo', '', 'Taiberg'], ['David', '', 'Gurka'], ['Aseem', '', 'Kumar'], ['Mary', '', 'Cheang']]",Critical Care Medicine,2006,[u'http://content.wkhealth.com/linkback/openurl?sid=WKPTLP:landingpage&an=00003246-200606000-00001']
10.1016/0196-6553(88)90053-3,cited-by,10.1086/345436,Community‐Acquired Methicillin‐Resistant Staphylococcus aureus: A Meta‐Analysis of Prevalence and Risk Factors,"[['Cassandra', 'D.', 'Salgado'], ['Barry', 'M.', 'Farr'], ['David', 'P.', 'Calfee']]",Clinical Infectious Diseases,2003,[u'http://www.journals.uchicago.edu/doi/abs/10.1086/345436']
10.1016/0196-6553(88)90053-3,cited-by,10.1086/367653,Adverse Clinical and Economic Outcomes Attributable to Methicillin Resistance among Patients with Staphylococcus aureus Surgical Site Infection,"[['John', 'J.', 'Engemann'], ['Yehuda', '', 'Carmeli'], ['Sara', 'E.', 'Cosgrove'], ['Vance', 'G.', 'Fowler'], ['Melissa', 'Z.', 'Bronstein'], ['Sharon', 'L.', 'Trivette'], ['Jane', 'P.', 'Briggs'], ['Daniel', 'J.', 'Sexton'], ['Keith', 'S.', 'Kaye']]",Clinical Infectious Diseases,2003,"[u'http://www.carefusiondev.com/pdf/Adverse_clinical_and_economic_outcomes_attributable_to_SSI_Engemann_ClinInfDis_030103.pdf', u'http://www.journals.uchicago.edu/doi/abs/10.1086/367653']"
10.1016/0196-6553(88)90053-3,cited-by,10.1056/NEJMoa071366,Hydrocortisone Therapy for Patients with Septic Shock,"[['Charles', 'L.', 'Sprung'], ['Djillali', '', 'Annane'], ['Didier', '', 'Keh'], ['Rui', '', 'Moreno'], ['Mervyn', '', 'Singer'], ['Klaus', '', 'Freivogel'], ['Yoram', 'G.', 'Weiss'], ['Julie', '', 'Benbenishty'], ['Armin', '', 'Kalenka'], ['Helmuth', '', 'Forst'], ['Pierre-Francois', '', 'Laterre'], ['Konrad', '', 'Reinhart'], ['Brian', 'H.', 'Cuthbertson'], ['Didier', '', 'Payen'], ['Josef', '', 'Briegel']]",New England Journal of Medicine,2008,"[u'http://www.esicm.org/Data/upload/images/file/Corticus%20NEJM%202008.pdf', u'http://www.nejm.org/doi/abs/10.1056/NEJMoa071366', u'http://pediatrics.uchicago.edu/chiefs/PICU/documents/corticus.pdf']"
10.1016/0196-6553(88)90053-3,cited-by,10.1007/s00134-001-1143-z,Epidemiology of sepsis and infection in ICU patients from an international multicentre cohort study,"[['Corinne', '', 'Alberti'], ['Christian', '', 'Brun-Buisson'], ['Hilmar', '', 'Burchardi'], ['Claudio', '', 'Martin'], ['Sergey', '', 'Goodman'], ['Antonio', '', 'Artigas'], ['Alberto', '', 'Sicignano'], ['Mark', '', 'Palazzo'], ['Rui', '', 'Moreno'], ['Ronan', '', 'Boulm\xc3\xa9'], ['Eric', '', 'Lepage'], ['Jean', 'Roger Le', 'Gall']]",Intensive Care Medicine,2002,"[u'http://www.springerlink.com/content/dr817kc8p95ec28j', u'http://www.springerlink.com/index/dr817kc8p95ec28j.pdf', u'http://www.springerlink.com/openurl.asp?genre=article&id=doi:10.1007/s00134-001-1143-z', u'http://www.springerlink.com/index/pdf/10.1007/s00134-001-1143-z']"
10.1016/0196-6553(88)90053-3,cited-by,10.1086/342300,Secular Trend of Hospital‐Acquired Candidemia among Intensive Care Unit Patients in the United States during 1989–1999,"[['W.', 'E.', 'Trick'], ['S.', 'K.', 'Fridkin'], ['J.', 'R.', 'Edwards'], ['R.', 'A.', 'Hajjeh'], ['R.', 'P.', 'Gaynes']]",Clinical Infectious Diseases,2002,[u'http://www.journals.uchicago.edu/doi/abs/10.1086/342300']
10.1016/0196-6553(88)90053-3,cited-by,10.1086/646432,"Methicillin-Resistant Staphylococcus aureus in U.S. Hospitals, 1975-1991","[['Adelisa', 'L.', 'Panlilio'], ['David', 'H.', 'Culver'], ['Robert', 'P.', 'Gaynes'], ['Shailen', '', 'Banerjee'], ['Tonya', 'S.', 'Henderson'], ['James', 'S.', 'Tolson'], ['William', 'J.', 'Martone']]",Infection Control and Hospital Epidemiology,1992,"[u'http://www.cleanyourhands.org/docs/mrsa_us_hospitals_1975-1991.pdf', u'http://lifelineozone.com/research/laundry/laundry7.pdf', u'http://origin.cdc.gov/ncidod/dhqp/pdf/ar/Vol13(10)ICHE.pdf', u'http://www.journals.uchicago.edu/doi/abs/10.1086/646432']"
10.1016/0196-6553(88)90053-3,cited-by,10.1016/j.ajic.2008.03.002,CDC/NHSN surveillance definition of health care–associated infection and criteria for specific types of infections in the acute care setting,"[['Teresa', 'C.', 'Horan'], ['Mary', '', 'Andrus'], ['Margaret', 'A.', 'Dudeck']]",American Journal of Infection Control,2008,"[u'http://www.sciencedirect.com/science/article/pii/S0196655308001673', u'http://linkinghub.elsevier.com/retrieve/pii/S0196655308001673']"
10.1016/0196-6553(88)90053-3,cited-by,11121500Health Care-Associated Bloodstream Infections in Adults: A Reason To Change the Accepted Definition of Community-Acquired Infections,Health Care-Associated Bloodstream Infections in Adults: A Reason To Change the Accepted Definition of Community-Acquired Infections,"[['N.', 'Deborah', 'Friedman'], ['Keith', 'S.', 'Kaye'], ['Jason', 'E.', 'Stout'], ['Sarah', 'A.', 'McGarry'], ['Sharon', 'L.', 'Trivette'], ['Jane', 'P.', 'Briggs'], ['Wanda', '', 'Lamm'], ['Connie', '', 'Clark'], ['Jennifer', '', 'MacFarquhar'], ['Aaron', 'L.', 'Walton'], ['L.', 'Barth', 'Reller'], ['Daniel', 'J.', 'Sexton']]",,0,[]
10.1016/0196-6553(88)90053-3,cited-by,10.1086/319757,Extended‐Spectrum β‐Lactamase–Producing Escherichia coli and Klebsiella pneumoniae: Risk Factors for Infection and Impact of Resistance on Outcomes,"[['Ebbing', '', 'Lautenbach'], ['Jean', 'Baldus', 'Patel'], ['Warren', 'B.', 'Bilker'], ['Paul', 'H.', 'Edelstein'], ['Neil', 'O.', 'Fishman']]",Clinical Infectious Diseases,2001,[u'http://www.journals.uchicago.edu/doi/abs/10.1086/319757']
10.1016/0196-6553(88)90053-3,cited-by,10.1086/375057,Outcomes Analysis of Delayed Antibiotic Treatment for Hospital‐Acquired Staphylococcus aureus Bacteremia,"[['Thomas', 'P.', 'Lodise'], ['Peggy', 'S.', 'McKinnon'], ['Linda', '', 'Swiderski'], ['Michael', 'J.', 'Rybak']]",Clinical Infectious Diseases,2003,[u'http://www.journals.uchicago.edu/doi/abs/10.1086/375057']
10.1016/0196-6553(88)90053-3,cited-by,10.1086/501641,Nosocomial Methicillin‐Resistant and Methicillin‐Susceptible Staphylococcus aureus Primary Bacteremia: At What Costs?,"[['Murray', 'A.', 'Abramson'], ['Daniel', 'J.', 'Sexton']]",Infection Control and Hospital Epidemiology,1999,[u'http://www.journals.uchicago.edu/doi/abs/10.1086/501641']
10.1016/0196-6553(88)90053-3,cited-by,10.1086/524667,Influence of Vancomycin Minimum Inhibitory Concentration on the Treatment of Methicillin‐Resistant Staphylococcus aureus Bacteremia,"[['Alex', '', 'Soriano'], ['Francesc', '', 'Marco'], ['Jose', 'A.', 'Martinez'], ['Elena', '', 'Pisos'], ['Manel', '', 'Almela'], ['Veselka', 'P.', 'Dimova'], ['Dolores', '', 'Alamo'], ['Mar', '', 'Ortega'], ['Josefina', '', 'Lopez'], ['Josep', '', 'Mensa']]",Clinical Infectious Diseases,2008,[u'http://www.journals.uchicago.edu/doi/abs/10.1086/524667']
10.1016/0196-6553(88)90053-3,cited-by,10.1046/j.1537-2995.1999.39070701.x,Transfusion and postoperative pneumonia in coronary artery bypass graft surgery: effect of the length of storage of transfused red cells,"[['E.', 'C.', 'Vamvakas'], ['J.', 'H.', 'Carven']]",Transfusion,1999,[u'http://www.blackwell-synergy.com/links/doi/10.1046%2Fj.1537-2995.1999.39070701.x']
10.1016/0196-6553(88)90053-3,cited-by,10.1001/archinte.159.10.1127,Health and Economic Outcomes of Antibiotic Resistance in Pseudomonas aeruginosa,"[['Yehuda', '', 'Carmeli'], ['Nicolas', '', 'Troillet'], ['Adolf', 'W.', 'Karchmer'], ['Matthew', 'H.', 'Samore']]",Archives of Internal Medicine,1999,"[u'http://archinte.ama-assn.org/cgi/doi/10.1001/archinte.159.10.1127', u'http://archinte.ama-assn.org/cgi/reprint/159/10/1127.pdf']"
10.1016/0196-6553(88)90053-3,cited-by,10.1016/S0003-4975(98)00063-0,Deep Sternal Wound Infection: Risk Factors and Outcomes,"[['Michael', 'A', 'Borger'], ['Vivek', '', 'Rao'], ['Richard', 'D', 'Weisel'], ['Joan', '', 'Ivanov'], ['Gideon', '', 'Cohen'], ['Hugh', 'E', 'Scully'], ['Tirone', 'E', 'David']]",Annals of Thoracic Surgery,1998,"[u'http://www.sciencedirect.com/science/article/pii/S0003497598000630', u'http://linkinghub.elsevier.com/retrieve/pii/S0003497598000630']"
10.1016/0196-6553(88)90053-3,cited-by,13590808Nosocomial infections in adult intensive-care units,Nosocomial infections in adult intensive-care units,"[['Jean-Louis', '', 'Vincent']]",,2003,[u'http://www.congrex.ch/escmidsummerschool2008/pdf/pdfs/akova_references2/vicent_2003_nosocomial_inf_in_icu_lancet.pdf']
10.1016/0196-6553(88)90053-3,cited-by,10.1086/313650,Pathogenic Significance of Methicillin Resistance for Patients with Staphylococcus aureus Bacteremia,"[['A.', '', 'Soriano'], ['J.', 'A.', 'Martinez'], ['J.', '', 'Mensa'], ['F.', '', 'Marco'], ['M.', '', 'Almela'], ['F.', '', 'Sanchez'], ['I.', '', 'Munoz'], ['M.', 'T. Jimenez de', 'Anta'], ['E.', '', 'Soriano']]",Clinical Infectious Diseases,2000,[u'http://www.journals.uchicago.edu/doi/abs/10.1086/313650']
10.1016/0196-6553(88)90053-3,cited-by,10.1007/BF01695658,Predominant pathogens found in the European prevalence of infection in intensive care study,"[['R.', 'C.', 'Spencer']]",European Journal of Clinical Microbiology & Infectious Diseases,1996,"[u'http://www.springerlink.com/content/h2507r7073h65541', u'http://www.springerlink.com/index/h2507r7073h65541.pdf', u'http://www.springerlink.com/index/10.1007/BF01695658', u'http://www.springerlink.com/index/pdf/10.1007/BF01695658']"
10.1016/0196-6553(88)90053-3,cited-by,10.1016/S0196-6553(97)90037-7,Definitions of key terms used in the NNIS System,"[['Teresa', 'C.', 'Horan'], ['T.', 'Grace', 'Emori']]",American Journal of Infection Control,1997,"[u'http://www.sciencedirect.com/science/article/pii/S0196655397900377', u'http://linkinghub.elsevier.com/retrieve/pii/S0196655397900377']"
10.1016/0196-6553(88)90053-3,cited-by,10.1007/BF01712153,Modification of empiric antibiotic treatment in patients with pneumonia acquired in the intensive care unit,"[['F.', '', 'Alvarez-Lerma'], ['R.', '', 'Jorda'], ['F.', '', 'Barcenilla'], ['Arnau', 'de', 'Vilanova'], ['B.', '', 'Galvan'], ['M.', '', 'Palomar'], ['J.', '', 'Serra'], ['B.', '', 'Bermejo'], ['M.', 'Sanchez', 'Palacios'], ['R.', '', 'Girat'], ['F.', 'Alvarez', 'Lerma'], ['Maria', 'del', 'Rosell'], ['J.', '', 'Martinez'], ['J.', '', 'Insausti'], ['P.', '', 'Olaechea'], ['A.', '', 'Gilabert'], ['C.', '', 'Junque'], ['F.', '', 'Palacios'], ['R.', '', 'Calvo'], ['E.', '', 'Mesalles'], ['J.', '', 'Nava'], ['A.', '', 'Santos']]",Intensive Care Medicine,1996,"[u'http://www.springerlink.com/index/g480u4477042l740.pdf', u'http://www.springerlink.com/content/g480u4477042l740', u'http://www.springerlink.com/index/10.1007/BF01712153', u'http://www.springerlink.com/index/pdf/10.1007/BF01712153']"
10.1016/0196-6553(88)90053-3,cited-by,10.1086/501677,"Outbreak of Enterobacter cloacae Related to Understaffing, Overcrowding, and Poor Hygiene Practices","[['Stephan', '', 'Harbarth'], ['Philippe', '', 'Sudre'], ['Sasi', '', 'Dharan'], ['Mercedes', '', 'Cadenas'], ['Didier', '', 'Pittet']]",Infection Control and Hospital Epidemiology,1999,[u'http://www.journals.uchicago.edu/doi/abs/10.1086/501677']
10.1016/0196-6553(88)90053-3,cited-by,10.1086/377200,Pseudomonas aeruginosa Bacteremia: Risk Factors for Mortality and Influence of Delayed Receipt of Effective Antimicrobial Therapy on Clinical Outcome,[],Clinical Infectious Diseases,2003,[u'http://www.journals.uchicago.edu/doi/abs/10.1086/377200']
10.1016/0196-6553(88)90053-3,cited-by,10.1097/00006454-200206000-00010,Clindamycin treatment of methicillin-resistant Staphylococcus aureus infections in children,"[['ARTHUR', 'L.', 'FRANK'], ['JOHN', 'F.', 'MARCINAK'], ['P.', 'DAISY', 'MANGAT'], ['JOYCE', 'T.', 'TJHIO'], ['SWATHI', '', 'KELKAR'], ['PAUL', 'C.', 'SCHRECKENBERGER'], ['JOHN', 'P.', 'QUINN']]",Pediatric Infectious Disease Journal,2002,[u'http://content.wkhealth.com/linkback/openurl?sid=WKPTLP:landingpage&an=00006454-200206000-00010']
10.1016/0196-6553(88)90053-3,cited-by,10.1086/313719,Epidemiology of Ciprofloxacin Resistance and Its Relationship to Extended‐Spectrum β‐Lactamase Production in Klebsiella pneumoniae Isolates Causing Bacteremia,"[['David', 'L.', 'Paterson'], ['Lutfiye', '', 'Mulazimoglu'], ['Jose', 'Maria', 'Casellas'], ['Herman', '', 'Goossens'], ['Anne', 'Von', 'Gottberg'], ['Sunita', '', 'Mohapatra'], ['Gordon', 'M.', 'Trenholme'], ['Keith', 'P.', 'Klugman'], ['Joseph', 'G.', 'McCormack'], ['Victor', 'L.', 'Yu']]",Clinical Infectious Diseases,2000,[u'http://www.journals.uchicago.edu/doi/abs/10.1086/313719']
10.1016/0196-6553(88)90053-3,cited-by,10.1007/s001340050552,"Epidemiology, diagnosis and treatment of systemic Candida infection in surgical patients under intensive care","[['J.', 'L.', 'Vincent'], ['E.', '', 'Anaissie'], ['H.', '', 'Bruining'], ['W.', '', 'Demajo'], ['M.', '', 'El-Ebiary'], ['J.', '', 'Haber'], ['Y.', '', 'Hiramatsu'], ['G.', '', 'Nitenberg'], ['P.', 'O.', 'Nystr\xc3\xb6m'], ['D.', '', 'Pittet'], ['T.', '', 'Rogers'], ['P.', '', 'Sandven'], ['G.', '', 'Sganga'], ['M.', 'D.', 'Schaller'], ['J.', '', 'Solomkin']]",Intensive Care Medicine,1998,"[u'http://www.springerlink.com/index/mgv8npba313elynk.pdf', u'http://www.springerlink.com/content/mgv8npba313elynk', u'http://www.springerlink.com/index/10.1007/s001340050552', u'http://www.springerlink.com/index/pdf/10.1007/s001340050552']"
10.1016/0196-6553(88)90053-3,cited-by,13868581Epidemiology and Outcomes of Health-care-Associated Pneumonia* Results From a Large US Database of Culture-Positive Pneumonia,Epidemiology and Outcomes of Health-care-Associated Pneumonia* Results From a Large US Database of Culture-Positive Pneumonia,"[['Marin', 'H.', 'Kollef'], ['Andrew', '', 'Shorr'], ['Ying', 'P.', 'Tabak'], ['Vikas', '', 'Gupta'], ['Larry', 'Z.', 'Liu'], ['R.', 'S.', 'Johannes']]",,2005,[u'https://www.pfizerpro.com/sites/PPro/SiteCollectionDocuments/pdfs/Kollef%20MH_Chest_2005_128_3854-3862.pdf']
10.1016/0196-6553(88)90053-3,cited-by,10.1097/01.CCM.0000168253.91200.83,The International Sepsis Forum Consensus Conference on Definitions of Infection in the Intensive Care Unit,"[['Thierry', '', 'Calandra'], ['Jonathan', '', 'Cohen']]",Critical Care Medicine,2005,[u'http://content.wkhealth.com/linkback/openurl?sid=WKPTLP:landingpage&an=00003246-200507000-00010']
10.1016/0196-6553(88)90053-3,cited-by,10.1086/345955,Risk of Methicillin‐Resistant Staphylococcus aureus Infection after Previous Infection or Colonization,"[['Susan', 'S.', 'Huang'], ['Richard', '', 'Platt']]",Clinical Infectious Diseases,2003,[u'http://www.journals.uchicago.edu/doi/abs/10.1086/345955']
10.1016/0196-6553(88)90053-3,cited-by,10.1046/j.1537-2995.1999.39070694.x,Risk of bacterial infection associated with allogeneic blood transfusion among patients undergoing hip fracture repair,"[['J.', 'L.', 'Carson'], ['D.', 'G.', 'Altman'], ['A.', '', 'Duff'], ['H.', '', 'Noveck'], ['M.', 'P.', 'Weinstein'], ['F.', 'A.', 'Sonnenberg'], ['J.', 'I.', 'Hudson'], ['G.', '', 'Provenzano']]",Transfusion,1999,[u'http://www.blackwell-synergy.com/links/doi/10.1046%2Fj.1537-2995.1999.39070694.x']
10.1016/0196-6553(88)90053-3,cited-by,11917729Beneficial Effects of Leukocyte Depletion of Transfused Blood on Postoperative Complications in Patients Undergoing Cardiac Surgery A Randomized Clinical Trial,Beneficial Effects of Leukocyte Depletion of Transfused Blood on Postoperative Complications in Patients Undergoing Cardiac Surgery A Randomized Clinical Trial,"[['Leo', 'M. G. van de', 'Watering'], ['Jo', '', 'Hermans'], ['Jos', 'G. A.', 'Houbiers'], ['Pieter', 'J. van den', 'Broek'], ['Hens', '', 'Bouter'], ['Fred', '', 'Boer'], ['Mark', 'S.', 'Harvey'], ['Hans', 'A.', 'Huysmans'], ['Anneke', '', 'Brand']]",,0,[u'http://circ.ahajournals.org/cgi/reprint/97/6/562.pdf']
10.1016/0196-6553(88)90053-3,cited-by,10.1080/08964280009595749,An Organizational Climate Intervention Associated With Increased Handwashing and Decreased Nosocomial Infections,"[['Elaine', 'L.', 'Larson'], ['Eve', '', 'Early'], ['Patricia', '', 'Cloonan'], ['Sandra', '', 'Sugrue'], ['Michael', '', 'Parides']]",Behavioral Medicine,2000,"[u'http://heldref.metapress.com/openurl.asp?genre=article&id=doi:10.1080/08964280009595749', u'http://heldref.metapress.com/index/6526J647818M7082.pdf']"
10.1016/0196-6553(88)90053-3,cited-by,10.1001/archinte.160.5.678,Catheter-Associated Urinary Tract Infection Is Rarely Symptomatic: A Prospective Study of 1497 Catheterized Patients,"[['Paul', 'A.', 'Tambyah'], ['Dennis', 'G.', 'Maki']]",Archives of Internal Medicine,2000,"[u'http://archinte.ama-assn.org/cgi/doi/10.1001/archinte.160.5.678', u'http://archinte.ama-assn.org/cgi/reprint/160/5/678.pdf']"
10.1016/0196-6553(88)90053-3,cited-by,10.1086/420816,Antibiotic Therapy for Klebsiella pneumoniae Bacteremia: Implications of Production of Extended‐Spectrum β‐Lactamases,"[['David', 'L.', 'Paterson'], ['Anne', 'Von', 'Gottberg'], ['Sunita', '', 'Mohapatra'], ['Jose', 'Maria', 'Casellas'], ['Herman', '', 'Goossens'], ['Lutfiye', '', 'Mulazimoglu'], ['Gordon', '', 'Trenholme'], ['Keith', 'P.', 'Klugman'], ['Robert', 'A.', 'Bonomo'], ['Louis', 'B.', 'Rice'], ['Marilyn', 'M.', 'Wagener'], ['Joseph', 'G.', 'McCormack'], ['Victor', 'L.', 'Yu']]",Clinical Infectious Diseases,2004,[u'http://www.journals.uchicago.edu/doi/abs/10.1086/420816']
10.1016/0196-6553(88)90053-3,cited-by,10.1086/501871,The Economic Impact of Methicillin‐Resistant Staphylococcus aureus in Canadian Hospitals,"[['Tony', '', 'Kim'], ['Paul', 'I.', 'Oh'], ['Andrew', 'E.', 'Simor']]",Infection Control and Hospital Epidemiology,2001,[u'http://www.journals.uchicago.edu/doi/abs/10.1086/501871']
10.1016/0196-6553(88)90053-3,cited-by,10.1097/00006454-200109000-00007,Community-acquired methicillin-resistant Staphylococcus aureus infections in South Texas children,"[['JAIME', 'E.', 'FERGIE'], ['KEVIN', '', 'PURCELL']]",Pediatric Infectious Disease Journal,2001,[u'http://content.wkhealth.com/linkback/openurl?sid=WKPTLP:landingpage&an=00006454-200109000-00007']
10.1016/0196-6553(88)90053-3,cited-by,10.1016/S0003-4975(98)01195-3,Is mediastinitis a preventable complication? A 10-year review,"[['Roger', 'J. F', 'Baskett'], ['Carolyn', 'E', 'MacDougall'], ['David', 'B', 'Ross']]",Annals of Thoracic Surgery,1999,"[u'http://www.sciencedirect.com/science/article/pii/S0003497598011953', u'http://linkinghub.elsevier.com/retrieve/pii/S0003497598011953']"
10.1016/0196-6553(88)90053-3,cited-by,10.1007/s00134-006-0517-7,Epidemiology of sepsis in Germany: results from a national prospective multicenter study,"[['Christoph', '', 'Engel'], ['Frank', 'M.', 'Brunkhorst'], ['Hans-Georg', '', 'Bone'], ['Reinhard', '', 'Brunkhorst'], ['Herwig', '', 'Gerlach'], ['Stefan', '', 'Grond'], ['Matthias', '', 'Gruendling'], ['Guenter', '', 'Huhle'], ['Ulrich', '', 'Jaschinski'], ['Stefan', '', 'John'], ['Konstantin', '', 'Mayer'], ['Michael', '', 'Oppert'], ['Derk', '', 'Olthoff'], ['Michael', '', 'Quintel'], ['Max', '', 'Ragaller'], ['Rolf', '', 'Rossaint'], ['Frank', '', 'Stuber'], ['Norbert', '', 'Weiler'], ['Tobias', '', 'Welte'], ['Holger', '', 'Bogatsch'], ['Christiane', '', 'Hartog'], ['Markus', '', 'Loeffler'], ['Konrad', '', 'Reinhart']]",Intensive Care Medicine,2007,"[u'http://www.imise.uni-leipzig.de/Archiv/2007/engel-c-2007-606-a.pdf', u'http://www.springerlink.com/index/q780471tj7327534.pdf', u'http://www.springerlink.com/content/q780471tj7327534', u'http://www.springerlink.com/index/10.1007/s00134-006-0517-7', u'http://www.springerlink.com/index/pdf/10.1007/s00134-006-0517-7']"
10.1016/0196-6553(88)90053-3,cited-by,10.1086/501554,Prevalence and Risk Factors for Nosocomial Infections in Four University Hospitals in Switzerland,"[['Didier', '', 'Pittet'], ['Stephan', '', 'Harbarth'], ['Christian', '', 'Ruef'], ['Patrick', '', 'Francioli'], ['Philippe', '', 'Sudre'], ['Christiane', '', 'Petignat'], ['Andrej', '', 'Trampuz'], ['Andreas', '', 'Widmer']]",Infection Control and Hospital Epidemiology,1999,[u'http://www.journals.uchicago.edu/doi/abs/10.1086/501554']
10.1016/0196-6553(88)90053-3,cited-by,10.1007/s001340050543,Procalcitonin and C-reactive protein during the early posttraumatic systemic inflammatory response syndrome,"[['O.', '', 'Mimoz'], ['A.', 'R.', 'Edouard'], ['K.', '', 'Samii'], ['J.', 'F.', 'Benoist'], ['M.', '', 'Assicot'], ['C.', '', 'Bohuon']]",Intensive Care Medicine,1998,"[u'http://www.springerlink.com/content/deer6gn2tjl01y40', u'http://www.springerlink.com/index/deer6gn2tjl01y40.pdf', u'http://www.springerlink.com/index/10.1007/s001340050543', u'http://www.springerlink.com/index/pdf/10.1007/s001340050543']"
10.1016/0196-6553(88)90053-3,cited-by,11085977Development and Validation of a Multifactorial Risk Index for Predicting Postoperative Pneumonia after Major Noncardiac Surgery,Development and Validation of a Multifactorial Risk Index for Predicting Postoperative Pneumonia after Major Noncardiac Surgery,"[['Ahsan', 'M.', 'Arozullah'], ['Shukri', 'F.', 'Khuri'], ['William', 'G.', 'Henderson'], ['Jennifer', '', 'Daley']]",,0,"[u'http://www.ottawa-anesthesia.org/director/paureading/01.arozullah.pulmonary.pdf', u'http://www.annals.org/content/135/10/847.full.pdf']"
10.1016/0196-6553(88)90053-3,cited-by,10.1007/BF02026130,"Prospective study of infection, colonization and carriage of methicillin-resistant Staphylococcus aureus in an outbreak affecting 990 patients","[['R.', '', 'Coello'], ['J.', '', 'Jim\xc3\xa9nez'], ['M.', '', 'Garc\xc3\xada'], ['P.', '', 'Arroyo'], ['D.', '', 'Minguez'], ['C.', '', 'Fern\xc3\xa1ndez'], ['F.', '', 'Cruzet'], ['C.', '', 'Gaspar']]",European Journal of Clinical Microbiology & Infectious Diseases,1994,"[u'http://www.springerlink.com/index/p43hr372m8270h28.pdf', u'http://www.springerlink.com/content/p43hr372m8270h28', u'http://www.springerlink.com/index/10.1007/BF02026130', u'http://www.springerlink.com/index/pdf/10.1007/BF02026130']"
10.1016/0196-6553(88)90053-3,cited-by,14282897Clinical Identifiers of Complicated Staphylococcus aureus Bacteremia,Clinical Identifiers of Complicated Staphylococcus aureus Bacteremia,"[['Vance', 'G.', 'Fowler'], ['Maren', 'K.', 'Olsen'], ['G.', 'Ralph', 'Corey'], ['Christopher', 'W.', 'Woods'], ['Christopher', 'H.', 'Cabell'], ['L.', 'Barth', 'Reller'], ['Allen', 'C.', 'Cheng'], ['Tara', '', 'Dudley'], ['Eugene', 'Z.', 'Oddone']]",,2003,[u'http://archinte.ama-assn.org/cgi/reprint/163/17/2066.pdf']
