source,citation string,ID,title,authors,journal,year,fulltext online link,fulltext location
14206164Impact of Oseltamivir Treatment on Influenza-Related Lower Respiratory Tract Complications and Hospitalizations,cited-by,10.1177/0091270007299761,Similarity in Pharmacokinetics of Oseltamivir and Oseltamivir Carboxylate in Japanese and Caucasian Subjects,"[['Jerome', 'J.', 'Schentag'], ['George', '', 'Hill'], ['Tom', '', 'Chu'], ['Craig', 'R.', 'Rayner']]",Journal of Clinical Pharmacology,2007,"[u'http://dx.doi.org/10.1177/0091270007299761', u'http://www.jclinpharm.org/cgi/doi/10.1177/0091270007299761']"
14206164Impact of Oseltamivir Treatment on Influenza-Related Lower Respiratory Tract Complications and Hospitalizations,cited-by,10.1016/j.dmr.2005.05.002,Pandemic Influenza: Are We Ready?,"[['Sandro', '', 'Cinti']]",Disaster Management & Response,2005,"[u'http://download.thelancet.com/flatcontentassets/H1N1-flu/preparedness/preparedness-7.pdf', u'http://www.sciencedirect.com/science/article/pii/S154024870500026X', u'http://linkinghub.elsevier.com/retrieve/pii/S154024870500026X']"
14206164Impact of Oseltamivir Treatment on Influenza-Related Lower Respiratory Tract Complications and Hospitalizations,cited-by,10.1007/s00430-007-0048-z,The threat of avian influenza A (H5N1). Part III: antiviral therapy,"[['Jindrich', 'Cinatl', 'Jr'], ['Martin', '', 'Michaelis'], ['Hans', 'W.', 'Doerr']]",Medical Microbiology and Immunology,2007,"[u'http://www.springerlink.com/index/41xpm470518281m7.pdf', u'http://www.springerlink.com/content/41xpm470518281m7', u'http://www.springerlink.com/index/10.1007/s00430-007-0048-z', u'http://www.springerlink.com/index/pdf/10.1007/s00430-007-0048-z']"
14206164Impact of Oseltamivir Treatment on Influenza-Related Lower Respiratory Tract Complications and Hospitalizations,cited-by,13543073Management of Influenza Symptoms in Healthy Children Cost-effectiveness of Rapid Testing and Antiviral Therapy,Management of Influenza Symptoms in Healthy Children Cost-effectiveness of Rapid Testing and Antiviral Therapy,"[['Michael', 'B.', 'Rothberg'], ['Donna', '', 'Fisher'], ['Brendan', '', 'Kelly'], ['David', 'N.', 'Rose']]",,2005,[u'http://archpedi.highwire.org/cgi/reprint/159/11/1055.pdf']
14206164Impact of Oseltamivir Treatment on Influenza-Related Lower Respiratory Tract Complications and Hospitalizations,cited-by,"12330234Economics of Neuraminidase Inhibitor Stockpiling for Pandemic Influenza, Singapore","Economics of Neuraminidase Inhibitor Stockpiling for Pandemic Influenza, Singapore","[['Vernon', 'J.', 'Lee'], ['Kai', 'Hong', 'Phua'], ['Mark', 'I.', 'Chen'], ['Angela', '', 'Chow'], ['Stefan', '', 'Ma'], ['Kee', 'Tai', 'Goh'], ['Yee', 'Sin', 'Leo']]",,0,[u'http://www.spp.nus.edu.sg/Handler.ashx?path=Data/Site/SiteDocuments/wp/2006/wp06-04.pdf']
14206164Impact of Oseltamivir Treatment on Influenza-Related Lower Respiratory Tract Complications and Hospitalizations,cited-by,10.1128/AAC.00588-08,Pharmacokinetics of High-Dose Oseltamivir in Healthy Volunteers,"[['Y.', '', 'Wattanagoon'], ['K.', '', 'Stepniewska'], ['N.', '', 'Lindegardh'], ['S.', '', 'Pukrittayakamee'], ['U.', '', 'Silachamroon'], ['W.', '', 'Piyaphanee'], ['T.', '', 'Singtoroj'], ['W.', '', 'Hanpithakpong'], ['G.', '', 'Davies'], ['J.', '', 'Tarning'], ['W.', '', 'Pongtavornpinyo'], ['C.', '', 'Fukuda'], ['P.', '', 'Singhasivanon'], ['N.', 'P. J.', 'Day'], ['N.', 'J.', 'White']]",Antimicrobial Agents and Chemotherapy,2009,"[u'http://aac.asm.org/cgi/reprint/53/3/945.pdf', u'http://aac.asm.org/cgi/doi/10.1128/AAC.00588-08']"
14206164Impact of Oseltamivir Treatment on Influenza-Related Lower Respiratory Tract Complications and Hospitalizations,cited-by,10.1136/bmj.b5164,Neuraminidase inhibitors—the story behind the Cochrane review,"[['Peter', '', 'Doshi']]",British Medical Journal,2009,"[u'http://www.bmj.com/cgi/doi/10.1136/bmj.b5164', u'http://dx.doi.org/10.1136/bmj.b5164']"
14206164Impact of Oseltamivir Treatment on Influenza-Related Lower Respiratory Tract Complications and Hospitalizations,cited-by,10.1136/bmj.b5387,Complications: tracking down the data on oseltamivir,"[['Deborah', '', 'Cohen']]",British Medical Journal,2009,"[u'http://dx.doi.org/10.1136/bmj.b5387', u'http://www.bmj.com/cgi/doi/10.1136/bmj.b5387']"
14206164Impact of Oseltamivir Treatment on Influenza-Related Lower Respiratory Tract Complications and Hospitalizations,cited-by,5648706Use of neuraminidase inhibitors to combat pandemic influenza,Use of neuraminidase inhibitors to combat pandemic influenza,"[['Jane', '', 'Democratis'], ['Manish', '', 'Pareek'], ['Iain', '', 'Stephenson']]",,2006,"[u'http://jac.oxfordjournals.org/cgi/reprint/dkl376v1.pdf', u'http://jac.oxfordjournals.org/cgi/reprint/58/5/911.pdf']"
14206164Impact of Oseltamivir Treatment on Influenza-Related Lower Respiratory Tract Complications and Hospitalizations,cited-by,10.1016/j.vaccine.2005.06.007,Scenarios on costs and savings of influenza treatment and prevention for Dutch healthy working adults,"[['Maarten', 'J.', 'Postma'], ['Paul', '', 'Jansema'], ['Marianne', 'L. L. van', 'Genugten']]",Vaccine,2005,"[u'http://www.sciencedirect.com/science/article/pii/S0264410X05005852', u'http://www.sff.fmns.rug.nl/downloads/2005/401_postma_2005.pdf', u'http://linkinghub.elsevier.com/retrieve/pii/S0264410X05005852']"
14206164Impact of Oseltamivir Treatment on Influenza-Related Lower Respiratory Tract Complications and Hospitalizations,cited-by,10.1186/1745-6215-11-37,Reporting bias in medical research - a narrative review,"[['Natalie', '', 'McGauran'], ['Beate', '', 'Wieseler'], ['Julia', '', 'Kreis'], ['Yvonne-Beatrice', '', 'Sch\xc3\xbcler'], ['Heike', '', 'K\xc3\xb6lsch'], ['Thomas', '', 'Kaiser']]",Trials,2010,"[u'http://www.springerlink.com/index/b41h459840h371g7.pdf', u'http://www.trialsjournal.com/content/11/1/37', u'http://www.springerlink.com/content/b41h459840h371g7', u'http://www.biomedcentral.com/content/pdf/1745-6215-11-37.pdf']"
14206164Impact of Oseltamivir Treatment on Influenza-Related Lower Respiratory Tract Complications and Hospitalizations,cited-by,10.1136/thx.2009.130799,Outcomes of adults hospitalised with severe influenza,"[['N.', '', 'Lee'], ['K.', 'W.', 'Choi'], ['P.', 'K. S.', 'Chan'], ['D.', 'S. C.', 'Hui'], ['G.', 'C. Y.', 'Lui'], ['B.', 'C. K.', 'Wong'], ['R.', 'Y. K.', 'Wong'], ['W.', 'Y.', 'Sin'], ['W.', 'M.', 'Hui'], ['K.', 'L. K.', 'Ngai'], ['C.', 'S.', 'Cockram'], ['R.', 'W. M.', 'Lai'], ['J.', 'J. Y.', 'Sung']]",Thorax,2010,"[u'http://thorax.bmj.com/cgi/doi/10.1136/thx.2009.130799', u'http://dx.doi.org/10.1136/thx.2009.130799']"
14206164Impact of Oseltamivir Treatment on Influenza-Related Lower Respiratory Tract Complications and Hospitalizations,cited-by,10.1086/591852,Diagnostic Testing or Empirical Therapy for Patients Hospitalized with Suspected Influenza: What to Do?,[],Clinical Infectious Diseases,2009,"[u'http://www.srlf.org/Data/upload/file/Grippe%20A/(53)%20-%20Tests%20Diag%20Grippe%20-%20CID%2009.pdf', u'http://www.journals.uchicago.edu/doi/abs/10.1086/591852']"
14206164Impact of Oseltamivir Treatment on Influenza-Related Lower Respiratory Tract Complications and Hospitalizations,cited-by,10.1097/CCM.0b013e3181c85229,The use of antiviral agents for the management of severe influenza,"[['James', 'R.', 'Smith'], ['Robert', 'E.', 'Ariano'], ['Stephen', '', 'Toovey']]",Critical Care Medicine,2010,"[u'http://content.wkhealth.com/linkback/openurl?sid=WKPTLP:landingpage&an=00003246-201004001-00006', u'http://www.sopemi.org.pe/file/articulos/201004/The use of antiviral agents for the management of severe influenza.pdf']"
14206164Impact of Oseltamivir Treatment on Influenza-Related Lower Respiratory Tract Complications and Hospitalizations,cited-by,10.1016/j.antiviral.2006.01.006,Treatment of respiratory virus infections,"[['Yacine', '', 'Abed'], ['Guy', '', 'Boivin']]",Antiviral Research,2006,"[u'http://www.sciencedirect.com/science/article/pii/S016635420600026X', u'http://linkinghub.elsevier.com/retrieve/pii/S016635420600026X']"
14206164Impact of Oseltamivir Treatment on Influenza-Related Lower Respiratory Tract Complications and Hospitalizations,cited-by,10.1086/600384,Influenza in Hospitalized Adults: Gaining Insight into a Significant Problem,[],Journal of Infectious Diseases,2009,"[u'http://www.crmpr.org.br/influenza/Influenza%20in%20Hospitalized%20Adults.pdf', u'http://www.journals.uchicago.edu/doi/abs/10.1086/600384']"
14206164Impact of Oseltamivir Treatment on Influenza-Related Lower Respiratory Tract Complications and Hospitalizations,cited-by,10.1016/j.antiviral.2007.12.010,PA subunit of RNA polymerase as a promising target for anti-influenza virus agents,"[['Misako', '', 'Nakazawa'], ['Shin-etsu', '', 'Kadowaki'], ['Izumi', '', 'Watanabe'], ['Youko', '', 'Kadowaki'], ['Masaya', '', 'Takei'], ['Hideyuki', '', 'Fukuda']]",Antiviral Research,2008,"[u'http://www.sciencedirect.com/science/article/pii/S0166354207005062', u'http://linkinghub.elsevier.com/retrieve/pii/S0166354207005062']"
14206164Impact of Oseltamivir Treatment on Influenza-Related Lower Respiratory Tract Complications and Hospitalizations,cited-by,10.1186/1471-2334-9-4,Antiviral prophylaxis during pandemic influenza may increase drug resistance,"[['Martin', '', 'Eichner'], ['Markus', '', 'Schwehm'], ['Hans-Peter', '', 'Duerr'], ['Mark', '', 'Witschi'], ['Daniel', '', 'Koch'], ['Stefan', 'O', 'Brockmann'], ['Beatriz', '', 'Vidondo']]",BMC Infectious Diseases,2009,"[u'http://www.springerlink.com/content/jq05rl77j1457120', u'http://www.biomedcentral.com/content/pdf/1471-2334-9-4.pdf', u'http://www.springerlink.com/index/jq05rl77j1457120.pdf', u'http://www.biomedcentral.com/1471-2334/9/4']"
14206164Impact of Oseltamivir Treatment on Influenza-Related Lower Respiratory Tract Complications and Hospitalizations,cited-by,5157075Economic Evaluation of Influenza Pandemic Mitigation Strategies in the United States Using a Stochastic MicrosimulationTransmission Model,Economic Evaluation of Influenza Pandemic Mitigation Strategies in the United States Using a Stochastic MicrosimulationTransmission Model,"[['Beate', '', 'Sander'], ['Azhar', '', 'Nizam'], ['Louis', 'P.', 'Garrison'], ['Maarten', 'J.', 'Postma'], ['M.', 'Elizabeth', 'Halloran'], ['Ira', 'M.', 'Longini']]",,2008,"[u'http://share.eldoc.ub.rug.nl/FILES/root2/2009/Econevofi/Sander_2009_Value_Health.pdf', u'http://www.sff.fmns.rug.nl/downloads/2008/630_sander_2008.pdf']"
14206164Impact of Oseltamivir Treatment on Influenza-Related Lower Respiratory Tract Complications and Hospitalizations,cited-by,10.1007/s00705-007-0974-5,"Antiviral activity of arbidol against influenza A virus, respiratory syncytial virus, rhinovirus, coxsackie virus and adenovirus  in vitro  and  in vivo","[['L.', '', 'Shi'], ['H.', '', 'Xiong'], ['J.', '', 'He'], ['H.', '', 'Deng'], ['Q.', '', 'Li'], ['Q.', '', 'Zhong'], ['W.', '', 'Hou'], ['L.', '', 'Cheng'], ['H.', '', 'Xiao'], ['Z.', '', 'Yang']]",Archives of Virology,2007,"[u'http://www.arbidol.org/arbidol-2007-china.pdf', u'http://www.springerlink.com/content/t6675872681r1848', u'http://www.springerlink.com/index/t6675872681r1848.pdf', u'http://www.springerlink.com/index/10.1007/s00705-007-0974-5', u'http://www.springerlink.com/index/pdf/10.1007/s00705-007-0974-5']"
14206164Impact of Oseltamivir Treatment on Influenza-Related Lower Respiratory Tract Complications and Hospitalizations,cited-by,10.2478/s11658-006-0055-x,How influenza’s neuraminidase promotes virulence and creates localized lung mucosa immunodeficiency,"[['Ajay', '', 'Bhatia'], ['Richard', 'E.', 'Kast']]",Cellular & Molecular Biology Letters,2007,"[u'http://www.springerlink.com/index/g228v48743685311.pdf', u'http://www.springerlink.com/content/g228v48743685311', u'http://www.springerlink.com/index/10.2478/s11658-006-0055-x']"
14206164Impact of Oseltamivir Treatment on Influenza-Related Lower Respiratory Tract Complications and Hospitalizations,cited-by,10.1016/j.vaccine.2006.05.080,"Active metabolite from Tamiflu ® solution is bioequivalent to that from capsule delivery in healthy volunteers: A cross-over, randomised, open-label study","[['M.', '', 'Brewster'], ['J.', 'R.', 'Smith'], ['R.', '', 'Dutkowski'], ['R.', '', 'Robson']]",Vaccine,2006,"[u'http://www.sciencedirect.com/science/article/pii/S0264410X06006396', u'http://linkinghub.elsevier.com/retrieve/pii/S0264410X06006396']"
14206164Impact of Oseltamivir Treatment on Influenza-Related Lower Respiratory Tract Complications and Hospitalizations,cited-by,10.1007/s00134-010-1853-1,Critically ill infants and children with influenza A (H1N1) in pediatric intensive care units in Argentina,"[['Julio', 'A.', 'Farias'], ['Anal\xc3\xada', '', 'Fern\xc3\xa1ndez'], ['Ezequiel', '', 'Monteverde'], ['Nilda', '', 'Vidal'], ['Pilar', '', 'Arias'], ['Mar\xc3\xada', 'J.', 'Montes'], ['Gabriela', '', 'Rodr\xc3\xadguez'], ['Mariela', '', 'Allasia'], ['Maria', 'E.', 'Ratto'], ['Roxana', '', 'Ja\xc3\xa9n'], ['Claudia', '', 'Meregalli'], ['Karina', '', 'Fiquepron'], ['Ana', 'R.', 'Calvo'], ['Alejandro', '', 'Siaba'], ['Lidia', '', 'Albano'], ['Rossana', '', 'Poterala'], ['Pablo', '', 'Neira'], ['Andr\xc3\xa9s', '', 'Esteban']]",Intensive Care Medicine,2010,"[u'http://www.springerlink.com/content/r115387410g35876', u'http://www.springerlink.com/index/r115387410g35876.pdf', u'http://www.springerlink.com/index/10.1007/s00134-010-1853-1', u'http://www.springerlink.com/index/pdf/10.1007/s00134-010-1853-1']"
14206164Impact of Oseltamivir Treatment on Influenza-Related Lower Respiratory Tract Complications and Hospitalizations,cited-by,10.1093/eurpub/ckp119,Investment decisions in influenza pandemic contingency planning: cost-effectiveness of stockpiling antiviral drugs,"[['Anna', 'K.', 'Lugner'], ['Maarten', 'J.', 'Postma']]",European Journal of Public Health,2009,"[u'http://www.sff.fmns.rug.nl/downloads/2009/516_lugner_2009.pdf', u'http://eurpub.oxfordjournals.org/cgi/doi/10.1093/eurpub/ckp119']"
14206164Impact of Oseltamivir Treatment on Influenza-Related Lower Respiratory Tract Complications and Hospitalizations,cited-by,10.1007/s15010-009-8241-1,Reducing the Burden of Influenza-Associated Complications with Antiviral Therapy,"[['B.', 'R.', 'Ruf'], ['T.', '', 'Szucs']]",Infection,2009,"[u'http://www.springerlink.com/index/880245655hpk7483.pdf', u'http://www.springerlink.com/content/880245655hpk7483', u'http://www.springerlink.com/index/10.1007/s15010-009-8241-1', u'http://www.springerlink.com/index/pdf/10.1007/s15010-009-8241-1']"
14206164Impact of Oseltamivir Treatment on Influenza-Related Lower Respiratory Tract Complications and Hospitalizations,cited-by,10.1016/j.clinthera.2007.10.001,Oseltamivir and the risk of influenza-related complications and hospitalizations in patients with diabetes,"[['Eric', 'A.', 'Orzeck'], ['Nianwen', '', 'Shi'], ['William', 'A.', 'Blumentals']]",Clinical Therapeutics,2007,"[u'http://www.sciencedirect.com/science/article/pii/S0149291807003165', u'http://linkinghub.elsevier.com/retrieve/pii/S0149291807003165']"
14206164Impact of Oseltamivir Treatment on Influenza-Related Lower Respiratory Tract Complications and Hospitalizations,cited-by,10.1136/bmj.39101.628715.80,Preparing for the next flu pandemic,"[['Wei', 'Shen', 'Lim'], ['Anne', '', 'Thomson'], ['Paul', '', 'Little']]",British Medical Journal,2007,"[u'http://www.bmj.com/cgi/doi/10.1136/bmj.39101.628715.80', u'http://dx.doi.org/10.1136/bmj.39101.628715.80']"
14206164Impact of Oseltamivir Treatment on Influenza-Related Lower Respiratory Tract Complications and Hospitalizations,cited-by,10.1136/bmj.b5351,Why don’t we have all the evidence on oseltamivir?,"[['Fiona', '', 'Godlee'], ['Mike', '', 'Clarke']]",British Medical Journal,2009,"[u'http://www.bmj.com/cgi/doi/10.1136/bmj.b5351', u'http://dx.doi.org/10.1136/bmj.b5351']"
14206164Impact of Oseltamivir Treatment on Influenza-Related Lower Respiratory Tract Complications and Hospitalizations,cited-by,10.1086/522192,Patient Knowledge and Attitudes about Antiviral Medication and Vaccination for Influenza in an Internal Medicine Clinic,"[['Robert', 'L.', 'Cook'], ['Kevin', 'L.', 'Kraemer'], ['Michael', 'B.', 'Rothberg']]",Clinical Infectious Diseases,2007,"[u'http://www2.medicine.wisc.edu/home/files/domfiles/infectiousdisease/influenza%20knowledge%20attitudes%20antivirals.pdf', u'http://www.journals.uchicago.edu/doi/abs/10.1086/522192']"
14206164Impact of Oseltamivir Treatment on Influenza-Related Lower Respiratory Tract Complications and Hospitalizations,cited-by,10.2147/copd.2007.2.1.55,Influenza infection and COPD,"[['Patrick', '', 'Mallia'], ['Sebastian', 'L', 'Johnston']]",International Journal of Copd,2007,[u'http://www.atypon-link.com/DMP/doi/abs/10.2147/copd.2007.2.1.55']
14206164Impact of Oseltamivir Treatment on Influenza-Related Lower Respiratory Tract Complications and Hospitalizations,cited-by,10.1183/09031936.06.00017406,Pandemic influenza: using evidence on vaccines and antivirals for clinical decisions and policy making,"[['A.', '', 'Granados'], ['C.', '', 'Goodman'], ['L.', '', 'Eklund']]",European Respiratory Journal,2006,"[u'http://erj.ersjournals.com/cgi/reprint/27/4/661.pdf', u'http://erj.ersjournals.com/cgi/doi/10.1183/09031936.06.00017406']"
14206164Impact of Oseltamivir Treatment on Influenza-Related Lower Respiratory Tract Complications and Hospitalizations,cited-by,10212496ASID/TSANZ guidelines: treatment and prevention of H1N1 influenza 09 (human swine influenza) with antiviral agents,ASID/TSANZ guidelines: treatment and prevention of H1N1 influenza 09 (human swine influenza) with antiviral agents,"[['Allen', 'C', 'Cheng'], ['Mike', '', 'Starr'], ['Tony', 'M', 'Korman'], ['Jim', 'P', 'Buttery'], ['Christine', 'R', 'Jenkins'], ['Vicki', 'L', 'Krause']]",,0,"[u'http://www.mja.com.au/public/rop/cheng/che10661_fm.pdf', u'https://www.mja.com.au/public/rop/cheng/che10661_fm.pdf']"
14206164Impact of Oseltamivir Treatment on Influenza-Related Lower Respiratory Tract Complications and Hospitalizations,cited-by,10.1159/000172796,The Influence of Oseltamivir Treatment on the Risk of Stroke after Influenza Infection,"[['Mohammad', '', 'Madjid'], ['Suellen', '', 'Curkendall'], ['William', 'A.', 'Blumentals']]",Cardiology,2009,"[u'http://content.karger.com/ProdukteDB/produkte.asp?doi=10.1159/000172796', u'http://www.karger.com/doi/10.1159/000172796']"
14206164Impact of Oseltamivir Treatment on Influenza-Related Lower Respiratory Tract Complications and Hospitalizations,cited-by,10.1016/j.epidem.2009.09.001,Intervention strategies for an influenza pandemic taking into account secondary bacterial infections,"[['Andreas', '', 'Handel'], ['Ira', 'M. Longini', 'Jr.'], ['Rustom', '', 'Antia']]",Epidemics,2009,"[u'http://www.sciencedirect.com/science/article/pii/S1755436509000413', u'http://linkinghub.elsevier.com/retrieve/pii/S1755436509000413']"
14206164Impact of Oseltamivir Treatment on Influenza-Related Lower Respiratory Tract Complications and Hospitalizations,cited-by,10.1136/bmj.b5364,Roche replies to the authors of the Cochrane Review on oseltamivir,"[['James', '', 'Smith']]",British Medical Journal,2009,"[u'http://dx.doi.org/10.1136/bmj.b5364', u'http://www.bmj.com/cgi/doi/10.1136/bmj.b5364']"
14206164Impact of Oseltamivir Treatment on Influenza-Related Lower Respiratory Tract Complications and Hospitalizations,cited-by,10.1016/j.emc.2008.02.004,Influenza and Pneumococcal Vaccinations in the Emergency Department,"[['Daniel', 'R.', 'Martin'], ['Mark', 'E.', 'Brauner'], ['Joseph', 'F.', 'Plouffe']]",Emergency Medicine Clinics of North America,2008,"[u'http://www.sciencedirect.com/science/article/pii/S0733862708000308', u'http://linkinghub.elsevier.com/retrieve/pii/S0733862708000308']"
14206164Impact of Oseltamivir Treatment on Influenza-Related Lower Respiratory Tract Complications and Hospitalizations,cited-by,10.1513/pats.200707-097TH,Pathogen-directed Therapy in Acute Exacerbations of Chronic Obstructive Pulmonary Disease,"[['Fernando', 'J.', 'Martinez']]",Proceedings of The American Thoracic Society,2007,"[u'http://pats.atsjournals.org/cgi/reprint/4/8/647.pdf', u'http://pats.atsjournals.org/cgi/doi/10.1513/pats.200707-097TH']"
14206164Impact of Oseltamivir Treatment on Influenza-Related Lower Respiratory Tract Complications and Hospitalizations,cited-by,10.1109/PICMET.1999.787858,The German Foresight Study '98 on the global development of science and technology,"[['Kerstin', '', 'Cuhls'], ['Knut', '', 'Blind']]",,1999,"[u'http://ieeexplore.ieee.org/xpls/abs_all.jsp?arnumber=787858', u'http://ieeexplore.ieee.org/stamp/stamp.jsp?arnumber=00787858']"
14206164Impact of Oseltamivir Treatment on Influenza-Related Lower Respiratory Tract Complications and Hospitalizations,cited-by,10.1186/1756-0500-4-4,Are there any differences in clinical and laboratory findings on admission between H1N1 positive and negative patients with flu-like symptoms?,"[['Paul', '', 'Zarogoulidis'], ['Theodoros', '', 'Constantinidis'], ['Paschalis', '', 'Steiropoulos'], ['Nikolaos', '', 'Papanas'], ['Kostas', '', 'Zarogoulidis'], ['Efstratios', '', 'Maltezos']]",BMC Research Notes,2011,"[u'http://www.biomedcentral.com/1756-0500/4/4', u'http://www.biomedcentral.com/content/pdf/1756-0500-4-4.pdf', u'http://www.springerlink.com/content/1863917496q2u265', u'http://www.springerlink.com/index/1863917496q2u265.pdf']"
14206164Impact of Oseltamivir Treatment on Influenza-Related Lower Respiratory Tract Complications and Hospitalizations,cited-by,5896567Cost effectiveness of oseltamivir treatment of infl uenza: a critique of published methods and outcomes,Cost effectiveness of oseltamivir treatment of infl uenza: a critique of published methods and outcomes,"[['Maarten', 'J', 'Postma'], ['Paul', '', 'Beardsworth'], ['Jan', 'C', 'Wilschut']]",,2008,[u'http://www.sff.fmns.rug.nl/downloads/2008/postma_2008.pdf']
14206164Impact of Oseltamivir Treatment on Influenza-Related Lower Respiratory Tract Complications and Hospitalizations,cited-by,10.1186/1471-2431-8-15,Do pediatricians manage influenza differently than internists?,"[['Michael', 'B', 'Rothberg'], ['Aleta', 'B', 'Bonner'], ['MH', '', 'Rajab'], ['Barbara', 'W', 'Stechenberg'], ['David', 'N', 'Rose']]",BMC Pediatrics,2008,"[u'http://www.biomedcentral.com/content/pdf/1471-2431-8-15.pdf', u'http://www.springerlink.com/content/35n5q5p7404xw304', u'http://www.springerlink.com/index/35n5q5p7404xw304.pdf', u'http://www.biomedcentral.com/1471-2431/8/15']"
14206164Impact of Oseltamivir Treatment on Influenza-Related Lower Respiratory Tract Complications and Hospitalizations,cited-by,10.1016/j.csm.2007.04.006,Prevention of Infectious Diseases in Athletes,"[['Anthony', '', 'Luke'], ['Pierre', '', ""d'Hemecourt""]]",Clinics in Sports Medicine,2007,"[u'http://www.sciencedirect.com/science/article/pii/S0278591907000221', u'http://linkinghub.elsevier.com/retrieve/pii/S0278591907000221']"
14206164Impact of Oseltamivir Treatment on Influenza-Related Lower Respiratory Tract Complications and Hospitalizations,cited-by,10.1016/j.ajic.2005.02.001,A 5-year experience with influenza prevention and containment in a program of all-inclusive care for elderly adults,"[['Norman', 'A.', 'Desbiens']]",American Journal of Infection Control,2005,"[u'http://www.sciencedirect.com/science/article/pii/S019665530500091X', u'http://linkinghub.elsevier.com/retrieve/pii/S019665530500091X']"
14206164Impact of Oseltamivir Treatment on Influenza-Related Lower Respiratory Tract Complications and Hospitalizations,cited-by,10.1016/j.medmal.2005.10.001,"Les inhibiteurs de la neuraminidase dans la grippe en médecine générale : qui prescrit, quand et avec quels résultats ?","[['J.', '', 'Gaillat'], ['M.', '', 'Pecking'], ['A.', 'El', 'Sawi'], ['G.', '', 'Grandmottet'], ['C.', '', 'Schlemmer'], ['M.-O.', '', 'Barbaza'], ['F.', '', 'Carrat']]",Medecine Et Maladies Infectieuses,2005,"[u'http://www.sciencedirect.com/science/article/pii/S0399077X05002271', u'http://linkinghub.elsevier.com/retrieve/pii/S0399077X05002271']"
14206164Impact of Oseltamivir Treatment on Influenza-Related Lower Respiratory Tract Complications and Hospitalizations,cited-by,10539163Demographic and Epidemiological Transitions in Asia: Towards a Comparative Study of National Health Policies in Responding to Emerging Infectious Diseases,Demographic and Epidemiological Transitions in Asia: Towards a Comparative Study of National Health Policies in Responding to Emerging Infectious Diseases,"[['PHUA', 'Kai', 'Hong'], ['Vernon', '', 'LEE']]",,0,"[u'http://www.spp.nus.edu.sg/Handler.ashx?path=Data/Site/SiteDocuments/wp/2006/wp06-05.pdf', u'http://www.lkyspp.nus.edu.sg/Handler.ashx?path=Data/Site/SiteDocuments/wp/2006/wp06-05.pdf', u'http://www.spp.nus.edu.sg/stag/Handler.ashx?path=Data/Site/SiteDocuments/wp/2006/wp06-05.pdf']"
14206164Impact of Oseltamivir Treatment on Influenza-Related Lower Respiratory Tract Complications and Hospitalizations,cited-by,10850280A Model-based Assessment of Oseltamivir Prophylaxis Strategies to Prevent Influenza in Nursing Homes,A Model-based Assessment of Oseltamivir Prophylaxis Strategies to Prevent Influenza in Nursing Homes,"[['Carline', 'van den', 'Dool'], ['Eelko', '', 'Hak'], ['Marc', 'J. M.', 'Bonten'], ['Jacco', '', 'Wallinga']]",,0,"[u'http://origin.cdc.gov/eid/content/15/10/pdfs/08-1129.pdf', u'http://www.cdc.gov/eid/content/15/10/pdfs/08-1129.pdf']"
14206164Impact of Oseltamivir Treatment on Influenza-Related Lower Respiratory Tract Complications and Hospitalizations,cited-by,10.1371/journal.pmed.1001201,The Imperative to Share Clinical Study Reports: Recommendations from the Tamiflu Experience,"[['Peter', '', 'Doshi'], ['Tom', '', 'Jefferson'], ['Chris', 'Del', 'Mar']]",PLOS Medicine,2012,[u'http://dx.doi.org/10.1371/journal.pmed.1001201']
