source,citation string,ID,title,authors,journal,year,fulltext online link,fulltext location
"13129215Prevention and Control of Influenza Recommendations of the Advisory Committee on Immunization Practices (ACIP), 2008",cited-by,10.1016/S1081-1206(10)60350-X,Adverse reactions to vaccines,"[['John', 'M.', 'Kelso'], ['James', 'T.', 'Li'], ['Richard', 'A.', 'Nicklas'], ['Joann', '', 'Blessing-Moore'], ['Linda', '', 'Cox'], ['David', 'M.', 'Lang'], ['John', '', 'Oppenheimer'], ['Jay', 'M.', 'Portnoy'], ['Christopher', '', 'Randolph'], ['Diane', 'E.', 'Schuller'], ['Sheldon', 'L.', 'Spector'], ['Stephen', '', 'Tilles'], ['Dana', '', 'Wallace'], ['Zuhair', 'K.', 'Ballas'], ['James', 'R.', 'Baker'], ['Joseph', 'A.', 'Bellanti'], ['Daniel', '', 'Ein'], ['Leslie', 'C.', 'Grammer']]",Annals of Allergy Asthma & Immunology,2009,"[u'http://www.sciencedirect.com/science/article/pii/S108112061060350X', u'http://linkinghub.elsevier.com/retrieve/pii/S108112061060350X']"
"13129215Prevention and Control of Influenza Recommendations of the Advisory Committee on Immunization Practices (ACIP), 2008",cited-by,10.1007/s00430-009-0108-7,Seroprevalence of influenza A and B in German infants and adolescents,"[['Andreas', '', 'Sauerbrei'], ['R.', '', 'Schmidt-Ott'], ['H.', '', 'Hoyer'], ['P.', '', 'Wutzler']]",Medical Microbiology and Immunology,2009,"[u'http://www.springerlink.com/index/q111g88615088512.pdf', u'http://www.springerlink.com/content/q111g88615088512', u'http://www.springerlink.com/index/10.1007/s00430-009-0108-7', u'http://www.springerlink.com/index/pdf/10.1007/s00430-009-0108-7']"
"13129215Prevention and Control of Influenza Recommendations of the Advisory Committee on Immunization Practices (ACIP), 2008",cited-by,10.1186/1471-2458-8-422,Influenza vaccination among healthcare workers in a multidisciplinary University hospital in Italy,"[['Susanna', '', 'Esposito'], ['Samantha', '', 'Bosis'], ['Claudio', '', 'Pelucchi'], ['Elena', '', 'Tremolati'], ['Caterina', '', 'Sabatini'], ['Margherita', '', 'Semino'], ['Paola', '', 'Marchisio'], ['Francesco', 'della', 'Croce'], ['Nicola', '', 'Principi']]",BMC Public Health,2008,"[u'http://www.springerlink.com/index/u54g0g5k351614u5.pdf', u'http://www.biomedcentral.com/1471-2458/8/422', u'http://www.biomedcentral.com/content/pdf/1471-2458-8-422.pdf', u'http://www.springerlink.com/content/u54g0g5k351614u5']"
"13129215Prevention and Control of Influenza Recommendations of the Advisory Committee on Immunization Practices (ACIP), 2008",cited-by,10.1016/j.ajic.2010.01.013,New interventions to increase influenza vaccination rates in health care workers,"[['Anna', '', 'Llupi\xc3\xa0'], ['Alberto', 'L.', 'Garc\xc3\xada-Basteiro'], ['Victoria', '', 'Oliv\xc3\xa9'], ['Laura', '', 'Costas'], ['Jose', '', 'R\xc3\xados'], ['Sebastiana', '', 'Quesada'], ['Pilar', '', 'Varela'], ['Jose', 'M.', 'Bayas'], ['Antoni', '', 'Trilla']]",American Journal of Infection Control,2010,"[u'http://www.sciencedirect.com/science/article/pii/S0196655310001793', u'http://linkinghub.elsevier.com/retrieve/pii/S0196655310001793']"
"13129215Prevention and Control of Influenza Recommendations of the Advisory Committee on Immunization Practices (ACIP), 2008",cited-by,10.1186/cc8183,Clinical review: Primary influenza viral pneumonia,"[['Jordi', '', 'Rello'], ['Aurora', '', 'Pop-Vicas']]",Critical Care,2009,"[u'http://www.springerlink.com/index/p2376780h56k6415.pdf', u'http://www.springerlink.com/content/p2376780h56k6415', u'http://ccforum.com/content/13/6/235']"
"13129215Prevention and Control of Influenza Recommendations of the Advisory Committee on Immunization Practices (ACIP), 2008",cited-by,10.1016/j.vaccine.2009.02.017,Influenza vaccination rates in Ontario children: Implications for universal childhood vaccination policy,"[['Kathy', '', 'Moran'], ['Sarah', '', 'Maaten'], ['Astrid', '', 'Guttmann'], ['David', '', 'Northrup'], ['Jeffrey', 'C.', 'Kwong']]",Vaccine,2009,"[u'http://www.sciencedirect.com/science/article/pii/S0264410X09002333', u'http://linkinghub.elsevier.com/retrieve/pii/S0264410X09002333']"
"13129215Prevention and Control of Influenza Recommendations of the Advisory Committee on Immunization Practices (ACIP), 2008",cited-by,10.1016/j.vaccine.2009.02.039,Evidence of effectiveness from a large county-wide school-based influenza immunization campaign,"[['Carlos', 'G.', 'Grijalva'], ['Yuwei', '', 'Zhu'], ['Marie', 'R.', 'Griffin']]",Vaccine,2009,"[u'http://www.sciencedirect.com/science/article/pii/S0264410X09002904', u'http://linkinghub.elsevier.com/retrieve/pii/S0264410X09002904']"
"13129215Prevention and Control of Influenza Recommendations of the Advisory Committee on Immunization Practices (ACIP), 2008",cited-by,10.3201/eid1302.061052,No Evidence of Avian Influenza A H5N1 among Returning US Travelers,"[['Justin', 'R.', 'Ortiz'], ['Teresa', 'R.', 'Wallis'], ['Mark', 'A.', 'Katz'], ['LaShondra', 'S.', 'Berman'], ['Amanda', '', 'Balish'], ['Stephen', 'E.', 'Lindstrom'], ['Vic', '', 'Veguilla'], ['Kathryn', 'S.', 'Teates'], ['Jacqueline', 'M.', 'Katz'], ['Alexander', '', 'Klimov'], ['Timothy', 'M.', 'Uyeki']]",Emerging Infectious Diseases,2007,"[u'http://www.cdc.gov/eid/content/13/2/pdfs/294.pdf', u'http://origin.cdc.gov/eid/content/13/2/pdfs/294.pdf', u'http://www.cdc.gov/eid/content/13/2/294.htm']"
"13129215Prevention and Control of Influenza Recommendations of the Advisory Committee on Immunization Practices (ACIP), 2008",cited-by,10.1007/s10067-010-1373-y,Anti-influenza vaccination in systemic lupus erythematosus patients: an analysis of specific humoral response and vaccination safety,"[['Ewa', '', 'Wi\xc4\x99sik-Szewczyk'], ['Magdalena', '', 'Romanowska'], ['Pawe\xc5\x82', '', 'Mielnik'], ['Hanna', '', 'Chwali\xc5\x84ska-Sadowska'], ['Lidia', 'B.', 'Brydak'], ['Marzena', '', 'Olesi\xc5\x84ska'], ['Jakub', '', 'Z\xc4\x85bek']]",Clinical Rheumatology,2010,"[u'http://www.springerlink.com/content/m72859492206w765', u'http://www.springerlink.com/index/m72859492206w765.pdf', u'http://www.springerlink.com/index/10.1007/s10067-010-1373-y', u'http://www.springerlink.com/index/pdf/10.1007/s10067-010-1373-y']"
"13129215Prevention and Control of Influenza Recommendations of the Advisory Committee on Immunization Practices (ACIP), 2008",cited-by,10.1128/JVI.02233-07,Hydrophobic Inactivation of Influenza Viruses Confers Preservation of Viral Structure with Enhanced Immunogenicity,"[['Yossef', '', 'Raviv'], ['Robert', '', 'Blumenthal'], ['S.', 'Mark', 'Tompkins'], ['Jennifer', '', 'Humberd'], ['Robert', 'J.', 'Hogan'], ['Mathias', '', 'Viard']]",Journal of Virology,2008,"[u'http://jvi.asm.org/cgi/reprint/82/9/4612.pdf', u'http://jvi.asm.org/cgi/doi/10.1128/JVI.02233-07']"
"13129215Prevention and Control of Influenza Recommendations of the Advisory Committee on Immunization Practices (ACIP), 2008",cited-by,10.1007/s11524-007-9197-z,Strategies for Improving Influenza Immunization Rates among Hard-to-Reach Populations,"[['David', '', 'Vlahov'], ['Micaela', 'H.', 'Coady'], ['Danielle', 'C.', 'Ompad'], ['Sandro', '', 'Galea']]",Journal of Urban Health-bulletin of The New York Academy of Medicine,2007,"[u'http://deepblue.lib.umich.edu/bitstream/2027.42/55425/1/vlahov_strategies%20for%20improving%20influenza%20vaccination_2007.pdf', u'http://www.springerlink.com/index/w13441302uvpu4n0.pdf', u'http://www.springerlink.com/content/w13441302uvpu4n0', u'http://www.springerlink.com/index/10.1007/s11524-007-9197-z', u'http://www.springerlink.com/index/pdf/10.1007/s11524-007-9197-z']"
"13129215Prevention and Control of Influenza Recommendations of the Advisory Committee on Immunization Practices (ACIP), 2008",cited-by,10.1186/1472-6963-7-66,"Influenza vaccine supply, 2005–2006: did we come up short?","[['Barbara', 'H', 'Bardenheier'], ['Raymond', '', 'Strikas'], ['Allison', '', 'Kempe'], ['Shannon', '', 'Stokley'], ['Jean', '', 'Ellis']]",BMC Health Services Research,2007,"[u'http://www.biomedcentral.com/content/pdf/1472-6963-7-66.pdf', u'http://www.biomedcentral.com/1472-6963/7/66', u'http://www.springerlink.com/content/dg95218185l1m7lg', u'http://www.springerlink.com/index/dg95218185l1m7lg.pdf']"
"13129215Prevention and Control of Influenza Recommendations of the Advisory Committee on Immunization Practices (ACIP), 2008",cited-by,10.1186/1471-2318-4-4,"Comprehensive Geriatric Assessment (CGA) in general practice: Results from a pilot study in Vorarlberg, Austria","[['Eva', '', 'Mann'], ['Michael', '', 'Koller'], ['Christian', '', 'Mann'], ['Tischa', 'van der', 'Cammen'], ['Johann', '', 'Steurer']]",BMC Geriatrics,2004,"[u'http://www.biomedcentral.com/1471-2318/4/4', u'http://www.biomedcentral.com/content/pdf/1471-2318-4-4.pdf', u'http://www.springerlink.com/index/2001451175n0k665.pdf', u'http://www.springerlink.com/content/2001451175n0k665']"
"13129215Prevention and Control of Influenza Recommendations of the Advisory Committee on Immunization Practices (ACIP), 2008",cited-by,11910349Compliance With the Recommendations for 2 Doses of Trivalent Inactivated Influenza Vaccine in Children Less Than 9 Years of Age Receiving Influenza Vaccine for the First Time: A Vaccine Safety Datalink Study,Compliance With the Recommendations for 2 Doses of Trivalent Inactivated Influenza Vaccine in Children Less Than 9 Years of Age Receiving Influenza Vaccine for the First Time: A Vaccine Safety Datalink Study,"[['Lisa', 'A.', 'Jackson'], ['Kathleen', 'M.', 'Neuzil'], ['James', '', 'Baggs'], ['Robert', 'L.', 'Davis'], ['Kristi', 'M.', 'Yamasaki'], ['Ed', '', 'Belongia'], ['Kenneth', 'M.', 'Zangwill'], ['John', '', 'Mullooly'], ['James', '', 'Nordin'], ['S.', 'Michael', 'Marcy'], ['Frank', '', 'DeStefano']]",,0,[u'http://pediatrics.aappublications.org/cgi/reprint/118/5/2032.pdf']
"13129215Prevention and Control of Influenza Recommendations of the Advisory Committee on Immunization Practices (ACIP), 2008",cited-by,10.1016/j.vaccine.2010.08.027,Seasonal influenza and vaccination coverage,"[['Arnold', 'S.', 'Monto']]",Vaccine,2010,"[u'http://www.sciencedirect.com/science/article/pii/S0264410X10011369', u'http://linkinghub.elsevier.com/retrieve/pii/S0264410X10011369']"
"13129215Prevention and Control of Influenza Recommendations of the Advisory Committee on Immunization Practices (ACIP), 2008",cited-by,10.1016/S1473-3099(09)70263-4,Yearly influenza vaccinations: a double-edged sword?,"[['Rogier', 'Bodewes', 'DVM'], ['Joost', 'HCM', 'Kreijtz']]",Lancet Infectious Diseases,2009,"[u'http://www.thinktwice.com/lancet.pdf', u'http://www.sciencedirect.com/science/article/pii/S1473309909702634', u'http://download.thelancet.com/flatcontentassets/H1N1-flu/vaccination/vaccination-78.pdf', u'http://linkinghub.elsevier.com/retrieve/pii/S1473309909702634']"
"13129215Prevention and Control of Influenza Recommendations of the Advisory Committee on Immunization Practices (ACIP), 2008",cited-by,10.1128/JCM.01993-08,"Influenza Antiviral Resistance Testing in New York and Wisconsin, 2006 to 2008: Methodology and Surveillance Data","[['Jennifer', 'M.', 'Laplante'], ['Steven', 'A.', 'Marshall'], ['Matthew', '', 'Shudt'], ['Tam', 'T.', 'Van'], ['Erik', 'S.', 'Reisdorf'], ['Lisa', 'A.', 'Mingle'], ['Peter', 'A.', 'Shult'], ['K.', 'St.', 'George']]",Journal of Clinical Microbiology,2009,"[u'http://jcm.asm.org/cgi/doi/10.1128/JCM.01993-08', u'http://jcm.asm.org/cgi/reprint/47/5/1372.pdf']"
"13129215Prevention and Control of Influenza Recommendations of the Advisory Committee on Immunization Practices (ACIP), 2008",cited-by,10.1186/1477-7525-7-21,Development and psychometric validation of a self-administered questionnaire assessing the acceptance of influenza vaccination: the Vaccinees' Perception of Injection (VAPI©) questionnaire,"[['Catherine', '', 'Chevat'], ['Muriel', '', 'Viala-Danten'], ['Carla', '', 'Dias-Barbosa'], ['Van', 'Hung', 'Nguyen']]",Health and Quality of Life Outcomes,2009,"[u'http://www.biomedcentral.com/content/pdf/1477-7525-7-21.pdf', u'http://www.springerlink.com/index/000t64325r28744j.pdf', u'http://www.hqlo.com/content/7/1/21', u'http://www.springerlink.com/content/000t64325r28744j']"
"13129215Prevention and Control of Influenza Recommendations of the Advisory Committee on Immunization Practices (ACIP), 2008",cited-by,10.1016/j.antiviral.2009.09.005,Immunization by influenza virus-like particles protects aged mice against lethal influenza virus challenge,"[['Zhiyuan', '', 'Wen'], ['Ling', '', 'Ye'], ['Yulong', '', 'Gao'], ['Lei', '', 'Pan'], ['Ke', '', 'Dong'], ['Zhigao', '', 'Bu'], ['Richard', 'W.', 'Compans'], ['Chinglai', '', 'Yang']]",Antiviral Research,2009,"[u'http://www.sciencedirect.com/science/article/pii/S0166354209004586', u'http://linkinghub.elsevier.com/retrieve/pii/S0166354209004586']"
"13129215Prevention and Control of Influenza Recommendations of the Advisory Committee on Immunization Practices (ACIP), 2008",cited-by,10.1007/978-3-540-72608-1_5,Population Dynamics in the Elderly: The Need for Age-Adjustment in National BioSurveillance Systems,"[['Steven', 'A.', 'Cohen'], ['Elena', 'N.', 'Naumova']]",,2007,"[u'http://www.springerlink.com/content/n23617183x2u86w0', u'http://www.springerlink.com/index/n23617183x2u86w0.pdf', u'http://www.informatik.uni-trier.de/~ley/db/conf/biosurveillance/biosurveillance2007.html#CohenN07', u'http://dx.doi.org/10.1007/978-3-540-72608-1_5']"
"13129215Prevention and Control of Influenza Recommendations of the Advisory Committee on Immunization Practices (ACIP), 2008",cited-by,10.1186/1750-9378-2-20,Possible stimulation of anti-tumor immunity using repeated cold stress: a hypothesis,"[['Nikolai', 'A', 'Shevchuk'], ['Sasa', '', 'Radoja']]",Infectious Agents and Cancer,2007,"[u'http://www.biomedcentral.com/content/pdf/1750-9378-2-20.pdf', u'http://www.infectagentscancer.com/content/2/1/20', u'http://www.springerlink.com/content/c5382xj8n7846355', u'http://www.springerlink.com/index/c5382xj8n7846355.pdf']"
"13129215Prevention and Control of Influenza Recommendations of the Advisory Committee on Immunization Practices (ACIP), 2008",cited-by,10.1038/sj.jp.7211625,Influenza in the neonatal intensive care unit,"[['D', 'J', 'Wilkinson'], ['J', 'P', 'Buttery'], ['C', 'C', 'Andersen']]",Journal of Perinatology,2006,"[u'http://dx.doi.org/10.1038/sj.jp.7211625', u'http://www.nature.com/doifinder/10.1038/sj.jp.7211625']"
"13129215Prevention and Control of Influenza Recommendations of the Advisory Committee on Immunization Practices (ACIP), 2008",cited-by,10.1186/1471-2334-10-134,Evaluation of non-inferiority of intradermal versus adjuvanted seasonal influenza vaccine using two serological techniques: a randomised comparative study,"[['Pierre', 'Van', 'Damme'], ['Robert', '', 'Arnou'], ['Froukje', '', 'Kafeja'], ['Anne', '', 'Fiquet'], ['Patrick', '', 'Richard'], ['St\xc3\xa9phane', '', 'Thomas'], ['Gilles', '', 'Meghlaoui'], ['Sandrine', 'Isabelle', 'Samson'], ['Emilio', '', 'Ledesma']]",BMC Infectious Diseases,2010,"[u'http://www.springerlink.com/index/6n3jj4113w268u70.pdf', u'http://www.springerlink.com/content/6n3jj4113w268u70', u'http://www.biomedcentral.com/1471-2334/10/134', u'http://www.biomedcentral.com/content/pdf/1471-2334-10-134.pdf']"
"13129215Prevention and Control of Influenza Recommendations of the Advisory Committee on Immunization Practices (ACIP), 2008",cited-by,10.1038/oby.2010.40,Obesity and Receipt of Clinical Preventive Services in Veterans,"[['William', 'S.', 'Yancy'], ['Jennifer', 'R.', 'McDuffie'], ['Karen', 'M.', 'Stechuchak'], ['Maren', 'K.', 'Olsen'], ['Eugene', 'Z.', 'Oddone'], ['Linda', 'S.', 'Kinsinger'], ['Santanu', 'K.', 'Datta'], ['Deborah', 'A.', 'Fisher'], ['Katrina', 'M.', 'Krause'], ['Truls', '', '\xc3\xb8stbye']]",Obesity,2010,"[u'http://dx.doi.org/10.1038/oby.2010.40', u'http://www.nature.com/doifinder/10.1038/oby.2010.40']"
"13129215Prevention and Control of Influenza Recommendations of the Advisory Committee on Immunization Practices (ACIP), 2008",cited-by,10.1186/1743-422X-7-102,5'PPP-RNA induced RIG-I activation inhibits drug-resistant avian H5N1 as well as 1918 and 2009 pandemic influenza virus replication,"[['Priya', '', 'Ranjan'], ['Lakshmi', '', 'Jayashankar'], ['Varough', '', 'Deyde'], ['Hui', '', 'Zeng'], ['William', 'G', 'Davis'], ['Melissa', 'B', 'Pearce'], ['John', 'B', 'Bowzard'], ['Mary', 'A', 'Hoelscher'], ['Victoria', '', 'Jeisy-Scott'], ['Mayim', 'E', 'Wiens'], ['Shivaprakash', '', 'Gangappa'], ['Larisa', '', 'Gubareva'], ['Adolfo', '', 'Garc\xc3\xada-Sastre'], ['Jacqueline', 'M', 'Katz'], ['Terrence', 'M', 'Tumpey'], ['Takashi', '', 'Fujita'], ['Suryaprakash', '', 'Sambhara']]",Virology Journal,2010,"[u'http://www.virologyj.com/content/7/1/102', u'http://www.springerlink.com/index/5x631562g4237729.pdf', u'http://www.biomedcentral.com/content/pdf/1743-422X-7-102.pdf', u'http://www.springerlink.com/content/5x631562g4237729']"
"13129215Prevention and Control of Influenza Recommendations of the Advisory Committee on Immunization Practices (ACIP), 2008",cited-by,10.1016/j.vaccine.2009.09.041,Kinetics of viral shedding and immune responses in adults following administration of cold-adapted influenza vaccine,"[['Laura', 'L.', 'Hammitt'], ['Julie', 'Patterson', 'Bartlett'], ['Shaobing', '', 'Li'], ['Jeremy', '', 'Rahkola'], ['Nancy', '', 'Lang'], ['Edward', 'N.', 'Janoff'], ['Myron', 'J.', 'Levin'], ['Adriana', '', 'Weinberg']]",Vaccine,2009,"[u'http://www.sciencedirect.com/science/article/pii/S0264410X09013759', u'http://www.ucdenver.edu/academics/colleges/medicine/research/mavrc/documents/hammitt%20ll_vaccine%202009_kinetics%20of%20viral%20shedding.pdf', u'http://linkinghub.elsevier.com/retrieve/pii/S0264410X09013759']"
"13129215Prevention and Control of Influenza Recommendations of the Advisory Committee on Immunization Practices (ACIP), 2008",cited-by,10.1007/s11606-009-1126-2,Do People Who Intend to Get a Flu Shot Actually Get One?,"[['Katherine', 'M.', 'Harris'], ['J\xc3\xbcrgen', '', 'Maurer'], ['Nicole', '', 'Lurie']]",Journal of General Internal Medicine,2009,"[u'http://www.springerlink.com/content/g715x9581844161m', u'http://www.springerlink.com/index/g715x9581844161m.pdf', u'http://www.springerlink.com/index/10.1007/s11606-009-1126-2', u'http://www.springerlink.com/index/pdf/10.1007/s11606-009-1126-2']"
"13129215Prevention and Control of Influenza Recommendations of the Advisory Committee on Immunization Practices (ACIP), 2008",cited-by,10.1016/j.jhin.2009.07.028,Co-ordinated approach to healthcare worker influenza vaccination in an area health service,"[['T.', '', 'Ballestas'], ['S.', 'P.', 'McEvoy'], ['J.', '', 'Doyle']]",Journal of Hospital Infection,2009,"[u'http://www.sciencedirect.com/science/article/pii/S0195670109003442', u'http://linkinghub.elsevier.com/retrieve/pii/S0195670109003442']"
"13129215Prevention and Control of Influenza Recommendations of the Advisory Committee on Immunization Practices (ACIP), 2008",cited-by,10.1007/s00705-009-0352-6,Expression of mouse beta-defensin-3 in MDCK cells and its anti-influenza-virus activity,"[['Yan', '', 'Jiang'], ['Yueling', '', 'Wang'], ['Yu', '', 'Kuang'], ['Baoning', '', 'Wang'], ['Wanyi', '', 'Li'], ['Tianxiang', '', 'Gong'], ['Zhonghua', '', 'Jiang'], ['De', '', 'Yang'], ['Mingyuan', '', 'Li']]",Archives of Virology,2009,"[u'http://www.springerlink.com/content/np1228h0855rg7u3', u'http://www.springerlink.com/index/np1228h0855rg7u3.pdf', u'http://www.springerlink.com/index/10.1007/s00705-009-0352-6', u'http://www.springerlink.com/index/pdf/10.1007/s00705-009-0352-6']"
"13129215Prevention and Control of Influenza Recommendations of the Advisory Committee on Immunization Practices (ACIP), 2008",cited-by,14258683Project VIVA: A Multilevel Community-Based Intervention to Increase Influenza Vaccination Rates Among Hard-to-Reach Populations in New York City,Project VIVA: A Multilevel Community-Based Intervention to Increase Influenza Vaccination Rates Among Hard-to-Reach Populations in New York City,"[['Micaela', 'H.', 'Coady'], ['Sandro', '', 'Galea'], ['Danielle', 'C.', 'Ompad'], ['Sarah', '', 'Sisco'], ['David', '', 'Vlahov']]",,2008,[u'http://www.dialogue4health.org/webforums/PDFs_11_23_09/COADY_et_al.pdf']
"13129215Prevention and Control of Influenza Recommendations of the Advisory Committee on Immunization Practices (ACIP), 2008",cited-by,"6128517Influenza Antiviral Resistance Testing in New York and Wisconsin, 2006 to 2008: Methodology and Surveillance Data","Influenza Antiviral Resistance Testing in New York and Wisconsin, 2006 to 2008: Methodology and Surveillance Data","[['Jennifer', 'M.', 'Laplante'], ['Steven', 'A.', 'Marshall'], ['Matthew', '', 'Shudt'], ['Tam', 'T.', 'Van'], ['Erik', 'S.', 'Reisdorf'], ['Lisa', 'A.', 'Mingle'], ['Peter', 'A.', 'Shult']]",,0,[u'http://jcm.asm.org/cgi/reprint/47/5/1372.pdf']
"13129215Prevention and Control of Influenza Recommendations of the Advisory Committee on Immunization Practices (ACIP), 2008",cited-by,10212496ASID/TSANZ guidelines: treatment and prevention of H1N1 influenza 09 (human swine influenza) with antiviral agents,ASID/TSANZ guidelines: treatment and prevention of H1N1 influenza 09 (human swine influenza) with antiviral agents,"[['Allen', 'C', 'Cheng'], ['Mike', '', 'Starr'], ['Tony', 'M', 'Korman'], ['Jim', 'P', 'Buttery'], ['Christine', 'R', 'Jenkins'], ['Vicki', 'L', 'Krause']]",,0,"[u'http://www.mja.com.au/public/rop/cheng/che10661_fm.pdf', u'https://www.mja.com.au/public/rop/cheng/che10661_fm.pdf']"
"13129215Prevention and Control of Influenza Recommendations of the Advisory Committee on Immunization Practices (ACIP), 2008",cited-by,10.3201/eid1602.091375,"Statewide School-located Influenza Vaccination Program for Children 5–13 Years of Age, Hawaii, USA","[['Paul', 'V.', 'Effler'], ['Carl', '', 'Chu'], ['Howard', '', 'He'], ['Kate', '', 'Gaynor'], ['Steve', '', 'Sakamoto'], ['Marcia', '', 'Nagao'], ['Lisa', '', 'Mendez'], ['Sarah', 'Y.', 'Park']]",Emerging Infectious Diseases,2010,"[u'http://www.cdc.gov/eid/content/16/2/pdfs/09-1375.pdf', u'http://origin.cdc.gov/eid/content/16/2/pdfs/09-1375.pdf', u'http://www.cdc.gov/eid/content/16/2/244.htm']"
"13129215Prevention and Control of Influenza Recommendations of the Advisory Committee on Immunization Practices (ACIP), 2008",cited-by,13526070Rapid and Specific Detection of Amantadine-Resistant Influenza A Viruses with a Ser31Asn Mutation by the Cycling Probe Method,Rapid and Specific Detection of Amantadine-Resistant Influenza A Viruses with a Ser31Asn Mutation by the Cycling Probe Method,"[['Yasushi', '', 'Suzuki'], ['Reiko', '', 'Saito'], ['Hassan', '', 'Zaraket'], ['Clyde', '', 'Dapat'], ['Isolde', '', 'Caperig-Dapat'], ['Hiroshi', '', 'Suzuki']]",,2010,[u'http://jcm.highwire.org/cgi/reprint/48/1/57.pdf']
"13129215Prevention and Control of Influenza Recommendations of the Advisory Committee on Immunization Practices (ACIP), 2008",cited-by,14209671Pandemic (H1N1) 2009 influenza vaccination coverage in Western Australia,Pandemic (H1N1) 2009 influenza vaccination coverage in Western Australia,"[['Donna', 'B', 'Mak'], ['Alison', 'M', 'Daly'], ['Paul', 'K', 'Armstrong'], ['Paul', 'V', 'Effler']]",,2010,"[u'http://www.mja.com.au/public/issues/193_07_041010/mak10281_fm.pdf', u'http://researchonline.nd.edu.au/med_article/294', u'http://www.mja.com.au/public/issues/193_07_041010/contents_041010.html']"
"13129215Prevention and Control of Influenza Recommendations of the Advisory Committee on Immunization Practices (ACIP), 2008",cited-by,10.1186/ar3011,Provision of preventive health care in systemic lupus erythematosus: data from a large observational cohort study,"[['Jinoos', '', 'Yazdany'], ['Chris', '', 'Tonner'], ['Laura', '', 'Trupin'], ['Pantelis', '', 'Panopalis'], ['Joann', 'Z', 'Gillis'], ['Aimee', 'O', 'Hersh'], ['Laura', 'J', 'Julian'], ['Patricia', 'P', 'Katz'], ['Lindsey', 'A', 'Criswell'], ['Edward', 'H', 'Yelin']]",Arthritis Research & Therapy,2010,"[u'http://www.springerlink.com/content/b6h5855410720387', u'http://www.springerlink.com/index/b6h5855410720387.pdf', u'http://arthritis-research.com/content/12/3/124', u'http://www.biomedcentral.com/content/pdf/ar3011.pdf', u'http://arthritis-research.com/content/12/3/R84']"
"13129215Prevention and Control of Influenza Recommendations of the Advisory Committee on Immunization Practices (ACIP), 2008",cited-by,10.1016/j.ijporl.2010.03.024,Impact of oseltamivir treatment on the incidence and course of acute otitis media in children with influenza,"[['Birgit', '', 'Winther'], ['Stan', 'L.', 'Block'], ['Keith', '', 'Reisinger'], ['Regina', '', 'Dutkowski']]",International Journal of Pediatric Otorhinolaryngology,2010,"[u'http://www.sciencedirect.com/science/article/pii/S0165587610001199', u'http://linkinghub.elsevier.com/retrieve/pii/S0165587610001199']"
"13129215Prevention and Control of Influenza Recommendations of the Advisory Committee on Immunization Practices (ACIP), 2008",cited-by,10.1016/j.vaccine.2009.11.055,Impact of influenza-like illness and effectiveness of influenza vaccination in oncohematological children who have completed cancer therapy,"[['Susanna', '', 'Esposito'], ['Valerio', '', 'Cecinati'], ['Barbara', '', 'Scicchitano'], ['Giovanni', 'Carlo', 'Delvecchio'], ['Nicola', '', 'Santoro'], ['Doriana', '', 'Amato'], ['Claudio', '', 'Pelucchi'], ['Momcilo', '', 'Jankovic'], ['Domenico', 'De', 'Mattia'], ['Nicola', '', 'Principi']]",Vaccine,2010,"[u'http://www.sciencedirect.com/science/article/pii/S0264410X09018581', u'http://linkinghub.elsevier.com/retrieve/pii/S0264410X09018581']"
